p_id,p_name,p_categories,p_id_shop,p_shop_name,p_brand,p_day_created,p_sold_quantity,p_original_price,p_current_price,p_discount_rate
25144488,TỦ TREO QUẦN ÁO ĐÔI 5 TẦNG GỖ THÔNG 97x150 cm,Tủ,179883.0,Cây Thông Xinh,OEM,1250.0,84,480000,480000,0
31473727,Combo 100 Túi Lọc Trà Có Dây Rút,Nhà Cửa - Đời Sống,19256.0,Công ty TNHH LPS VINA,OEM,1216.0,307,28500,28500,0
95043563,Khăn tắm sợi tre Bamboo Life hàng chính hãng Khăn lau người mềm mại kháng khuẩn siêu thấm hút an toàn cho da ngay cả với trẻ sơ sinh BL046,Khăn,152044.0,Bamboo Life Official Store,Bamboo Life,605.0,1960,65000,57600,11
34171666,0.5 kg túi zip chỉ đỏ lựa chọn size,Nhà Cửa - Đời Sống,266755.0,Tạp hóa Vân An,OEM,1197.0,152,39000,39000,0
67811819,"Đèn LED Cảm Biến Chuyển Động Nhiều Kích Cỡ, Cảm Ứng Hồng Ngoại 3 Chế Độ",Nhà Cửa - Đời Sống,97441.0,Luckky Shop,OEM,839.0,21,196000,196000,0
43880302,"Kệ chữ nhật phòng tắm Inox 304 HOBBY Home Decor KCN1 dán tường gạch men, kính - có sẵn keo dán siêu dính và đinh ốc - không rỉ sét",Kệ nhà tắm,20023.0,Hobby Home Decor,Hobby Home Decor,1126.0,848,249000,162000,35
124392263,Bộ Thái Rau Củ Đa Năng ECOCO - Hàng Chính Hãng,Dụng cụ Cắt-Gọt-Bào,107147.0,Nonostyle Official Store,Ecoco,464.0,333,350000,169000,52
89054016,ÁO MƯA BỘ THÀNH LONG VẢI DÙ 2 LỚP CAO CẤP,Áo mưa,282800.0,KEN SHOPP,OEM,639.0,1,184000,184000,0
68908587,"Chân Đế Đỡ Chậu Hoa, Cây Kiểng Thuận Tiện Di Chuyển ",Kệ trang trí cây,94442.0,Xanh Garden,OEM,820.0,3680,35000,35000,0
5981431,Bình Ngâm Rượu Thủy Tinh Hoa Văn Rồng (Có Van),Bình đựng nước,72116.0,MimiShoping,OEM,1540.0,509,187000,187000,0
109739684,GA GIƯỜNG THUN LẠNH MÀU TRƠN (bộ),Bộ ga,190446.0,Tiệm Blue,OEM,551.0,83,150000,150000,0
212986033,"Đồng hồ bấm giờ đếm ngược điện tử mini, đồng hồ điện tử đa năng",Nhà Cửa - Đời Sống,134154.0,Funu Home,OEM,9.0,462,65000,63000,3
68716601,Dao Gọt Hoa Quả Sunhouse KS-KN100PS,Dao các loại,182530.0,GIADUNG TẤN PHÁT,Sunhouse,825.0,2,37000,37000,0
38302207,TÚI 1 KG- PHÂN LÂN ĐƠN - CUNG CẤP NHANH LƯỢNG LỚN P2O5 CHO CÂY TRỒNG - BỔ SUNG THÊM CANXI VÀ LƯU HUỲNH - KÍCH THÍCH RA HOA - RA RỄ,Phân bón,18516.0,Nông Nghiệp Phố,OEM,1162.0,1140,8000,7800,3
58311830,Hạt giống Hoa Mười giờ Mỹ kép - Mix nảy mầm cao,Hạt giống,92052.0,Phú Thành Phát,Titapha,895.0,2886,18000,12900,28
86376338,Đèn ngủ Oval cắm điện 10 cấp độ sáng có remote - đèn ngủ thông minh - hẹn giờ - 2 cổng USB sạc nhanh mới 2021,Đèn ngủ,97441.0,Luckky Shop,OEM,641.0,165,99000,99000,0
48094891,"Combo 2 Túi bọc quần áo chống bụi bẩn, nấm mốc có khóa kéo tiện dụng size S/M/L giúp bảo vệ quần áo luôn sạch sẽ",Phụ kiện giặt ủi khác,17480.0,Ghế Nam Việt,OEM,1017.0,158,55000,55000,0
14448546,Bình Gas Bơm Bật Lửa BlueSky,Than,67417.0,Shop AZ,OEM,1353.0,2,85000,85000,0
1918931,Keo Dán Đa Năng Selleys Epoxy Fix (10ml / Tuýp),Khác,1028.0,TAVANA,Selleys,1727.0,690,39000,35400,9
72646042,Combo 10 cặp nút tai chống ồn cao cấp Honeywell Max 1,Nhà Cửa - Đời Sống,935.0,Bảo Hộ Lao Động Achison,Honeywell,784.0,722,48000,48000,0
195901387,Bao Trống Cajon thương hiệu CORO VIETNAM - Chống thấm cao cấp,Trống & Phụ kiện,301534.0,Coro Percussion,CORO,120.0,42,495000,495000,0
103822707,Hạt giống Cà chua đỏ quả to F1 - Nảy mầm cao Titapha,Hạt giống,92052.0,Phú Thành Phát,Titapha,576.0,366,13900,13900,0
108652829,Xẻng lật và vá inox 304 Sa Maison,Phụ kiện nhà bếp khác,64171.0,Sa Maison,Sa Maison,558.0,181,99000,59400,40
160705822,Kim Nguyên Bảo - Thỏi vàng phong thủy Thần Tài May Mắn KAI_ Hàng Chính Hãng,Vật phẩm phong thủy khác,158862.0,Art H Store,OEM,342.0,133,4000,4000,0
203883187,Bọc Tay Nắm Cửa Silicon Chống Va Đập Hiệu Qủa,Khác,290838.0,BiBonStore,OEM,64.0,89,9500,9500,0
135810827,Tạp Dề Chống Thấm Nước 2 lớp nhiều màu,Phụ kiện nhà bếp khác,146279.0,Tạp Dề Đồng Phục Xanh,OEM,431.0,247,50000,50000,0
37266689,Hạt Giống Rau Muống Thái Lan,Nhà Cửa - Đời Sống,42056.0,KoyShop,OEM,1170.0,1960,6895,6895,0
191911126,"Kệ giày thông minh, tủ giày gỗ đa năng 4 tầng cánh tủ trắng, hai bên kèm kệ phong cách hiện đại 78x30x78 TAGO ND22",Kệ & Tủ,135751.0,Home decoration,OEM,167.0,19,279000,264800,5
21101765,Bàn Học Bàn Làm Việc Kết Hợp Kệ Sách Thương Hiệu IGEA,Nhà Cửa - Đời Sống,48574.0,IGEA Nội Thất Thông Minh,IGA,1287.0,8081,615000,586000,5
189373783,"Máy Rửa Xe Mini Deli Công Suất Lớn - Tiết Kiệm Điện Năng, Phun Rửa Đa Năng - DL882201",Nhà Cửa - Đời Sống,236924.0,Deli tools Store,Deli,187.0,80,2399000,1289000,46
141201958,Ly Giữ Nhiệt Cà Phê Có Tay Cầm Nắp Trượt Chống Tràn Rinfere (415ml),Ly,28034.0,Rinfere Official,Rinfere,413.0,256,449000,290000,35
24437529,Thảm Lông Loang Màu Xám Nhạt Trải Sàn Trang Trí 1m6x2m,Trang trí nhà cửa khác,34982.0,Nhaxinh decor,Bảo Anh,1255.0,1058,299000,284200,5
107534596,Đèn Rèm Mành 6M 8M 16M Mưa Led Rủ Mành Đèn Led Thả Mành Trang Trí Ngoài Trời Trang Trí Sự Kiện Nhà Cửa Sảnh Quán Cafe,Đèn khác,246985.0,PHƯƠNG ĐÔNG TPHCM,OEM,562.0,125,98000,98000,0
177456220,Dụng Cụ Bánh Xe Nâng Đỡ -Di Chuyển Vật Nặng Đa Nâng,Xe đẩy hàng,221038.0,Shop Gia Dụng Tiện Lợi,OEM,252.0,48,145000,125000,14
7202377,Bộ 3 Lõi Lọc Nước Máy Tiêu Chuẩn Barrier,Nhà Cửa - Đời Sống,1.0,Tiki Trading,BARRIER,1514.0,2150,660000,519000,21
140791193,Bóng đèn LED Bright PHILIPS E27 - Thay thế hoàn hảo cho bóng đèn Compact - Hàng Chính Hãng,Bóng đèn,232117.0,QUOSOM,Philips,413.0,787,90000,56000,38
116966601,HỘP 10 ĐÔI ĐŨA INOX 304 - CAO CẤP - SANG TRỌNG - NGUYÊN KHỐI INOX 304,Đũa,151652.0,Jodily StarHome HP,Jodily StarHome,513.0,349,275000,228000,17
106281034,Bình nước thủy tinh Luminarc Quadro 1.7L -LUQUG2668,Bình,189048.0,Luminarc Official Store,Luminarc,567.0,267,186000,105000,44
121367420,"Gối ngồi lót mông y tế chống trĩ, đau xương cụt, ê mỏi mông cho dân văn phòng, lái xe, thu ngân, sinh viên...Chính hãng Ema - Hàng nhập khẩu",Gối các loại,18299.0,Gối nêm Hi-Sleep Store,Ema,485.0,540,650000,325000,50
125658476,"Bình Giữ Nhiệt Kim Cương 1500Ml Inox 304- YOGA QG- Chống Rỉ Set, Nắp Đậy Chặt, Giữ Nhiệt Nóng Lạnh Tốt 6- 8h, Quai Đeo Chắc Chắn, Thiết Kế Sang Trọng, Màu Sắc Thanh Lịch, Tiện Lợi, Pha Lọc Trà, Hàng Chính Hãng",Bình giữ nhiệt,205461.0,Học Viện Yoga Quốc Gia,YOGA QG,467.0,491,186000,186000,0
53119459,Chảo inox 304 Westfalia (Đức),Chảo các loại,90431.0,Tentum,Westfalia,985.0,528,600000,600000,0
72226853,"Đèn Bàn Học Đọc Sách Chống Cận, Đèn Bàn Làm Việc, Đèn Ngủ Sang Trọng (Học Sinh, Sinh Viên, Văn Phòng) Cao Cấp Kẹp Bàn – 03 Mức Độ Ánh Sáng Vàng Bảo Vệ Mắt Chống Cận - Hàng Chính Hãng - VinBuy",Nhà Cửa - Đời Sống,109746.0,VinBuy,VinBuy,792.0,154,200000,130700,35
9805349,"Ổ cắm Điện Quang ECO ĐQ ESK 5WR 8ECO (8 Lỗ, dây dài 5m, màu trắng đỏ)",Ổ cắm,17490.0,Điện Quang Official Store,Điện Quang,1460.0,522,217100,152000,30
120170899,"Kéo cắt gà đa năng SK5 Nhật siêu cứng - Kéo Nhật nội địa cắt giấy, vải chuyên dụng GD016",Kéo các loại,16725.0,Sứa Closet,OEM,496.0,77,49000,35000,29
73608154,ĐỒNG HỒ TREO TƯỜNG TRÒN KIM TRÔI SIZE LỚN ĐƯỜNG KÍNH 30CM,Đồng hồ treo tường,267338.0,Máy Photocopy Hoàng Nguyên,OEM,758.0,18,125000,125000,0
20484673,Nắp ngồi rơi êm cao cấp thay thế cho các loại bồn cầu INAX thân dài 504-702-700-710-808-900,Nhà Cửa - Đời Sống,15938.0,Thiết bị vệ sinh VN,SUNZIN,1295.0,758,295000,295000,0
130410828,Chăn Ngủ Văn Phòng Chăn Du Lịch Giữ Ấm Màu Trơn Cho Nam Cao Cấp - Kích  Thước(160cm * 120cm)- Hàng Chính Hãng MINIIN,Chăn,134678.0,Smarthome29,MINIIN,446.0,84,120000,118200,2
204207230,"Nhang nụ trầm hương đốt xông nhà tẩy uế HÀ XÁ đồ thờ cúng phong thủy, xua đuổi vận xui, thu hút nguồn năng lượng tích cực, thanh lọc không khí, an toàn cho sức khỏe",Nhà Cửa - Đời Sống,146857.0,Trầm Hương HÀ XÁ,Trầm Hương Hà Xá,62.0,269,198000,99000,50
185798331,"Máy chà nhà vệ sinh Jesopb K129 phiên bản 5 in 1, chổi cọ bồn cầu đa năngm lau chùi bề mặt không dây, Pin 4000mAh, Tốc Độ Cao 320 Vòng/Phút, hàng chính hãng",Bàn chải,179711.0,ĐIỆN MÁY HTG,Jesopb,205.0,41,735000,735000,0
197822149,"Tựa lưng công thái học EMA cho ghế văn phòng, ô tô - Chuẩn công thái học, thoái mái & thoáng mát",Nội thất phòng học,18299.0,Gối nêm Hi-Sleep Store,Ema,109.0,255,860000,430000,50
184915910,"Chậu Gội Đầu Tại Nhà, Tại Giường Cho Người Già, Người Bệnh, Trẻ Em",Xô,108828.0,Tiện ích 1708,PEAFLO,212.0,90,150000,103400,31
104681217,Bông lau cho cây lau nhà sợi fbier tự vắt phẳng và cây lau nhà tự vắt phun sương MyJae Đài Loan,Khăn,190794.0,MyJae Flagship Store,MyJae,573.0,301,99000,27000,73
186692944,Bộ 6 Đĩa Chấm Thuỷ Tinh Luminarc Diwali 11cm - LUDIN3977,Tô,189048.0,Luminarc Official Store,Luminarc,198.0,197,203000,117000,42
75517080,GỐI NGỦ VĂN PHÒNG ĐA NĂNG TỰA LƯNG HÌNH THÚ - KHỦNG LONG- GỐI NGỦ,Gối các loại,146536.0,Phan Nguyễn Office,OEM,729.0,129,119000,119000,0
173671887,"Phân Bón Hữu Cơ Hoa Hồng Phân Bón Hoa Hồng, Cây Cảnh GREEN FARM Gói 1kg",Phân bón,212248.0,HeLiCorp,OEM,275.0,172,42050,23127,45
80666842,Bộ 4 miếng đệm cao su lót chân máy giặt chống rung chống ồn,Phụ kiện giặt ủi khác,76796.0,Vietstore24h,OEM,667.0,6,16080,16080,0
145495739,Nhang nụ Dương Minh 100% thành phần tự nhiên nụ trầm nụ quế nụ bồ kết - nụ khói tỏa ngược hương nhang sạch an toàn cho sức khỏe,Hương,245287.0,Nhang sạch Dương Minh,Dương Minh Since 1984,398.0,114,150000,110000,27
105892083,"Rèm Cửa Dán Tường, màn cửa sổ chống nắng may sẵn treo phòng ngủ, giường tầng, dán bếp",Rèm,42815.0,Marytexco - Home and Living Decor,OEM,569.0,24,149000,149000,0
199171217,"Đèn LED Chữ Merry Christmas Treo Cây Thông, Trang Trí Giáng Sinh, Noel - Chính Hãng NAVIVU",Đèn khác,17480.0,Ghế Nam Việt,NAVIVU,93.0,38,149000,149000,0
184245786,"Túi đựng hộp cơm giữ nhiệt, túi đựng đồ ăn trưa văn phòng có lớp lót nhôm giữ nhiệt dày dặn, kích thước lớn tiện lợi",Phụ kiện nhà bếp khác,160959.0,Bột Mì House,OEM,218.0,85,92000,86000,7
115767168,Gối Tựa Lưng Gối Trang Trí Sofa Hình Mèo Neko May Mắn Siêu Dễ Thương,Gối các loại,35488.0,Aquaria,OEM,525.0,58,498000,259000,48
1325511,Combo 5 Cặp Nút Tai Chống Ồn 3M 1110 - Cam,Nhà Cửa - Đời Sống,935.0,Bảo Hộ Lao Động Achison,3M,1818.0,637,58000,58000,0
178316055,Bịch 100 túi bao trái (quả) - túi vải không dệt,Dụng cụ làm vườn khác,18516.0,Nông Nghiệp Phố,OEM,244.0,49,66000,66000,0
73314056,Lọ xay tiêu tay vặn HOBBY HOME DECOR XT - lọ thủy tinh và cối sứ viền Inox 304 không rỉ,Dụng cụ xay,20023.0,Hobby Home Decor,Hobby Home Decor,769.0,528,99000,65000,34
114105978,Keo Vá Tường Chống Thấm LKB 250gr - Trám Trét Vết Nứt Khe Hở Tường - Chống Mốc Ẩm Làm Sạch Tường - Mifan Hàng Chính Hãng,Nhà Cửa - Đời Sống,76621.0,Mifan Official Store,LKB,533.0,393,35000,29000,17
160310658,"Tạp dề chống thấm giá rẻ, giao màu, họa tiết ngẫu nhiên - Hàng chính hãng",Phụ kiện nhà bếp khác,134154.0,Funu Home,FuNu,348.0,1089,19000,19000,0
201050752,Bình Giữ Nhiệt Nóng Lạnh Vusign Inox 316 350ml Cao Cấp Cách Nhiệt Deli - Phù Hợp Cà Phê Trà Nước Ép Sinh Tố Đá Du Lịch Đi Học Tập Bình Nước Thể Thao Gym Yoga - LL606,Bình giữ nhiệt,113115.0,Deli Official Store,Deli,82.0,56,466200,159000,66
198028980,Máy Rửa Xe Chuyên Dụng Pin 10 Cell Siêu Trâu - Máy Xịt Rửa Tăng Áp 199V Chuẩn Động Cơ Lõi Đồng Siêu Khỏe Hàng Mới,Máy xịt rửa,286730.0,TỔNG KHO HÀNG MINH KHOA,OEM,107.0,1,690000,690000,0
149573787,Thùng rác thông minh cảm ứng tự động M&L-FH-2 phong cách Hàn Quốc,Thùng rác,250596.0,ML Official Store,M&L,384.0,466,527000,339000,36
164479566,"Ghế chỉnh dáng ngồi đúng - Roichen Hàn Quốc (Made in Korea). Dùng cho Nam, Nữ, Trẻ em. Hàng chính hãng",Nhà Cửa - Đời Sống,101716.0,GIA DỤNG TIỆN ÍCH MINH NGỌC,Roichen,310.0,946,898000,808000,10
70083074,"Ghế xếp thư giãn SUMIKA 199 - có lăn tay massage, khung vuông cao cấp, tải trọng 300kg",Nhà Cửa - Đời Sống,1764.0,PGN Professional Equips & Cleaning,Sumika,810.0,1206,1580000,1135000,28
202611094,Bộ 2 hộp Thủy Tinh Chịu Nhiệt Lock&Lock LCB425 + LCB425C,Hộp đựng thực phẩm,1.0,Tiki Trading,LocknLock,71.0,33,387000,179000,54
162210732,"Bộ Tua Vít Deli Cao Cấp 30 Chi Tiết Đa Năng Vặn Ốc Vít, Bu Lông - Phù Hợp Sửa Chữa Vật Dụng, Xe Máy - DL1130",Máy vặn vít,47548.0,Nhà sách Chi An,Deli,323.0,0,268000,268000,0
135350935,Set mỏ hàn thiếc mini  220V 60W với 5 mũi hàn +thiếc + nhựa thông tiện dụng,Máy hàn,236529.0,Cá Mập Trắng,EOM,433.0,84,99000,99000,0
142214410,Ổ Cắm Điện Đa Năng Thông Minh Phích Cắm Chuyển Đổi Với 2 Cổng USB Bugu HHT202 Tặng Hộp Đựng - Hàng Chính Hãng,Ổ cắm,160736.0,Love Me,Bugu,408.0,188,255000,242250,5
175091479,Giấy bạc kháng khuẩn Nhật Bản 25cm x 10m chịu nhiệt tốt nướng thực phẩm,Màng nhôm,190794.0,MyJae Flagship Store,MyJae,261.0,82,130000,59000,55
147100752,"Dụng cụ bơm hút rượu, xăng dầu chất lỏng bóp tay , hút chất lỏng bóp tay",Phụ kiện nhà bếp khác,294631.0,Bách Hóa 247 online,OEM,393.0,0,56000,56000,0
162122783,Bộ 6 Đĩa Sâu Thuỷ Tinh Luminarc Diwali Lines 20cm - LUDIQ1662,Tô,189048.0,Luminarc Official Store,Luminarc,324.0,103,338000,237000,30
163580111,Bọ xiphong ống thoát chậu rửa chén siêu to,Chậu,57051.0,thiết bị vệ sinh cao cấp Moonoah,	OEM,319.0,325,580000,452400,22
162116332,Bộ 6 Tô Thuỷ Tinh Luminarc Diwali Lines 18cm - LUDIQ1672,Tô,189048.0,Luminarc Official Store,Luminarc,324.0,53,600000,420000,30
199254482,"Đèn pin cầm tay siêu sáng chiếu xa 500m có Zoom xa gần, chip Led XHP50 tâm tròn, pin trấu, 7 chế độ sáng, chống nước IPX6",Đèn pin,8999.0,Rẻ cùng bạn,OEM,93.0,33,149000,146700,2
10647257,Ổ cắm Điện Quang ĐQ ESK 2B.SM750SL (5 lỗ 3 chấu dây 2 mét màu Đen Trắng Đỏ),Ổ cắm,17490.0,Điện Quang Official Store,Điện Quang,1419.0,314,243100,170000,30
193894899,phôi nấm bào ngư xám,Hạt giống,211857.0,81farm,81 FARM,149.0,166,15000,13700,9
207379266,"[Nguồn 220V] Đèn Led Đom Đóm Hạt Gạo Chống Nước Trang Trí Ngoài Trời, 8 Chế Độ Nháy",Đèn khác,17480.0,Ghế Nam Việt,NAVIVU,38.0,19,109000,109000,0
173433806,"Móc treo phơi quần áo em bé, khăn tay, tất vớ, đồ lót - Móc treo quần áo - Móc Inox treo đồ 10/20 Kẹp",Móc treo,170061.0,Bảo Hân Store 68,OEM,278.0,265,34000,34000,0
69193092,Bộ vòi xịt tăng áp lực rửa chén HOBBY VSTADAY có dây nối dài và khớp nối xoay - 3 chế độ phun cực mạnh,Nhà Cửa - Đời Sống,20023.0,Hobby Home Decor,Hobby Home Decor,819.0,433,119000,79000,34
54758744,"combo 5 keo bẫy  chuột siêu dính cao cấp , dùng được nhiều lần ",Dụng cụ diệt côn trùng khác,5697.0,Huy Tưởng Tphcm,OEM,965.0,1467,42000,25200,40
187184291,Băng Dính Silicol 2 Mặt Siêu Dính Siêu Tiện Lợi Ứng Dụng Vào Mọi Công Việc Vị Trí Trong Gia Đình,Khác,151652.0,Jodily StarHome HP,Jodily StarHome,197.0,74,35000,29000,17
188997797,Đầu Bàn ChảI Điện Oral B Braun - Người Lớn - Set 2-3-4-5-6 (không tách lẻ) - Hàng chuẩn Úc - Sản xuất tại Đức,Bàn chải,293680.0,ANNY AUS STORE,OEM,188.0,119,80000,80000,0
134232221,Đồng Hồ Điện Tử LED; Điều Khiển Giọng Nói; Báo Thức Kèm Nhiệt Độ - Hàng Nhập Khẩu,Đồng hồ để bàn,148768.0,Nụ Cười,iKiU,436.0,297,150000,150000,0
21229521,Hộp đựng giấy vệ sinh gắn tường cỡ lớn 26cm,Kệ nhà tắm,9463.0,Giá rẻ mỗi ngày,OEM,1283.0,431,119000,116600,2
152915395,Keo Dán Tường Đa Năng - Trám Vết Nứt Tường Thông Minh- LOẠI 1 - HÀNG CHÍNH HÃNG,Khác,134678.0,Smarthome29,MINIIN,376.0,169,32000,32000,0
17635804,Keo Liền Sẹo - Keo Liền Da Cây Mỹ Tiến 100gr,Phân bón,248161.0,TRUONGNGUYETLOC,OEM,1315.0,3,24000,24000,0
10914085,Ổ cắm Điện Quang ĐQ 001A-02-2M (2 lỗ dây 2 mét),Ổ cắm,17490.0,Điện Quang Official Store,Điện Quang,1407.0,363,99800,85000,15
117048535,"Giấy lọc cà phê HARIO V60 100 tờ (size 02, màu tự nhiên) - V60 Paper Filter 02 M 100 sheets VCF-02-100M",Bình,108769.0,Hario Official Store,Hario,515.0,354,109000,99000,9
207206135,"Tiền 0 Euro kỷ niệm World Cup 2022 Qatar được săn lùng, BÃO GIÁ",Vật phẩm phong thủy khác,232469.0,Quà Tặng Tết PASA,PASACOLLECTION,41.0,16,89000,86300,3
89227279,"Giấy bạc dán tường nhà bếp chống thấm dầu, thấm nước tiện dụng, cách nhiệt",Decal & giấy dán tường,2684.0,HKT Home Shopping,ZOOYOO,638.0,664,69000,37800,45
176435276,Vòi Xịt Vệ Sinh Bồn Cầu Toilet Trong Nhà Tắm Tăng Áp Pimisi Chịu Áp Lực Nước - Mạ Xi Inox Sáng Bóng Từ Tay Xịt Và Dây Mềm Cao Cấp | Hàng Chính Hãng,Vòi nước các loại,127298.0,Pimisi,Pimisi,258.0,86,250000,157000,37
69248810,Kệ chân đế máy giặt tủ lạnh inox cao cấp 48-60cm,Kệ nhà bếp,197704.0,Lộc Minh Phát,OEM,819.0,0,172000,172000,0
199144803,"Bộ Dây đèn led đuổi ARGB 16 triệu màu, cảm biến âm thanh trực tiếp, điều khiển bằng điện thoại, led IP65 cao cấp",Nhà Cửa - Đời Sống,277227.0,Tấn Phát Store,OEM,94.0,13,279965,279965,0
39317473,Hộp 60 Viên Pin AAA Panasonic NEO ( Pin Đũa ) - Hàng Chính Hãng,Pin tiểu,71726.0,Thegioipin88,Panasonic,1156.0,756,220000,210000,5
130978265,"Ổ cắm Xoay 90° Điện Quang ĐQ ESK RT 6GW (6 lỗ, màu xanh lá trắng)",Nhà Cửa - Đời Sống,51365.0,ABMA VIỆT NAM,Điện Quang,443.0,0,78000,78000,0
134351529,"Đũa Gỗ Dùng 1 Lần KETILO Cao Cấp, Thân Thiện Với Môi Trường, Không Hóa Chất Độc Hại, An Toàn Sức Khỏe Người Dùng(Giao Ngẫu Nhiên) - CHÍNH HÃNG ĐG001",Đũa,189298.0,KETI LO,KETILO,435.0,536,33000,33000,0
197746067,"Đèn Pin Mini Siêu Sáng S2 Công Suất 10W Kèm Hộp Full Box Chống Nước, Chịu Được Va Đập Lớn, Kèm Sạc Dự Phòng",Đèn pin,173280.0,Tấn Phát HCM,OEM,110.0,1,113000,113000,0
66090300,Bộ 20 dụng cụ kẹp giữ dây điện gọn gàng,Nhà Cửa - Đời Sống,6351.0,Siêu Thị Linh Kiện,OEM,852.0,430,12999,12999,0
208099383,"Hộp Đựng Giày Nhựa Cứng Cao Cấp Size Lớn, Hộp Để Giày Cửa Nam Châm Lắp Ráp Tiện Lợi ( Loại Xịn )",Tủ,316139.0,Smarthome24h,OEM,31.0,74,65900,65900,0
73983602,"Dây Treo Đèn LED 3D Hình Cây Thông, Chuông Trang Trí Giáng Sinh, Noel, Năm Mới",Đèn khác,17480.0,Ghế Nam Việt,OEM,754.0,190,85000,85000,0
115334461,"Combo 2 Lõi cây lăn bụi ,Lông Động Vật, Sợi Vải, Đồ Da, Chăn Nệm, Ghế Salon",Cây lăn bụi,53713.0,linhkien1984,OEM,527.0,0,13200,13200,0
173717336,"Túi Hộp Vải Lưới Đựng Đồ Lót, Tất Vớ Nhiều Ngăn - Khay Xếp Chia Ô Đựng Đồ Để Tủ Quần Áo Tiện Ích",Tủ,12619.0,CATAN shop,OEM,276.0,80,26000,26000,0
57284183,"Đèn Bàn LED Kẹp Đầu Giường Đọc Sách Chống Cận Pin Sạc, Điều Chỉnh Được Độ Sáng - Nhiều Màu",Đèn khác,97441.0,Luckky Shop,OEM,922.0,237,132000,132000,0
96180139,Chân đàn Organ/ Piano đa năng - Kzm Kurtzman STX1 - Dáng chữ X đơn - Màu đen - Hàng chính hãng,Phụ kiện nhạc cụ khác,174653.0,KZM KURTZMAN OFFICIAL STORE,Kzm Kurtzman,606.0,881,155000,100000,35
181222919,"Ghế nhựa ghế đẩu ghế đòn thấp nhựa Đại Đồng Tiến sử dụng trong nhà tắm, nhà bếp, dùng cho em bé nhiều màu sắc để lựa chọn",Bàn ghế các loại,43332.0,Laviefoods,Đại Đồng Tiến,232.0,70,39000,39000,0
196150307,[Quà Tặng] 2 Bình Nước Caro Thể Thao Có Dây Quai Mang Đi,Bình đựng nước,224679.0,TD Electrical Supermarket,OEM,131.0,126,99000,99000,0
177292097,Củ hoa loa kèn | lan huệ | huệ tây nhiều màu,Nhà Cửa - Đời Sống,256912.0,Flower Diary,OEM,252.0,19,45000,45000,0
199036961,Chảo inox Tefal Primary dùng cho mọi loại bếp- Hàng chính hãng,Chảo các loại,121435.0,Tefal Official Store - Chính hãng,Tefal,96.0,289,479000,289000,40
196670862,HOA LAN HỒ ĐIỆP ĐẠI ĐÃ CÓ NGỒNG,Nhà Cửa - Đời Sống,192483.0,Quỳnh Nga shop,OEM,125.0,44,59000,59000,0
191822621,Gối Foam Contour Doona Sofy Cấu Trúc Lượn Sóng Nâng Đỡ Định Hình Xương Cổ Và Đầu Hoàn Hảo,Gối các loại,9596.0,Vua Nệm Official Store,Doona,167.0,206,600000,309000,49
199593599,Kệ Sách Hình Cây Để Sàn,Nhà Cửa - Đời Sống,48574.0,IGEA Nội Thất Thông Minh,IGA,91.0,2137,259000,246000,5
162250528,"Bộ Dụng Cụ Sửa Chữa Đa Năng 116 Chi Tiết Deli Cao Cấp Chính Hãng - Sử Dụng Nhiều Mục Đích, An Toàn, TIện Lợi - DL5973",Bộ dụng cụ đa năng,47548.0,Nhà sách Chi An,Deli,323.0,0,1315000,1315000,0
203185106,"Nồi Áp Suất Bí Ngô Thông Minh Nồi Hầm 4in1 Đa Năng 8L , Hầm Gà, Cháo - Nồi Chiên, Xào, Nấu Lẩu, Nấu Cơm - Tặng Kèm Xửng Hấp - Chính Hãng MINIIN",Nồi các loại,134678.0,Smarthome29,MINIIN,68.0,84,199000,176400,11
73464817,"Kệ gia vị dán tường dài 30/40/50cm sơn đen tĩnh điện Vando chính hãng - kèm keo chuyên dụng kệ treo tường bằng thép carbon không gỉ, siêu chịu lực 30kg",Kệ nhà bếp,157549.0,Vando Official Store,VANDO,764.0,2151,139000,79000,43
35906533,Combo 6 hộp đựng giày nhựa cứng trong suốt,Tủ,107004.0,Dolare,OEM,1183.0,26,177000,177000,0
53970712,Bàn Trang Điểm Ngồi Bệt Thông Minh Gương Gập Tiện Ích,Nhà Cửa - Đời Sống,48574.0,IGEA Nội Thất Thông Minh,IGA,972.0,796,294000,280000,5
2039747,Bộ Nồi Inox 3 Đáy Sunhouse SH334,Nhà Cửa - Đời Sống,182530.0,GIADUNG TẤN PHÁT,Sunhouse,1713.0,2,498000,498000,0
144203367,Bộ túi hộp cơm thủy tinh Lock&Lock 3EA LLG428S2,Hộp đựng thực phẩm,1.0,Tiki Trading,LocknLock,403.0,292,726000,352000,52
189491948,"Kệ gia vị, Kệ đựng gia vị nhà bếp, Kệ gia vị đa năng",Kệ nhà bếp,287124.0,Minhsmart Shop,OEM,183.0,72,250000,250000,0
143752087,Kệ Sách Để Bàn Phong Cách Nordic Thương Hiệu IGA - GP176,Tủ,48574.0,IGEA Nội Thất Thông Minh,IGA,405.0,179,258000,245000,5
19920919,Bật Lửa Mồi Lửa Bếp Gas Bếp Cồn An Toàn (Màu Sắc Ngẫu Nhiên),Than,76796.0,Vietstore24h,OEM,1302.0,64,16400,16400,0
72527242,"Kệ Nhà Tắm Thông Minh OENON Dán Tường, Giá Treo Bàn Trải Đánh Răng, Bán Kèm Hộp Nhả Kem Đánh Răng Tự Động",Kệ nhà tắm,72734.0,OENON,OENON,786.0,474,300000,159000,47
192303236,Kìm bấm cúc áo kèm túi 100 cúc,Kềm & Dũa các loại,6351.0,Siêu Thị Linh Kiện,OEM,163.0,0,34999,34999,0
17487178,Bộ tưới cây tự động 20 đầu cắm phun 8 tia kèm van nước hẹn giờ,Vòi nước và phụ kiện tưới cây,34902.0,CÔNG NGHỆ PHUN TƯỚI,OEM,1316.0,208,345000,345000,0
176805022,Combo 3 lọ Phân Kích thích ra rễ cực mạnh N7M - lọ 100gr,Phân bón,29614.0,Yêu Phong Lan,OEM,221.0,66,39000,39000,0
163827070,Combo 2 hộp chia ngăn sắp xếp quần áo phong cách Nhật Bản VINAVU,Tủ,17480.0,Ghế Nam Việt,OEM,317.0,116,190000,190000,0
51044868,"Vòi sen tăng áp, bát sen tắm inox 304 KAMA PK03, vòi nước tăng áp, bát sen tăng áp inox 304, bề mặt inox 304 nguyên bản, không rỉ sét, vòi sen tắm tăng áp lực nước",Vòi nước các loại,62143.0,CỬA HÀNG CHÍNH THỨC CỦA KAMA,Kama,1014.0,211,180000,180000,0
169919224,"Kệ Để Kem Đánh Răng & Bàn Chải, Tặng Kèm Cốc - Kệ Nhà Tắm Dán Tường Thông Minh - Giá Treo Bàn Chải Đánh Răng Kiêm Để Đồ & Úp Cốc - Giao Màu Ngẫu Nhiên [HÀNG CHÍNH HÃNG]",Kệ nhà tắm,76589.0,TITANSTORE,ENCOVINA,293.0,201,180000,121200,33
21582013,Bộ Bịt Mắt Ngủ 3D Tặng Kèm Bịt Tai Chống Ồn Màu Ngẫu Nhiên,Nhà Cửa - Đời Sống,9612.0,AUCOSTA,OEM,1280.0,1700,39000,29000,26
698608,Bộ Hộp Nhựa Lock&Lock Classic 6EA HPL818SHP,Nhà Cửa - Đời Sống,195742.0,Điện Máy Vymart,LocknLock,2018.0,20,400000,279000,30
109260690,"Pin 23A - 12V ALKALINE  dùng cho chuông cửa, điều khiển cửa cuốn,",Pin tiểu,198166.0,Phụ Kiện Duy Châu,OEM,538.0,82,7000,7000,0
