p_id,p_name,p_categories,p_id_shop,p_shop_name,p_brand,p_day_created,p_sold_quantity,p_original_price,p_current_price,p_discount_rate
178515092,Bộ cây lau nhà cao cấp xoay 360 độ SAMONO SCM003 lau sạch mọi ngóc ngách sàn nhà 2 ngăn chứa lau khô lau ướt thông minh - Hàng chính hãng,Chổi,284775.0,Samono Official Store,Samono,243.0,135,500000,299000,40
46104797,Bình Giữ Nhiệt Holiday Sunset I.d Tumbler Lock&Lock LHC3245 450ml (Không phủ ceramic),Nhà Cửa - Đời Sống,38510.0,JoyMall LocknLock Chính Hãng,LocknLock,1104.0,378,534000,299000,44
135507759,Dây vòi hoa sen tắm nóng lạnh Pimisi bằng inox 304 với đầu dây đồng thau không gỉ phù hợp với mọi sen tắm trong nhà vệ sinh dài 150cm chống xoắn - mạ xi sáng bóng - ống mềm cấp nước và dùng được cho cả vòi xịt nhà vệ sinh phòng tắm | Hàng chính hãng,Vòi nước các loại,127298.0,Pimisi,Pimisi,431.0,243,120000,120000,0
194125008,"Khăn mặt, khăn gội sợi tre MORI xuất Nhật cao cấp 35x75cm",Khăn,299742.0,Khăn sợi tre Mori,OEM,147.0,351,58000,33400,42
83847675,Combo 30 bịch giấy ăn gấu trúc,Phụ kiện nhà bếp khác,76796.0,Vietstore24h,OEM,653.0,172,107500,105800,2
195444509,Bông lau cây lau nhà sợi fiber kỳ diệu maxi MyJae,Khăn,190794.0,MyJae Flagship Store,MyJae,138.0,33,109000,79000,28
54566137,"Miếng lót ly - Tấm lót ly, cốc siêu hút nước bằng đất xốp Diatomite họa tiết, thông điệp dễ thương",Ly,65588.0,D and D House,OEM,964.0,427,39000,38400,2
116048764,Kệ sách tổ ong vân gỗ dễ dàng kết hợp với bàn làm việc chính hãng IGA - GP100,Tủ,48574.0,IGEA Nội Thất Thông Minh,IGA,523.0,2817,112000,107000,4
155794592,"Kệ lò vi sóng đa năng Thép Carbon cao cấp Vando, kệ để đồ nhà bếp siêu chịu lực 300kg sơn tĩnh điện chống bong tróc, kệ nhà bếp ",Kệ nhà bếp,157549.0,Vando Official Store,VANDO,363.0,684,1099000,559000,49
73547953,Lau kính 2 mặt nam châm Kitimop-NC01 làm sạch kính cửa sổ chung cư bể cá an toàn tiện lợi hiệu quả,Dụng cụ vệ sinh khác,158587.0,Kitimop Official Store,Kitimop,763.0,1192,185000,185000,0
54476660,"Đèn Bàn Học Đọc Sách, Làm Việc (Học Sinh, Sinh Viên, Văn Phòng) Cao Cấp Kẹp Bàn – 03 Mức Độ Ánh Sáng Vàng Bảo Vệ Mắt Chống Cận Pin 2500 mAh",Nhà Cửa - Đời Sống,97355.0,Future Store,eLights,966.0,1316,220000,189000,14
193433927,Đèn Bàn Học Led Đọc Sách Làm Việc Học Tập Bảo Vệ Mắt Chống Cận - 2 Trục Đèn Chiếu Sáng - Gấp Gọn Tiện Lợi ,Đèn bàn,37335.0,TRIỀU CƯỜNG TECH OFFICIAL ,TRIỀU CƯƠNG TECH ,153.0,118,699000,568000,19
207184660,"Tranh Cát 3D Chuyển Động Tranh Cát Chảy Hình Tròn Làm Quà Tặng Trang Trí Bàn Làm Việc Tinh Tế, Sang Trọng",Nhà Cửa - Đời Sống,35488.0,Aquaria,OEM,41.0,31,718000,718000,0
75411116,"Lót chân ghế, miếng dán chống trầy, chống rung lắc bàn ghế - Hàng chính hãng",Bảo vệ nhà cửa khác,152429.0,MOHI,MO hi,730.0,449,29000,27000,7
164221758,"Túi lưới giặt đồ lót, Túi giặt bảo quản quần áo có khóa kéo và gọng nhựa LYPK31-32",Túi giặt,154803.0,Loving Yourself,	OEM,316.0,74,17000,17000,0
53467695,"Bàn học gấp gọn Thông minh, có khe cắm",Nhà Cửa - Đời Sống,101662.0,ShopQuangSon,OEM,982.0,5,95000,95000,0
146509745,Bộ Hộp Cơm Giữ Nhiệt Văn Phòng Cao Cấp Cắm Điện inox 3 tầng - Chính hãng dododios,Hộp đựng thực phẩm,248883.0,DoDoDios Official Store,dododios,394.0,947,400000,324000,19
54130086,Cây lau nhà tự vắt thông minh đa năng cao cấp Parroti Magic MG01 - Tặng 1 Miếng Lau,Nhà Cửa - Đời Sống,96639.0,Parroti Store,Parroti,971.0,2005,349000,225000,36
192121064,Bộ 2 Thảm Nhà Bếp Siêu Thấm Chống Trượt Dễ Dàng Vệ Sinh,Thảm chùi chân,17480.0,Ghế Nam Việt,NAVIVU,166.0,113,269000,269000,0
75409237,Hoa Mai Giả Trang Trí Tết - Bịch 40 hoa mai giả kèm lá kẽm trang trí tết ,Hoa trang trí,35488.0,Aquaria,OEM,730.0,330,78000,39000,50
140204791,Bộ 24 Quả Châu Bóng Nhũ Kim Tuyến Lấp Lánh Trang Trí Cây Thông Noel Giáng Sinh Giá Rẻ,Trang trí nhà cửa khác,107004.0,Dolare,OEM,415.0,125,78000,78000,0
51005591,Túi Giặt Bảo Vệ Quần Áo - Nhiều Mẫu,Túi giặt,107004.0,Dolare,OEM,1017.0,0,29000,29000,0
98562199,Vĩ 5 VIÊN PIN CMOS CR2032,Nhà Cửa - Đời Sống,20367.0,VI TÍNH NAM TRUNG HẢI,OEM,597.0,10,10600,10600,0
177969021,Bộ Hộp Cơm Giữ Nhiệt 2GOOD Lunch Box HC02 (2000ml) - Kèm Muỗng và Đũa Inox 304,Hộp đựng thực phẩm,68379.0,2GOOD Official Store,2Good,245.0,162,590000,590000,0
74815043,Đồng Hồ Đo Điện Vạn Năng Ampe Kìm + Bút Thử Điện Cảm Ứng Đa Chức Năng CTFAST An Toàn Tiện Dụng,Thiết bị đo lường khác,54602.0,HUY HÙNG AFAST,CTFAST,737.0,948,158000,155600,2
186826373,Tấm lót sàn nhà vệ sinh MHI. Vỉ nhựa lót sàn chống trơn Trải Sàn Nhà Tắm/Vệ Sinh/Nhà Bếp.,Thảm chùi chân,290085.0,MHI Store,MHI,199.0,1461,6500,6500,0
200782721,"Hộp vải đựng quần áo chia ngăn, khay đựng đồ lót, tất vớ,có nắp gấp gọn tiện lợi",Nhà Cửa - Đời Sống,254550.0,Shop Áo Trùm Vỏ Bọc Máy Giặt,OEM,84.0,192,52000,52000,0
41886085,Túi Đựng Ly Giữ Nhiệt Lớn 900ml - Nhiều Hoa Văn,Nhà Cửa - Đời Sống,17480.0,Ghế Nam Việt,OEM,1141.0,3351,40000,40000,0
117353723,Chiếu ngủ văn phòng cao cấp ,Chiếu,160163.0,K KRISHNA,Krishna,511.0,2021,29000,29000,0
69929041,"Móc Treo Quần Áo, Móc Phơi Đồ Trẻ Em Inox Kẹp Chống Rơi, Móc Treo Tất, Vớ, Đồ Lót Nhiều Kiểu Dáng",Móc treo,17480.0,Ghế Nam Việt,OEM,814.0,951,50000,50000,0
195507521,Bộ 3 Kệ Để Màn Hình SIB DECOR Đa Chức Năng Dễ Dàng Điều Chỉnh Chiều Dài Từ 80 Đến 120cm (Không gồm các đồ trang trí). ,Nhà Cửa - Đời Sống,3271.0,SIB Decor,SIB DECOR,139.0,317,335000,249000,26
94776792,Chuông Gọi Phục Vụ Bàn Trang Trí Nhiều Màu Sắc - Chọn Họa Tiết  - Giao Màu Ngẫu Nhiên,Trang trí nhà cửa khác,110137.0,Đồ Dùng Gia Đình Max,OEM,615.0,72,54000,54000,0
5429807,Bộ 50 cút nối dây điện nhanh CH-2,Khác,17480.0,Ghế Nam Việt,OEM,1546.0,82,50000,50000,0
189492088,"Nhang Sen Thuần Khiết Liên Tâm 29cm 200 cây - Ít khói, dịu nhẹ, 100% Đài sen thiên nhiên",Nhà Cửa - Đời Sống,64157.0,Nhang Sen Liên Tâm,Liên Tâm,185.0,696,125000,118750,5
196336659,RONG BIỂN KẸP HẠT DINH DƯỠNG- Hộp 500gr,Nội thất khác,74878.0,Gối cột sống TN,OEM,128.0,189,250000,189900,24
55580718,"Bộ 3 Nồi Inox 304 Đáy Từ 5 Đáy Nagakawa NAG1352 (16cm, 20cm, 24cm) - Hàng Chính Hãng ",Nhà Cửa - Đời Sống,1.0,Tiki Trading,Nagakawa,951.0,1141,1890000,1080000,43
74296344,Chảo vuông Lock&Lock Handycook LHD1146 14cm,Chảo các loại,1.0,Tiki Trading,LocknLock,750.0,712,264000,128000,52
197070658,"Cây Lau Nhà Tự Vắt Thông Minh Đa Năng VinBuy, Vắt Khô Đến 95%, Chổi Lau Nhà 360 Độ, Sau Sạch Khô Nhanh – Hàng Chính Hãng",Chổi,109746.0,VinBuy,VinBuy,119.0,97,299000,165250,45
182709717,Màn chụp tự bung đỉnh vuông - Mẫu mùng chụp tự bung người lớn chống muỗi gấp gọn,Phụ kiện phòng ngủ khác,272228.0,Màn Chụp Hoàng Nhân,OEM,225.0,220,225000,225000,0
134581992,Bình Giữ Nhiệt Bằng Thép Không Gỉ Lock&Lock Loop Tumbler LHC4154,Nhà Cửa - Đời Sống,38510.0,JoyMall LocknLock Chính Hãng,LocknLock,435.0,847,521000,279000,46
192523772,"Tấm Lót Tủ Lạnh, Tủ Bếp, Tủ Quần Áo Nhựa EVA Dễ Dàng Vệ Sinh (Đủ màu, đủ size)",Phụ kiện nhà bếp khác,17480.0,Ghế Nam Việt,NAVIVU,162.0,223,49000,49000,0
29573914,Lọ Xay Tiêu Elmich-El1157,Nhà Cửa - Đời Sống,1.0,Tiki Trading,Elmich,1225.0,1798,235000,144000,39
92441037,"[LOẠI XỊN - CÓ TẶNG BƠM TAY] Bộ 8 Túi Hút Chân Không Đựng Quần Áo, Chăn Màn CỠ ĐẠI Cao Cấp miDoctor",Phụ kiện phòng ngủ,34473.0,Danido Store,miDoctor,624.0,980,250000,185100,26
134016395,"Chổi cọ toilet thông minh silicon cọ chà vệ sinh sạch mọi ngóc ngách bồn cầu, nhà tắm - Cây chà toilet, chà nhà tắm",Nhà Cửa - Đời Sống,107004.0,Dolare,OEM,436.0,0,25000,25000,0
73467694,"Kệ để lò vi sóng đa năng Inox 304 cao cấp Vando chính hãng kệ để đồ lò nướng chắc chắn, sơn tĩnh điện chống bong tróc, kệ nhà bếp siêu chịu lực 300kg",Kệ nhà bếp,157549.0,Vando Official Store,VANDO,764.0,2372,929000,599000,36
185380271,"Keo Chống Thấm Trong Suốt TAIKOMI -Chống Thấm Gạch Lát Nền,Trần Vết Nứt Mái Nhà, Sàn Nhà Vệ Sinh Triệt Để",Sơn,83621.0,Đạt Nguyễn Shops Thiết Bị Nhập Khẩu,TAIKOMI,209.0,83,203000,192850,5
186693022,"Cây lau nhà Kitimop-Red 38cm tự vắt thông minh không cần thùng, chổi lau nhà xoay 360 độ vắt nhẹ, lau sạch, khô nhanh",Chổi,158587.0,Kitimop Official Store,Kitimop  Home Tool Cleaning,196.0,212,225000,139000,38
71518878,Nồi Decor Lock&Lock LDE1204IH Hai Tay Cầm (20cm) - Màu Navy,Nhà Cửa - Đời Sống,1.0,Tiki Trading,LocknLock,803.0,536,1248000,614000,51
196443544,"Kệ Để Đồ Rửa Chén 3 in1 Tiện Lợi ,Giá Treo Để Đồ Rửa Bát Gắn Bồn - Có Thanh Treo Khăn Tiện Dụng, Có Thể Kéo Dài Tiện Lợi ",Kệ nhà bếp,192111.0,BHome6868,OEM,127.0,86,30000,25000,17
466737,Hộp Hâm Nóng Life360 EL-ALS263 (Tím),Nhà Cửa - Đời Sống,1.0,Tiki Trading,Life360,2093.0,23009,799000,433000,46
34816875,"Dụng Cụ Thông Tắc Cống, Kẹp Gắp Rác Đa Năng Loại Tốt",Bàn chải,107004.0,Dolare,OEM,1191.0,10,25000,25000,0
203875374,"Decal Dán Trên Mọi Bề Mặt Trang Trí Giáng Sinh Nhiều Mẫu Bông Tuyết, Cây Thông, Ông Già Noel, Tuần Lộc Merry Christmas Nhiều Kích Thước",Decal & giấy dán tường,35488.0,Aquaria,OEM,64.0,92,198000,49000,75
141258470, Bộ 6 Bát Sứ Màu Xanh-Trắng Viền Mạ Vàng Cao Cấp- Tặng Kèm Đũa Phong Cách Nhật- Hàng Chính Hãng MINIIN,Tô,134678.0,Smarthome29,MINIIN,411.0,140,217000,217000,0
154258725,Vít tắc kê Inox đầu bằng nhiều kích thước [100Gram],Ốc vít,228935.0,Thiết bị dụng cụ đồ nghề Phương Nam,OEM,371.0,53,13500,13500,0
212465483,"Tua Vít Cầm Tay Nhỏ Gọn, Tiện Dụng Lắp Ráp Và Sửa Chữa Vật Dụng Gia Đình",Máy vặn vít,150059.0,FIVO Official Store,FIVO,12.0,22,35000,35000,0
196763021,Bàn Làm Việc Gỗ Decor FIVO Mã FD01 Cao 75cm Chống Gù Lưng Phong Cách Bắc Âu,Bàn ghế làm việc,112244.0,Vimila Mart,FIVO,120.0,85,800000,588000,27
79665351," Đèn Led gắn tường, tủ đọc sách  tích điện đa năng 4 cấp độ",Đèn khác,97441.0,Luckky Shop,OEM,670.0,169,163999,163999,0
185004559,Ly Thủy Tinh Hoa Văn Navivu Vintage Glass 300 - 350ml,Ly,17480.0,Ghế Nam Việt,NAVIVU,212.0,187,47000,47000,0
65576473,Bộ Chăn Ga Gối Cotton Tici Đơn Sắc LIDACO - Màu Trắng - Tặng Vỏ Gối Ôm,Bộ ga,43482.0,Lidaco Official Store,LIDACO,852.0,97,329000,329000,0
148810239,"Hộp Cơm Cắm Điện Đời Mới Chính Hãng MINIIN, Hâm Nóng, Giữ Nhiệt, Nấu Chín Cơm Và Thức Ăn, 2 Tầng Nhỏ Gọn, 4 Bát Innox Không Gỉ, Tặng Kèm Bộ Đũa Và Thìa, Đa Chức Năng, Dễ Dàng Vệ Sinh",Hộp đựng thực phẩm,203034.0,Gia Dụng Trí Vũ,MINIIN,387.0,36,299000,287000,4
72515117,"COMBO  6 HỘP NHỰA ĐỰNG GIÀY DÉP SANG TRỌNG - CỨNG CÁP - CHỐNG BỤI - CHỐNG ẨM MỐC - UY TÍN - CHẤT LƯỢNG NHẤT THỊ TRƯỜNG  VIỆT NAM (Thay thế kệ giày, kệ dép)",Nhà Cửa - Đời Sống,49020.0,LORITA VIỆT NAM,OEM,772.0,629,149000,119000,20
174897090,"Combo 4 Miếng dán tường treo kệ bếp, kệ nhà tắm",Kệ nhà bếp,17480.0,Ghế Nam Việt,NAVIVU,264.0,203,24000,24000,0
76510119,Bong bóng hình chữ số tráng nhôm kích cỡ 32 inch trang trí tiệc sinh nhật,Trang trí nhà cửa khác,76045.0,New Sky Shop 18,OEM,686.0,449,15000,7000,53
73318198,BỘ CỐC SỨ KÈM ĐẾ ĐIỆN HÂM NÓNG CAO CẤP,Ly,258659.0,Pin Bom Shop,OEM,770.0,5,68000,68000,0
53202251,"Túi Hút Chân Không 1 Mặt Nhám Dạng Cuộn B2D Roll (Cuộn Dài 5M). Làm Từ Hạt Nhựa Nguyên Sinh Cao Cấp Tiêu Chuẩn Vệ Sinh ATTP, Không Chứa Chất Gây Ung Thư, Dùng Được Trong Lò Vi Sóng. Hàng Chính Hãng Chất Lượng Cao Cấp.",Nhà Cửa - Đời Sống,162883.0,Máy thực phẩm SGE,Spring Green Evolution ,982.0,874,79300,51850,35
199243252,Đèn năng lượng mặt trời đèn pha100W 200W 300W 500W LED vỏ nhôm chống nước thời gian sáng kéo dài,Đèn ngoài trời,303510.0,TTB Solar,OEM,93.0,66,470000,470000,0
196768917,Cây lau nhà tự vắt 2 ngăn tách nước sạch nước bẩn riêng biệt Joybos JBS-ZXTB-M16-OGY2P - Hàng nhập khẩu,Chổi,129537.0,Mi Hoàng Gia,Joybos,119.0,51,499000,389000,22
152700947,Bộ cây lau nhà tự vắt thông minh  xoay 360 độ sợi microfiber,Chổi,190794.0,MyJae Flagship Store,MyJae,376.0,302,690000,329000,52
71925401,"Đèn Bàn Học Đọc Sách, Đèn Bàn Làm Việc Sang Trọng, Đèn Ngủ Cao Cấp (Học Sinh, Sinh Viên, Văn Phòng) LED Chống Cận 03 Mức Độ Sáng, Cảm Ứng Tích Điện Pin 2500mAh - Hàng Chính Hãng - VinBuy",Nhà Cửa - Đời Sống,109746.0,VinBuy,VinBuy,798.0,764,260000,140600,46
72016703,"Bếp Nướng Than Hoa Phiên Bản Cải Tiến Loại Dài 2020 Chống Cháy Thực Phẩm, An Toàn Sức Khỏe, Không Cần Quạt, Bếp Nướng Không Khói, Bếp Nướng Ngoài Trời, Bếp Nướng Than Hoa Vuông - Tặng Kèm 3 Móc  Kim Loại Chữ S Treo Đồ Tiện Lợi",Bếp nướng,61513.0,chat24h,KUNBE,793.0,565,400000,229000,43
73493365,"Đầu vòi nước tăng áp, xoay 360 độ, hai chế độ nước N023 (kèm bộ ren chuyển đổi 6 món)",Chậu,77480.0,Waternymph Official Store,Waternymph,764.0,1229,129000,84000,35
776480,Bình Giữ Nhiệt Cartoon Vacuum Bottle Lock&Lock LHC1435 (550ml),Nhà Cửa - Đời Sống,1.0,Tiki Trading,LocknLock,1975.0,4598,842000,375000,55
48722108,"1kg - Túi đựng rác gia đình , khách sạn , Bao đựng rác văn phòng 3 màu size đại 64x78",Nhà Cửa - Đời Sống,92052.0,Phú Thành Phát,Titapha,1048.0,1302,68000,39000,43
171319644,Hộp Đựng Đồ Đa Năng Bằng Vải Thùng Đựng Chăn Màn Quần Áo Khung Thép Siêu Bền Gấp Gọn Mẫu Hoa Tuyết Sang Trọng,Tủ,173842.0,HomeMi Shop,CHIKIGON,287.0,264,185000,185000,0
117318253,"Nệm xếp đa năng Goodnight 70x180cm, Nệm gấp văn phòng, Nệm xếp 3 thiết kế gọn nhẹ, kèm túi đựng (Giao màu ngẫu nhiên)",Nệm,9596.0,Vua Nệm Official Store,GOODNIGHT,512.0,859,570000,319000,44
115966800,Bộ ga giường Everon Lite ELM 204 Microfiber Xám Đậm (4 món),Bộ ga,2207.0,Everon Official Store,Everon Lite,523.0,445,800000,478000,40
185138439,Tủ Giày Gỗ Thông Minh 3 Ngăn Kết Hợp Ghế Ngồi Nệm Da Sang Trọng VANDO,Kệ & Tủ,157549.0,Vando Official Store,VANDO,211.0,229,899000,599000,33
186862075,"Nắp Ngăn Mùi Thoát Sàn ECODEALS - Chặn Mùi Hôi Cống, Chống côn trùng, Chống trào ngược - MẪU MỚI CẢI TIẾN, ĐỦ KÍCH CỠ",Thiết bị phòng tắm khác,37964.0,ECODEALS,Eco deals,196.0,168,42000,40500,4
127215514," Hộp Đũa Dán Tường Jodily Có Nắp Sang Trọng, Sạch Sẽ",Phụ kiện nhà bếp khác,151652.0,Jodily StarHome HP,Jodily StarHome,457.0,351,205000,190000,7
198995620,Kệ để giày dép chữ x - Kệ để giày dép tháo lắp 5 - 6 tầng có thể tháo lắp gấp gọn,Kệ & Tủ,160608.0,AT HOME,OEM,96.0,228,39000,39000,0
72797082, Chảo Sâu Lòng DECOR Lock&Lock LDE1225IH 22cm (màu vàng) - Hàng chính hãng ,Nhà Cửa - Đời Sống,1.0,Tiki Trading,LocknLock,779.0,802,662000,328000,50
205856283,"Bộ ga giường K-Bedding KMP chất liệu Microfiber bền chắc, kháng khuẩn (KHÔNG BAO GỒM CHĂN)",Bộ ga,2207.0,Everon Official Store,K-Bedding,48.0,37,650000,422000,35
199728521,Bộ lau nhà đa năng Space Saving Sunhouse KS-CL3211P,Dụng cụ lau nhà khác,1.0,Tiki Trading,Sunhouse,90.0,223,450000,275000,39
59341791,Set 100 túi lọc trà vải không dệt- sản phẩm có nhiều kích thước,Nhà Cửa - Đời Sống,67417.0,Shop AZ,OEM,869.0,81,31000,31000,0
108280989,"1 Vỏ gối ôm cao cấp A kích thước 35x100cm (giao mẫu ngẫu nhiên), lớp vải dày cùng với đường may chắc chắn giúp bảo vệ lõi gối bên trong an toàn",Vỏ gối,2443.0,Shop Ánh Sao,A,559.0,304,75000,65000,13
74859074,"Chuông Cửa Không Dây Thông Minh CTFAST CT - 01 (1 Nút Bấm, 1 Chuông ), Chống Nước, Khoảng Cách Sử Dụng Hiệu Quả 300 mét - Hàng Chính Hãng",Nhà Cửa - Đời Sống,142623.0,LEDANTA,CTFAST,734.0,186,199000,176300,11
174184368,Topper làm mềm nệm LIDACO chuyên dùng khách sạn vải cotton chuẩn dày 7cm,Phụ kiện nệm,43482.0,Lidaco Official Store,LIDACO,271.0,29,379000,336000,11
147975049,Thảm Chùi Chân Lau Chân trải sàn TCS SHOUSE phòng khách phòng tắm cao cấp giá rẻ 3d chống trượt hình thú đế cao su hút nước,Thảm chùi chân,141070.0,Shouse,Shouse,389.0,1142,39000,39000,0
48717416,"1kg - Túi đựng rác gia đình , Bao đựng rác văn phòng size trung 55x65 màu đen",Túi đựng rác,92052.0,Phú Thành Phát,Titapha,1047.0,1607,68000,39000,43
188375839,Khăn tắm Khăn lau mặt Cotton 100% Mềm Êm Dày dặn Màu trơn Nhấn viền họa tiết 74x33cm,Khăn,173842.0,HomeMi Shop,CHIKIGON,191.0,260,53000,53000,0
72660053,Miếng Dán Tường Dự Phòng Cho Kệ Nhà Tắm OENON ,Kệ nhà tắm,72734.0,OENON,OENON,785.0,909,50000,25000,50
191604178,"Đèn đốt nến thơm, an toàn, sang trọng, phù hợp mọi không gian",Đèn khác,159301.0,Thế giới mùi hương tự nhiên,Aurae,168.0,41,373000,373000,0
97790251,Hạt giống Ớt Chỉ Thiên F1 - Nảy mầm cao Titapha,Hạt giống,20680.0,SG Titapha Co LTD,Titapha,593.0,87,13000,13000,0
185674459,Set 3 nĩa ăn mini Echo,Đũa,133097.0,Phú Sĩ Arigatou,OEM,208.0,28,38000,27000,29
173635827,"Kệ Góc Nhà Tắm INOX 304/ Kệ Góc Dán Tường Nhà Tắm, Nhà Bếp Siêu Chắc Chắn - Tặng Kèm Tấm Dán - Hàng Chính Hãng",Kệ nhà tắm,249634.0,Homebox Store,JYooHome,277.0,835,130000,68000,48
53116344,Súng bắn keo nến silicon + Tặng 10 cây keo silicon nến,Súng bắn keo,5411.0,vinet shop,OEM,988.0,72,38700,38700,0
119309533,"Gối cao su non có gel lạnh Ema cho người lớn - Chống ngủ ngáy, giảm đau mỏi cổ vai gáy - Phòng ngừa thoái hóa đốt sống cổ - Phong cách Nhật Bản",Gối các loại,18299.0,Gối nêm Hi-Sleep Store,Ema,500.0,1726,650000,325000,50
141231743,Ruột Chăn Bông Trắng Everon Lite chuẩn 5 sao khách sạn,Chăn,2207.0,Everon Official Store,Everon Lite,413.0,127,750000,452000,40
110204562,Túi Lọc Rác Bồn Rửa Chén Bát JOYLOT - Túi Lưới Vải Tự Phân Huỷ Có Chun Miệng Túi - Mifan Hàng Chính Hãng,Phụ kiện nhà bếp khác,76621.0,Mifan Official Store,Joylot,548.0,1746,30000,17900,40
71518864,Nồi Decor Lock&Lock LDE1182IH (18cm) - Màu Kem,Nhà Cửa - Đời Sống,1.0,Tiki Trading,LocknLock,803.0,565,1043000,512000,51
89308474,Thước Dây Da Cuộn Deli - 1.5M - Hồng/ Xanh Lá/ Trắng/ Xanh Dương - 1 Chiếc - 79650,Thước đo các loại,113115.0,Deli Official Store,Deli,638.0,968,45000,25000,44
3677753,Bình Lọc Nước BRITA Flow Basic Blue - 8.2L (Kèm Maxtra Plus) - Hàng Chính Hãng,Nhà Cửa - Đời Sống,6916.0,BRITA VIỆT NAM,Brita,1605.0,3034,2249000,1499000,33
86263672,Nồi quánh chống dính đa năng Dr.Hows Poco,Nồi các loại,175722.0,Dr.HOWS Official,Dr.Hows,638.0,29,1750000,1750000,0
208411197,Đèn bắt muỗi Điện Quang ĐQ EML06L ,Nhà Cửa - Đời Sống,17490.0,Điện Quang Official Store,Điện Quang,27.0,1095,413400,289000,30
205973149,Đồng Hồ Để Bàn lật số cơ học Auto Flip Clock Retro Mac Setup Đồng hồ phong cách vintage cổ điển Sang Trọng chất liệu thép không gỉ,Đồng hồ để bàn,285488.0,Office Chill,OEM,47.0,42,540000,285000,47
199539210,"Dụng Cụ Làm Sạch Tôm Hai Đầu, Dao Làm Lòng Gà, Mổ Cá Cạo Vảy, Lột Bóc Vỏ Tôm, Cua Sò, Dụng Cụ Nhà Bếp Bằng Inox Không Gỉ",Phụ kiện nhà bếp khác,165627.0,LÊ THỊ HƯƠNG VIỆT BẢO TÍN,OEM,92.0,55,25000,13500,46
68279903,Nến Điện Tử Tim Lắc Cao Cấp Mô Phỏng Như Nến Sáp Tặng Kèm Pin,Nến trang trí & Phụ kiện,17480.0,Ghế Nam Việt,OEM,833.0,137,90000,90000,0
13619778,Đồng Hồ Treo Tường P1 (25cm) - Màu ngẫu nhiên,Đồng hồ treo tường,138330.0,TQT Decor,OEM,1367.0,4,80000,80000,0
205531604,"Set Thớt Kháng Khuẩn 5D, Chống Trơn Trượt 35x25 Cm - Hàng Nhập Khẩu",Thớt nhà bếp,193366.0,HOMES STORE,OEM,51.0,87,319000,169000,47
52774383,Đèn LED Đom Đóm Chipsbling Dùng Pin Năng Lượng Mặt Trời ,Đèn khác,291080.0,ShopAnZ,OEM,993.0,0,148999,148999,0
107063648,"Ly nhựa 2 lớp Lock&Lock HAP507 750ml - Hàng chính hãng, có ống hút, có nắp đậy - Tặng kèm cọ rửa",Ly,38510.0,JoyMall LocknLock Chính Hãng,LocknLock,560.0,466,227000,119000,48
207336569,"BIG SIZE - Túi đựng quần áo chăn màn vải canvas chống thấm nước, Thùng giỏ đựng đồ đa năng gấp gọn tiện lợi - Hàng Chính Hãng JYoohome",Tủ,249634.0,Homebox Store,JYooHome,39.0,110,100000,58000,42
59318679,Bộ Ga Gối Cotton Tici Kẻ LIDACO Cao Cấp - Caro Nâu Nhạt - TẶNG 01 VỎ GỐI ÔM,Bộ ga,43482.0,Lidaco Official Store,LIDACO,874.0,504,238000,218000,8
68478297,Combo 2 Ron Thanh Nẹp Xốp Chèn Chắn Cửa Chống Bụi Côn Trùng Dài 90cm Legaxi,Khác,3196.0,Legaxi Official,Legaxi,828.0,3841,36000,36000,0
201112268,"Thảm Nhà Bếp Siêu Thấm Dễ Dàng Vệ Sinh, Thảm Silicon 4 Lớp NAVIVU",Thảm chùi chân,17480.0,Ghế Nam Việt,NAVIVU,81.0,53,129000,129000,0
22764290,Ghế Lùn Xếp Duy Tân - Giao Màu Ngẫu Nhiên,Nhà Cửa - Đời Sống,1.0,Tiki Trading,Duy Tân,1269.0,2828,59000,41000,31
173710560,"Cuộn Khăn Giấy Lau Đa Năng - Chất Liệu Rayon An Toàn - Lau Chén Đĩa , Lau Nhà Bếp..vv - Hàng Chính Hãng",Khăn,137411.0,Phụ Kiện Store 76,PaKaSa,276.0,135,70000,49000,30
72049662,"Combo 6 Túi Giặt Lưới Bảo Vệ Quần Áo, túi lưới mịn polyester bảo quản quần áo",Túi giặt,270513.0,HALOTA,OEM,796.0,1,150000,150000,0
3607659,Kéo cắt cành cây Nhật ,Dụng cụ làm vườn khác,298269.0,ThuyDungShop2002,OEM,1608.0,6,59000,59000,0
14895703,Bộ tua vít đa năng 32 đầu,Máy vặn vít,6351.0,Siêu Thị Linh Kiện,OEM,1343.0,2,52999,52999,0
202805092,"Bình Giữ Nhiệt 800ml Lock&Lock Vacuum Bottle LHC6180 - Hàng Chính Hãng, Bằng Thép Không Gỉ, Có Lưới Lọc Trà Bằng Inox, Mức Giữ Nhiệt Vượt Trội Tặng Kèm Ống Hút Inox",Nhà Cửa - Đời Sống,38510.0,JoyMall LocknLock Chính Hãng,LocknLock,70.0,994,697000,369000,47
74296343,Chảo chiên Lock&Lock Handycook LHD1163 có tay cầm 16cm,Chảo các loại,1.0,Tiki Trading,LocknLock,749.0,855,220000,113000,49
70898819,Giấy ăn giấy gấu trúc Ycool -khăn giấy rút 300 tờ 1bịch 10 gói mẫu trắng,Phụ kiện nhà bếp khác,131980.0,Giấy ycool,ycool,777.0,1866,43000,43000,0
206473614,"Túi Vải Đa Năng Đựng Đồ Quần Áo, Chăn Ga Gối Màn Gấu Bông, Sách Vở Khéo Khoá Deli - Hộp Vải Đựng Đồ Khung Thép Chịu Lực Cao Cấp - Nhiều Size Kích Cỡ Lớn Nhỏ",Tủ,113115.0,Deli Official Store,Deli,44.0,71,135000,75000,44
128206072,"Bộ Cọ Nhà Vệ Sinh, Nhà Tắm Tự Động Không Dây Thông Minh 360 Độ Với 4 Đầu Cọ Thay Thế Tiện Lợi, Đơn Giản Và Dễ Dàng Sử Dụng",Bàn chải,291266.0,KandK12 Shop,OEM,454.0,4,520499,520499,0
167019283,"Đèn Pixar, Đèn Bàn Học Chống Cận Thị, Đèn Làm Việc Để Bàn Bảo Vệ Mắt - Hàng Chính Hãng - VinBuy",Đèn bàn,109746.0,VinBuy,VinBuy,303.0,244,360000,180000,50
120470959,Bình Nước Thuỷ Tinh Luminarc Arc 1.3L - LUBIG2662,Bình đựng nước,189048.0,Luminarc Official Store,Luminarc,493.0,281,111000,50000,55
198097413,Máy Xay Hạt Khô Tiêu Chuẩn Châu Âu Máy Xay Ngũ Cốc Mini Công Suất 300w Lưỡi Dao 6 Cánh Thân Máy Bằng Thép Không Gỉ - Hàng Loại 1 - Chính Hãng MINIIN,Dụng cụ xay,134678.0,Smarthome29,MINIIN,105.0,124,329000,164500,50
160278163,[COMBO] Trà Nam Mỹ Yerba Maté 180g vị Truyền thống + Cốc Gourd và ống hút Bombilla mới,Bình,202853.0,Matéa Yerba Maté,OEM,348.0,218,425000,425000,0
196530625,"Xô nước gấp gọn, xô đa năng vệ sinh nhà cửa, xô giặt lau nhà, chùi kính, xô ô tô Parroti Extra XT01",Bàn chải,96639.0,Parroti Store,Parroti,121.0,113,209000,145000,31
159971094,"Bộ 2 hộp vải đựng đồ 7 ngăn mã HQ2, Combo 2 hộp vải đựng quần áo chia ngăn gọn gàng tiện lợi chất vải Oxford cao cấp miDoctor",Tủ,34473.0,Danido Store,miDoctor,349.0,1028,250000,157600,37
36960736,Dây Đèn LED Trang Trí Bông Tuyết,Đèn khác,273325.0,Bách hóa tổng hợp 247,OEM,1173.0,1,88000,88000,0
