p_id,p_name,p_categories,p_id_shop,p_shop_name,p_brand,p_day_created,p_sold_quantity,p_original_price,p_current_price,p_discount_rate
208413993,Bàn Làm Việc Phong Cách Bắc Âu Thương Hiệu IGEA (Không Bao Gồm Ghế),Nhà Cửa - Đời Sống,48574.0,IGEA Nội Thất Thông Minh,IGA,27.0,2529,335000,335000,0
207335546,Bình đựng nước giữ nhiệt inox 304 JYoohome - Ly cốc giữ nhiệt Iced Americano cao cấp không gỉ uống cà phê dùng văn phòng - Hàng Chính Hãng JYoohome,Bình giữ nhiệt,249634.0,Homebox Store,JYooHome,39.0,35,180000,90000,50
202806140,"Cây Lau Nhà, Chổi Lau Sàn Trần Nhà Tường Kính Hình Tam Giác Đa Năng Tự Vắt Thông Minh Xoay 360 Độ Mẫu Mới - Hàng loại 1.  CHính Hãng MINIIN",Chổi,134678.0,Smarthome29,MINIIN,69.0,83,99000,99000,0
206485286,[Có Combo 5] Hộp Nhựa Đựng Giày Trong Suốt Có Nắp Đậy Nhiều Màu Thông Minh Tiện Lợi Deli - Nhiều Size Có Thể Xếp Chồng,Tủ,113115.0,Deli Official Store,Deli,44.0,86,63000,35000,44
193770021,"Keo siêu dính dán chắc như đóng đinh, keo cơ khí chuyên dùng dán các đồ vật thay thế đinh vít",Khác,275768.0,Gia dụng long anh 966,OEM,151.0,178,15000,15000,0
105170899,"Phân Bón Siêu Đâm Chồi, Vua Đâm Chồi, Giúp Cây Bung Đọt Mạnh, Đâm Chồi Ra Lá Mạnh Mẽ, Chống Nghẽn Đầu Lân Phân Bón Vua Đâm Chồi gói 100gr",Phân bón,282786.0,Cây Xanh Store,OEM,572.0,201,33600,16800,50
197887886,Kệ Nhựa Để Giày Dép 5 tầng  Nhỏ Gọn Chiếm Diện Tích Nhỏ Dễ Lắp Đặt Decor Phòng Đẹp,Kệ & Tủ,106273.0,Hitech07,OEM,108.0,5,47500,47500,0
70824754,"Gối Ôm Lông Vũ Thuần Việt Mircrofiber Cao Cấp 100% Cotton Thoáng Mát, Mềm Mịn, Có Khả Năng Thấm Hút Mồ Hôi Tốt",Gối các loại,56226.0,NỆM THUẦN VIỆT,Nệm Thuần Việt,701.0,584,460000,229000,50
3526073,Bộ Túi Hộp Cơm Thủy Tinh Lock&Lock 3EA LLG428M2 - Xanh Mint,CHƯƠNG TRÌNH KHUYẾN MẠI KHÁC,1.0,Tiki Trading,LocknLock,1619.0,8163,660000,320000,52
58469517,"Dây đèn nháy Led đom đóm trang trí pin dây bóng đèn nháy cao cấp decor nhà cửa, lễ tết, lều trại du lịch, fairy light cao cấp (Tùy chọn màu và chiều dài dây)",Đèn khác,133345.0,DEHA Official Store,DEHA,894.0,1261,165000,165000,0
198057071,Đèn Led Đom Đóm Bọc Nhựa Năng Lượng Mặt Trời Chống Nước Trang Trí Ngoài Trời - Chính Hãng NAVIVU,Đèn ngoài trời,17480.0,Ghế Nam Việt,NAVIVU,106.0,46,190000,190000,0
74380878, CHỔI LÔNG QUÉT BỤI CÁN INOX RÚT GỌN TẶNG KÈM MÓC TREO 3D,Chổi,82579.0,Shop HBH247,HBH,748.0,191,78000,72500,7
96448166,Đồng Hồ LED Để Bàn và Treo Tường Sang Trọng,Đồng hồ để bàn,76451.0,shopbonbon81,Gohanto store,596.0,798,99000,97000,2
193330033,Bóng đèn led 6 cánh 90w siêu sáng,Bóng đèn,263578.0,Dụng Cụ Y Khoa Hoàn Mỹ 1,OEM,155.0,50,135000,135000,0
66964368,Đèn Ngủ Trang Trí Siêu đẹp giúp phòng thêm mê ảo view đỉnh ( giao ngẫu nhiên ),Nhà Cửa - Đời Sống,107651.0,WireShelving,OEM,844.0,91,58950,58950,0
55328992,[Xuất Nhật] Kệ Để Chén Bát Nhựa Inox 2 Tầng Inochi Có Khay Thoát Nước Thông Minh Dùng Để Làm Giá Úp Bát Đĩa Chén Đũa Trên Chậu Rửa,Kệ nhà bếp,17480.0,Ghế Nam Việt,Inochi,952.0,4,339000,339000,0
32072094,"Dầu neem hữu cơ DOCNEEM phòng trị sâu bệnh hoa hồng, phong lan, cây cảnh, dầu neem oil nguyên chất ép lạnh 100ml",Nhà Cửa - Đời Sống,54962.0,Docneem Official,DocNeem,1205.0,1346,150000,150000,0
196675194,Đệm Ngồi 3D Silicon 2 Lớp Tổ Ong Lót Ghế Thoáng Khí Chống Đau Mỏi Lưng Amalife ,Gối các loại,37431.0,Amalife,Amalife,120.0,87,190000,120600,37
89043119, GỐI KÊ CỔ CHỮ U  GỐI CHỮ U VĂN PHÒNG,Gối các loại,298269.0,ThuyDungShop2002,OEM,638.0,0,46999,46999,0
70410304,"Thảm chùi chân, thảm nhà tắm CAO CẤP màu sắc hài hoà dễ trang trí. Thảm chùi chân phù hợp đặt mọi nơi trong nhà",Thảm chùi chân,67869.0,Zen,Friday's,812.0,1290,250000,175000,30
185782595,Khăn mặt lông cừu Hàn Quốc Cao Cấp 30x50 (Loại 1),Khăn,267574.0,bamboo and love,OEM,208.0,200,20000,11600,42
39371667,Hộp gồm 5 vỉ pin kiềm siêu nhỏ A23 12V Panasonic LR-V08T/1B (Hàng chính hãng) ,Pin tiểu,107444.0,Thế Giới Pin Sinh Thái,Panasonic,1156.0,159,160000,160000,0
71625981,Chăn gối văn phòng 2 in 1 hình thú chất lượng cao - Kích thước 1mx1m6,Nhà Cửa - Đời Sống,146536.0,Phan Nguyễn Office,OEM,799.0,186,179000,179000,0
42264813,Kẹp phơi quần áo inox đồ chống gió 11CM,Móc treo,152674.0,nhaxinhxinh,OEM,1139.0,4,58000,58000,0
192635575,Combo Chén/ Bát gáo dừa + Muỗng gỗ dừa DK Harvest - Loại size lớn 12 - 14cm (Loại Xuất khẩu),Tô,15400.0,DK HARVEST,DK Harvest,161.0,132,38000,38000,0
87139382,"GIỎ NHỰA ĐỰNG GIẤY VỆ SINH DÁN TƯỜNG, ĐỰNG ĐỒ ĐA NẮNG KT: 11x14x13.5cm",Kệ nhà tắm,20367.0,VI TÍNH NAM TRUNG HẢI,OEM,645.0,28,8294,8294,0
195962564,Chăn tuyết nhung trẻ em đáng yêu 1mx1m4,Chăn,288642.0,Chăn và gối cho bé,OEM,133.0,12,125000,125000,0
56383693,Combo 300 túi lọc rác bồn rửa bát,Nhà Cửa - Đời Sống,20367.0,VI TÍNH NAM TRUNG HẢI,OEM,937.0,680,62000,62000,0
173903547,Khăn lau nhà bếp siêu thấm hút 2 mặt đa năng mềm mịn - Henrysa,Khăn,132026.0,Gia Dụng Henry,HENRYSA Bạn của mọi nhà,273.0,117,49000,49000,0
108243510,Chảo Inox cao cấp 5 Đáy chống dính siêu bền Sunhouse IN20M2 - Dùng trên mọi loại bếp - Hàng chính hãng,Chảo các loại,1.0,Tiki Trading,Sunhouse,560.0,359,370000,290000,22
182800028,"Bàn làm việc, bàn học chân sắt thiết kế kèm giá sách 2 tầng rất tiện lợi, mặt bàngỗ công nghiệp được bo góc để trách va đập",Bàn ghế làm việc,176006.0,Nội Thất Thông Minh 5C,OEM,225.0,61,1250000,750000,40
195791850,Chảo chống dính Ultra titanium Sunhouse STB - Dùng cho mọi loại bếp  - Hàng chính hãng,Chảo các loại,1.0,Tiki Trading,Sunhouse,135.0,102,560000,415000,26
1453915,Ly Giữ Nhiệt Bằng Thép Không Gỉ Lock&Lock Clip Tumbler LHC4151BLK (540ml) - Đen,Bình giữ nhiệt,1.0,Tiki Trading,LocknLock,1799.0,14597,506000,250000,51
73230427,"Chill Party-Đèn Chiếu Ngàn Sao 6 phong cách kiêm đèn ngủ xoay tự động, tích hợp phát nhạc bằng Bluetooth nhiều màu sắc tuyệt đẹp, sạc lại bằng USB",Đèn khác,133565.0,SmartTech-Shop,SPEVI,771.0,760,380000,196000,48
54625005,Chảo chiên chống dính đáy từ Tefal Sensations H9100514 26cm - Hàng chính hãng,Chảo các loại,14865.0,Gia dụng Tín Phong,Tefal,967.0,108,494000,333888,32
34527170,"Giấy bạc dán tường nhà bếp chống thấm dầu, thấm nước tiện dụng 3mx60cm",Decal & giấy dán tường,256755.0,Trangtrilyly,OEM,1191.0,0,21000,21000,0
120166109,"Bóng Philips LED bulb Essential E27 (5W,7W,9W,11W,13W) - E27 (3000K/6500K)",Bóng đèn,1785.0,Philips Lighting Vietnam,Philips,496.0,1224,66000,44000,33
204816925,"Bộ Đèn Nháy 50M Kim Cương, Dây Led 50M Trang Trí Tiểu Cảnh.",Đèn khác,165627.0,LÊ THỊ HƯƠNG VIỆT BẢO TÍN,OEM,57.0,60,19900,19900,0
164837244,combo 12 hũ thủy tinh đựng sữa chua 100ml mẫu trụ tròn vát eo - nắp nhựa – hủ yaourt thủy tinh siêu trong - Hàng chính hãng,Hũ,96274.0,NHÀ CỦA MẸ,Nhà của Mẹ,313.0,110,65000,65000,0
174609283,Kệ Màn Hình Để Bàn Làm Việc Đơn Giản SIB Decor,Nội thất phòng học,3271.0,SIB Decor,SIB DECOR,266.0,164,250000,169000,32
198058599,Máy Xay Tỏi Ớt Cầm Tay Mini Tiện Lợi Wineless Dễ Dàng Tháo Lắp Vệ Sinh Bằng Tay Máy Xay Thịt Đa Năng Sạc USB Tiện Lợi Xay Các Loại Gia Vị Thịt Cá Tự Động Ngắt Khi Mở Nắp,Dụng cụ xay,109746.0,VinBuy,OEM,106.0,1,168000,168000,0
122939123,"Đệm tựa lưng ghế văn phòng, ô tô cao su non Ema - Vỏ gối 4D tổ ong siêu thoáng - Hàng nhập khẩu",Gối các loại,18299.0,Gối nêm Hi-Sleep Store,Ema,477.0,454,320000,160000,50
213491032,Bàn để ủi quần áo khung bằng thép Lebenlang LBB363,Nhà Cửa - Đời Sống,134974.0,LEbenlang,Lebenlang,9.0,1309,750000,539000,28
161029925,"Cây gạt nước sàn nhà, chổi gạt kính silicone cán inox tùy chỉnh độ dài - Kitimop-G35",Dụng cụ vệ sinh khác,158587.0,Kitimop Official Store,Kitimop,319.0,179,185000,119000,36
158639945,"Hộp 20 Viên Pin AA / AAA Maxell Alkaline 1,5V - Hàng chính hãng",Pin tiểu,86463.0,Phụ Kiện Anh Ngọc,Maxell,352.0,8,140000,140000,0
58828647,"Xe đẩy hàng 4 bánh SUMIKA T150 - Khung thép, tay cầm gấp mở tiện lợi, tải trọng 150kg",Nhà Cửa - Đời Sống,283011.0,Gia dụng Huy Linh,Sumika,883.0,0,949000,949000,0
107351108,Hạt giống Rau Mùng tơi F1 - Nảy mầm cao Titapha,Hạt giống,92052.0,Phú Thành Phát,Titapha,562.0,404,13900,13900,0
80757840,"Combo 3 Hộp Vải Đựng Đồ Đa Năng TD2 – Túi Vải Thụy Điển Không Nắp Bộ 3 Chiếc Sang Trọng, Đẳng Cấp miDoctor",Tủ,34473.0,Danido Store,miDoctor,667.0,1082,200000,147400,26
74155997,Đèn Pin Led Essesa Cầm Tay Có Thể Gắn Xe Đạp - Chính Hãng,Đèn pin,134154.0,Funu Home,Essesa,751.0,10,110000,110000,0
73095635,Giỏ Đựng Đồ Đa Năng Gấp Gọn Tiện Lợi - Màu Ngẫu Nhiên,Giỏ đựng quần áo,115414.0,Gold,OEM,776.0,30,110000,85000,23
191592137,Set quà tặng thảo mộc khô thơm - thương hiệu Citta - trang trí nhà cửa + thơm nhà,Nến trang trí & Phụ kiện,159301.0,Thế giới mùi hương tự nhiên,Citta,169.0,50,220000,220000,0
74285588,Khăn tắm lông cừu Hàn Quốc,Khăn,53713.0,linhkien1984,OEM,749.0,6,32900,32900,0
27656117,"Thùng rác nhựa văn phòng, kiểu Âu - Fitis 2 lớp (xám) - ROM3-909",Thùng rác,24615.0,KENZIO,Fitis,1078.0,69,190000,152000,20
195928002,Combo Chai Nhựa HDPE (250ml - 500ml - 1000ml) Có Nắp + Seal Chống Tràn,Bình đựng nước,302028.0,Gia Dụng Hoàng Phát,OEM,134.0,30,22500,22500,0
120339115,"Thanh xốp chắn cửa đa năng chống bụi, chống va đập khi gió mạnh",Khác,8426.0,Bao Bì Hiếu,OEM,494.0,0,9999,9999,0
34812576,Pin Đại Panasonic Ankaline LR20T/2B Hàng Chính Hãng,Nhà Cửa - Đời Sống,1242.0,"Vo Hoang Trading Co.,Ltd",Panasonic,1189.0,45,90000,90000,0
19822607,"Cân tiểu ly điện tử 5kg phím cảm ứng - cân tiểu li điện tử có độ chính xác cao, có lỗ treo tiện lợi",Đồ dùng nhà bếp khác,21344.0,NGUYỄN ĐẠT SHOP,OEM,1303.0,17,185000,185000,0
145750524,"Bộ Giá Đỡ Ke Bàn Gấp Treo Tường KUNBE, Bản Lề Gập Thông Minh Tiết Kiệm Không Gian, Chịu Tải Tốt",Nội thất phòng học,61513.0,chat24h,KUNBE,397.0,226,135000,111500,17
114633173,Bộ Khay đựng đồ ăn kèm phụ kiện bằng Lúa Mạch - Hàng Chính Hãng ,Khay,137411.0,Phụ Kiện Store 76,PaKaSa,531.0,9,150000,110000,27
127126066,Hộp đựng bàn chải đánh răng diệt khuẩn bằng tia cực tím UV,Khác,254353.0,khoaitay boutique,OEM,459.0,0,129986,129986,0
75707305,Bộ May Vá Quần Áo Đa Năng Cho Gia Đình KUNBE Kèm Hộp Đựng Kim Chỉ,Phụ kiện phòng ngủ,61513.0,chat24h,KUNBE,722.0,476,70000,51400,27
36302375,Túi Đựng Hộp Cơm Giữ Nhiệt Đa Năng Họa Tiết Cá Và Sóng Biển Siêu Hot - Vàng,Túi đựng hộp cơm,273327.0,Gia dụng thông minh HH,OEM,1177.0,0,40500,40500,0
90439729,Bút thử điện dùng trong gia đình sieu bềnHàng cao cấp,Khác,252842.0,SHOP 94,OEM,634.0,0,30000,24200,19
152209577,Bộ miếng nhấc nồi chống nóng rẻ ( 1 bộ gồm 2 miếng ),Phụ kiện nhà bếp khác,47072.0,Quynhthy,OEM,378.0,149,10000,10000,0
207200186,"Bộ bình giữ nhiệt kèm cốc sang trọng, Cốc Ly đựng nước giữ nhiệt Vacuum Bottle INOX 304 500ml - Chính Hãng JYoohome",Bình giữ nhiệt,249634.0,Homebox Store,JYooHome,41.0,41,300000,150000,50
113458874,Tủ Để Đồ Thông Minh S Smart Tận Dụng Không Gian Cạnh Cửa Sổ - GP131,Kệ & Tủ,48574.0,IGEA Nội Thất Thông Minh,IGA,537.0,1558,415000,396000,5
106808360,"Bình Giữ Nhiệt Lock&Lock Riga Tumbler LHC4160 (897ml) - Hàng Chính Hãng, Bằng Thép Không Gỉ, Có Lưới Lọc Inox - Tặng Kèm Ống Hút Và Cọ Rửa Ống Hút",Bình giữ nhiệt,38510.0,JoyMall LocknLock Chính Hãng,LocknLock,553.0,373,735000,389000,47
93760107,"Dây đèn trang trí ngoài trời chống nước dùng cho quán cà phê, trà chanh, trà sữa đuôi đèn chống nước -thương hiệu Kiotool",Đèn khác,7241.0,KIOTOOL Official Store,KIOTOOL,618.0,623,103000,103000,0
71518869,Nồi Decor Lock&Lock LDE1202IH (20cm) - Màu Navy,Nhà Cửa - Đời Sống,1.0,Tiki Trading,LocknLock,803.0,758,1098000,539000,51
5980477,Bình Ngâm Rượu Kim Cương Thủy Tinh 8833 Có Van,Bình đựng nước,72116.0,MimiShoping,OEM,1540.0,910,139000,139000,0
143644945,"Decal dán tường ngày tết Hoa Mai, Hoa Đào Sticker Decal Trang Trí Tết",Decal & giấy dán tường,2684.0,HKT Home Shopping,ZOOYOO,405.0,148,70000,40000,43
141230683,Hạt xốp làm đầy ghế lười - HXWBCK,Bàn ghế các loại,239917.0,CUCKOO BEAN BAG,OEM,413.0,79,108000,108000,0
54478757,"Đèn Bàn Học Đọc Sách, Làm Việc (Học Sinh, Sinh Viên, Văn Phòng) LED Chống Cận, Cảm Ứng Tích Điện Pin 3200mAh eLights TD-618",Nhà Cửa - Đời Sống,97355.0,Future Store,eLights,965.0,1818,300000,249000,17
173768367,"Hộp đựng đồ chia ngăn sắp xếp quần áo Danido - Khay đựng đồ 7 ngăn tiện ích, chất liệu cao cấp",Tủ,34473.0,Danido Store,miDoctor,274.0,319,150000,77800,48
207197323,"Túi treo túi xách đồ dùng đa năng, Túi treo giỏ xách, bóp ví 6 ngăn chống bụi bẩn có móc treo xoay 360 độ - Chính hãng JYoohome",Tủ,249634.0,Homebox Store,JYooHome,41.0,33,100000,60000,40
116191376,"Nhang trầm hương tự nhiên Thiên Mộc Hương 30cm, Ít Khói, Thơm Nhẹ, Dễ Chịu, Không kích mũi",Hương,1795.0,Thiên Mộc Hương Official Store,Thiên Mộc Hương,471.0,325,396000,297000,25
125968190,"Đèn Ngủ Để Bàn Mặt Trăng, Đèn Trang Trí Decor - Điều Chỉnh Độ Sáng Theo Ý Muốn - Hàng Chính Hãng - VinBuy",Đèn ngủ,109746.0,VinBuy,VinBuy,463.0,84,250000,125000,50
78025846,Khăn tắm Bamboo Life BL058 hàng chính hãng được làm từ sợi tre thiên nhiên mềm mại kháng khuẩn siêu thấm hút an toàn cho da,Khăn,152044.0,Bamboo Life Official Store,Bamboo Life,677.0,2363,59000,59000,0
50272433,"Đèn LED Bóng Tròn Pha Lê Bọt Khí Trang Trí Lễ Tết, Sinh Nhật, Nhà Cửa - Nhiều Kích Cỡ",Đèn khác,17480.0,Ghế Nam Việt,OEM,1029.0,414,69000,69000,0
198057044,Dây Đèn LED Edison S14 Năng Lượng Mặt Trời Chống Nước Trang Trí Ngoài Trời - Chính Hãng NAVIVU,Đèn ngoài trời,17480.0,Ghế Nam Việt,NAVIVU,106.0,14,660000,660000,0
104681323,Màng bọc PE chấm đứt 60m (M) (Tặng thêm màng bọc 30m) MyJae,Màng bọc thực phẩm,190794.0,MyJae Flagship Store,MyJae,573.0,498,99000,55000,44
54156958,Pin Sạc Energizer AAA 700mAh Power Plus,Nhà Cửa - Đời Sống,1242.0,"Vo Hoang Trading Co.,Ltd",Energizer,966.0,371,145000,145000,0
143779168,Thảm ngủ cá nhân văn phòng ,Chiếu,160163.0,K KRISHNA,Krishna,404.0,654,25000,25000,0
52260520,Pin AA Energizer LR6 AM3 1.5V,Nhà Cửa - Đời Sống,11618.0,MYMYMART,Energizer,1001.0,1278,39000,39000,0
149376396,"Túi peva SmileBox size lớn bọc nhiều bộ quần áo treo tủ chống thấm, chống bụi, có khóa kéo đôi tiện lợi nhiều size ngắn dài 90cm 110cm- Hàng chính hãng",Tủ,10380.0,PhuKienMini,SmileBox,386.0,55,105000,103000,2
183254388,"Ô (Dù) Tự Động 2 Chiều Cao Cấp Teement, Che Mưa, Che Nắng, Chống UV - Hàng Chính Hãng",Áo mưa,147879.0,Thanh Giàu,TEEMENT,218.0,52,175000,175000,0
36935892,Combo 10 khăn lau bếp đa năng - KL29 (Giao ngẫu nhiên mẫu),Nhà Cửa - Đời Sống,134133.0,An Vũ Techcom,OEM,1171.0,39,15000,15000,0
159236996,Bật lửa điện độc lạ tạo 4 tia plasma chóng gió sạc pin độc đáo,Than,184269.0,Quang Duy Plasma,OEM,352.0,112,129000,119300,8
59149834,"Giường xếp đa năng, giường tre gấp gọn",Nội thất phòng ngủ khác,169565.0,SharkDecorrHN,OEM,877.0,0,1900000,1900000,0
133846119,"Hộp Cơm Giữ Nhiệt, Hộp Cà Men Inox SEASY SS35, Giữ Nhiệt Thức Ăn Lâu Hơn, 2 Lớp Cách Nhiệt, Thiết Kế Nắp Chống Tràn, An Toàn Sức Khỏe, Tặng Kèm Túi Giữ Nhiệt, Hộp Đựng Bộ Đũa Thìa, Miếng Cọ Rửa Tiện Lợi– Hàng Chính Hãng",Hộp đựng thực phẩm,195068.0,SEASY TECH STORE,SeaSy,436.0,240,389000,255000,34
21006786,Kệ Giày Dép 6 Tầng Rộng 60cm,Nhà Cửa - Đời Sống,16412.0,nolulu shop,OEM,1288.0,65,788200,600000,24
87941678,Sạc pin Camelion BC-0904 sạc được pin AA/AAA/9V,Máy sạc pin,1242.0,"Vo Hoang Trading Co.,Ltd",Camelion,639.0,31,190000,190000,0
2873653,Kệ Đỡ Màn Hình Máy Tính Monitor Stand Plyconcept MSM01004 ( 490 x 200 mm) - Gỗ Sồi,Kệ & Tủ,1303.0,MipuMade,Plyconcept,1644.0,915,380000,290000,24
52785428,"Chốt khóa cửa trượt an toàn cho văn phòng, căn hộ, khách sạn chống mở từ ngoài - HOBBY KCT1",Ổ khóa,20023.0,Hobby Home Decor,Hobby Home Decor,992.0,210,125000,85000,32
26602007,Kẹp Bẫy Bắt Chuột Thông Minh,Dụng cụ diệt côn trùng khác,54154.0,hoangvietstore,OEM,1230.0,2,9900,9900,0
131894766,Dao thái thịt bò siêu mỏng - thép Nhật -Không rỉ-Chuôi gỗ hương,Dao các loại,232776.0,Shop dao le ngoc,OEM,442.0,16,135000,120000,11
76369610,Ca lọc cặn dầu bằng thép không gỉ - Chính hãng (Giao ngẫu nhiên),Nhà Cửa - Đời Sống,163615.0,HIBARWELL,BARWELL,709.0,201,195000,185000,5
198619155,Hộp Vải Đa Năng Gấp Gọn Có Khung Thép Nhiều Hoa Văn - Chính Hãng NAVIVU,Tủ,17480.0,Ghế Nam Việt,NAVIVU,99.0,6,139000,139000,0
34574806,"BƠM ĐIỆN 2 CHIỀU DÙNG BƠM PHAO, BỂ PHAO, NỆM HƠI",Khác,298269.0,ThuyDungShop2002,OEM,1185.0,0,80000,80000,0
52578184,"Tuýp Keo Dán Đồ Gia Dụng Siêu Dính, Keo Dán Kim Loại Cao Cấp",Khác,189795.0,MarryStore,OEM,996.0,504,15000,15000,0
173971270,"Kệ chén bát 2 tầng trên bồn rửa tiện lợi VANDO bằng thép carbon cao cấp không gỉ, giá úp bát, kệ để chén sạch sẽ nhà bếp",Kệ nhà bếp,157549.0,Vando Official Store,VANDO,273.0,50,1199000,799000,33
138534630,Tủ quần áo KATA 5 tầng - Nhựa Talopa,Tủ,238272.0,PHÚ MỸ furniture,Duy Tân,421.0,435,1260000,1045000,17
96271704,"Ổ Cắm Điện Thông Minh XSmart Đa Tính Năng Chống Giật Hàng Siêu Cao Cấp,  Chống Cháy Nổ Chịu Được Công Suất Cao, Chính Hãng",Ổ cắm,152209.0,XSmart Official Store,XSmart,604.0,822,169000,139000,18
70684212,BG Ghế lưới làm việc ghế xoay văn phòng cao cấp mới 2020 Mẫu B200 BLACK (hàng nhập khẩu),Bàn ghế làm việc,1409.0,BG Việt Nam Official Store,BG,809.0,1409,969000,511200,47
79323086,"Đèn Ngủ kiêm Đèn Chiếu Ngàn Sao 6 phong cách xoay tự động, tích hợp phát nhạc bằng Bluetooth nhiều hiệu ứng, sạc bằng USB",Đèn ngủ,133565.0,SmartTech-Shop,SPEVI,672.0,205,380000,196000,48
57335326,"Ghế xếp thư giãn SUMIKA 179A - Khóa kim loại, khung thép tròn, tải trọng 200kg",Bàn ghế các loại,283011.0,Gia dụng Huy Linh,Sumika,918.0,10,825000,825000,0
173999814,"Kem giảm mụn Viêm, mụn ẩn KLENZIT C (15g)",Phụ kiện phòng ngủ khác,282193.0,BEAUTY CHOICE,OEM,273.0,276,130000,130000,0
188838171,ĐÈN LED LASER CHIẾU SAO BẦU TRỜI ĐẦU CẮM USB,Đèn khác,132726.0,ATN SYSTEM,OEM,189.0,28,54000,54000,0
73829087,Kệ rổ đựng đồ rửa chén có khay hứng nước HOBBY KRC5 - Inox 304 nhỏ gọn tiện lợi không rỉ sét,Kệ nhà bếp,20023.0,Hobby Home Decor,Hobby Home Decor,757.0,877,159000,105000,34
63051860, Đèn Học Làm Việc Đọc Sách Để Bàn Pixar Chống Cận Thị Bảo Vệ Mắt - Hàng Chính Hãng eLights,Nhà Cửa - Đời Sống,97355.0,Future Store,eLights,853.0,2580,189000,169000,11
114204740,Bình giữ nhiệt inox 304 Sunhouse 900ml KS-TU900I,Bình giữ nhiệt,182530.0,GIADUNG TẤN PHÁT,Sunhouse,533.0,1,143500,143500,0
35958689,"Thang nhôm rút đôi chữ a Nhật Bản HAKAWA HK256 (5,6M) - Phân phối chính hãng - Nhỏ gọn tiện lợi ",Nhà Cửa - Đời Sống,8081.0,Thang Nhôm HAKAWA,HAKAWA,1181.0,239,5600000,3900000,30
26491454,Bộ 1 gói Hạt giống rau bạc hà italian (húng bạc hà),Nhà Cửa - Đời Sống,42056.0,KoyShop,OEM,1153.0,1584,6895,6826,1
172340730,"Túi Zip Bạc 1 Mặt Bạc, 1kg Túi Zip Bạc Đáy Đứng Đựng Thực Phẩm Cao Cấp",Túi,233963.0,Siêu thị túi đóng gói Elas House,OEM,284.0,46,89000,45000,49
137226640,Nhang xanh trầm hương phổ thông - Hộp 500 gram,Hương,183040.0,HOÀNG VÂN SHOP,Nhang Xanh,426.0,399,165000,165000,0
16170433,"Combo 3 lõi lọc nước yamato 1,2,3 - 10 inch",Lõi lọc,8413.0,SMY (Tp.HCM),YAMATO,1328.0,805,190000,120100,37
1021671,Màng Bọc Thực Phẩm Ringo ST612SC 8936009561872 (30cm x 500m),Màng nhôm,98343.0,sieuthiat68,RINGO,1840.0,528,255000,238500,6
50393230,Nhang Sạch Phòng Máy Lạnh - Ít khói - Hương trầm dịu nhẹ - Chân tăm mộc - Nhang Xanh ,Nhà Cửa - Đời Sống,3280.0,Nhang Xanh Official,Nhang Xanh,1027.0,480,27000,25200,7
11747533,Máy Khò Nhiệt màng  Khò nhiệt 2000W + móc khóa kĩ thuật,Các loại máy khác,249606.0,gia dụng kim biên,OEM,1388.0,0,366450,366450,0
50231888,Bộ Bàn ăn gỗ sồi mặt đá  Granite 6 ghế hàng chuẩn xuất khẩu ,Bàn ghế,218707.0,DAN ORGANIC,OEM,1029.0,0,10789000,10789000,0
142331006,Chuôi đèn liền công tắc Điện Quang ĐQ LH E27 ,Linh kiện đèn,17490.0,Điện Quang Official Store,Điện Quang,408.0,235,49800,40000,20
51969021,"Màng PE, Màng bọc hàng, Màng quấn pallet 50cm x 2kg",Khác,20680.0,SG Titapha Co LTD,Titapha,1003.0,457,159000,123000,23
160290544,"Dây chằng hàng, buộc hàng tăng đơ không móc, màu cam bản 2.5cm chiều dài 2 đến 15m - NIKITA",Dụng cụ ngoài trời khác,19288.0,NIKITA Official Store,Nikita,348.0,125,55680,46000,17
51462534,Thùng rác đạp chữ nhật Hiro 20L - trắng xanh đậm,Thùng rác,17480.0,Ghế Nam Việt,Inochi,1010.0,25,289000,289000,0
28039453,Bộ dụng cụ thông tắc bồn cầu và các loại ống nước bằng khí nén - Canino cao cấp,Nhà Cửa - Đời Sống,298269.0,ThuyDungShop2002,OEM,1227.0,0,179000,179000,0
59452929,Chén Chấm Sứ Trắng Bên Trong Nhiều Màu- Cổ Điển pha Lẫn Hiện Đại- Gốm Sứ Nhật,Tô,135995.0,XUANsHome,OEM,869.0,235,22000,22000,0
7583254,Vòi xịt vệ sinh inox - Vòi xịt bồn cầu inox SUS 304 cao cấp,Vòi nước các loại,291069.0,RUBY2,OEM,1505.0,7,151998,75999,50
184334157,"Đèn Học , Đèn Đọc Sách Để Bàn Chống Cận Có Ống Đựng Bút , Giá Đỡ Điện Thoại , Cổng Sạc Usb - Hàng Chính Hãng ",Đèn bàn,137411.0,Phụ Kiện Store 76,PaKaSa,217.0,6,380000,266000,30
95760230,[Quà Tặng] Gối Ôm Gòn Cao Cấp Thuần Việt,Ruột gối,56226.0,NỆM THUẦN VIỆT,Nệm Thuần Việt,151.0,93,599000,599000,0
33337588,Áo Bọc Nệm Hai Mặt Có Khóa Đủ Kích Thước 10cm - Màu Ngẫu Nhiên,Bộ ga,254905.0,Cửa hàng nệm trường phát,Happy,1199.0,67,95000,95000,0
38304453,"Ổ Cắm Điện Đa Năng 4 Tầng 16 Chân Cắm Điện, 3 Cổng USB Siêu tiện lợi",Ổ cắm,64160.0,Công Nghệ July,OEM,1162.0,5,215000,215000,0
22131223,Giấy Dán Tường Đáng Yêu Cho Bé,Decal & giấy dán tường,256755.0,Trangtrilyly,OEM,1275.0,0,78000,78000,0
44145738,kệ để gia vị KN 133,Kệ nhà bếp,20367.0,VI TÍNH NAM TRUNG HẢI,OEM,1122.0,0,139000,139000,0
21674758,"Bộ 6 thìa , muỗng gỗ NHÃN nhỏ múc gia vị màu nâu 9cmx3cm-TG22",Nhà Cửa - Đời Sống,20195.0,Mỹ Nghệ Việt,Vitrapro,1275.0,48,120000,120000,0
48476515," Set 10 Kẹp miệng túi đồ ăn, thực phẩm - Màu ngẫu nhiên",Nhà Cửa - Đời Sống,131912.0,Shop Thịnh,OEM,1057.0,55,19000,19000,0
76404965,Bộ 2 Vòng sứ cô đặc dùng cho ấm sắc thuốc - mẫu ngẫu nhiên,Phụ kiện nhà bếp khác,131912.0,Shop Thịnh,OEM,710.0,62,32000,32000,0
372930,Thớt Nhựa Kháng Khuẩn Kova Hoa Sen TT- Xanh Lá,Thớt nhà bếp,1.0,Tiki Trading,KOVA,2138.0,219,260000,205000,21
17491634,"Dây xịt vệ sinh , dây sen - inox 304 dài 1,2m",Vòi nước các loại,5697.0,Huy Tưởng Tphcm,OEM,1316.0,24,30000,28200,6
580669,Thước Cuộn Tolsen 36004 - 5 Mét,Thước đo các loại,10508.0,Khởi Phát,Tolsen,2128.0,155,90000,90000,0
22081865,TÚI ÁO BÌNH GIỮ NHIỆT TIỆN LỢI,Nhà Cửa - Đời Sống,17480.0,Ghế Nam Việt,OEM,1274.0,1182,40000,40000,0
152780561,100 Tờ Giấy Nến Nồi Chiên 23cm Đục Lỗ Dùng Hấp Nướng Loại 1 Chính Hãng - Thấm Dầu Mỡ - An Toàn Cho Sức Khỏe,Phụ kiện nhà bếp khác,203034.0,Gia Dụng Trí Vũ,MINIIN,376.0,5,43000,43000,0
