p_id,p_name,p_category,p_id_shop,p_shop_name,p_brand,p_sold_quantity,p_original_price,p_current_price,p_discount_rate
187622257,Bộ 3 Kệ Trang Trí Treo Góc Tường SIB DECOR Hình Cung Tròn,Nhà Cửa - Đời Sống,3271.0,SIB Decor,SIB DECOR,227,360000,239000,34
74607711,"Bộ Lục Giác Đầu Bi 09 Chi Tiết HARDEN 540603 Loại Ngắn, Hàng Chính Hãng, Được Làm Từ Chất Liệu Thép Chrome Vanadium, Độ Cứng Cao. Sản Phẩm Đựng Trong Vỉ Nhựa Tiện Lợi Và Bền Đẹp. Thông số kỹ thuật : 1,5、2、2,5、3、4、5、6、8、10mm",Bộ lục giác,60332.0,Hộp Dụng Cụ Đa Năng, Harden,105,70000,70000,0
54483857,"Đèn Bàn Học Đọc Sách, Làm Việc (Học Sinh, Sinh Viên, Văn Phòng) LED Chống Cận, Cảm Ứng Tích Điện Pin 2500mAh Elights BT-618",Nhà Cửa - Đời Sống,97355.0,Future Store,eLights,2086,400000,249000,38
179994345,Bộ 2 Đĩa Thuỷ Tinh Luminarc Evolution Trắng 27cm- LUEV63371,Tô,189048.0,Luminarc Official Store,Luminarc,212,171000,171000,0
169111678,"Chảo Xào, Inox 3 Lớp Liền Đáy Trimax ELMICH El3796 26cm Hàng Chính Hãng",Chảo các loại,72525.0,Elmich Outlet,Elmich,35,899000,615000,32
142403591,Combo 10 bịch(300 tờ/bịch)Giấy rút cầu vồng cao cấp My Lan,Phụ kiện nhà bếp khác,136140.0,MinKstore,OEM,156,55000,55000,0
148026925,Bình Đựng Nước 2L Dễ Thương Có Vạch Báo Giờ Uống Nước - Hàng Loại 1 - Chính Hãng MINIIN,Bình đựng nước,203034.0,Gia Dụng Trí Vũ,MINIIN,57,102000,102000,0
40752584,"PHÂN BÓN LÁ RA RỄ CỰC MẠNH N3M - KÍCH PHÁT RA RỄ - GIÂM, CHIẾT, GHÉP CÀNH - THÍCH HỢP SỬ DỤNG CHO LAN, MAI, KIỂNG LÁ",Phân bón,42056.0,KoyShop,OEM,389,24749,24749,0
146736019,Thiết Bị Đo Nhiệt Độ Và Độ Ẩm Xiaomi Mi Temperature And Humidity Monitor 2 (NUN4126GL),Máy đo  nhiệt độ,67624.0,AKIA SmartHome Store,Xiaomi,39,160000,160000,0
20634384,Ổ Khóa inox Mật Mã 4 Số,Ổ khóa,131912.0,Shop Thịnh,OEM,132,43000,43000,0
103379536,Máy Đuổi Muỗi Bằng Sóng Siêu Âm - Máy Đuổi Muỗi Điện Tử - Máy Đuổi Côn Trùng Tiện Lợi - K1107 - Màu trắng - đuổi muỗi,Nhà Cửa - Đời Sống,294601.0,Thanh Tung international,OEM,0,584000,584000,0
38306937,Vỉ 5 Viên Pin CR1616 Lithium 3V Panasonic - Hàng Chính Hãng,Nhà Cửa - Đời Sống,1242.0,"Vo Hoang Trading Co.,Ltd",Panasonic,178,84000,84000,0
131030960,"Máy cắt lông xù và hút bụi quần áo CTFAST-LK618 thiết kế nhỏ gọn, pin sạc tích điện, tặng kèm lưỡi dao thay thế",Phụ kiện giặt ủi khác,54602.0,HUY HÙNG AFAST,CTFAST,186,123000,123000,0
107443342,Hạt giống Rau Dền đỏ F1 - Nảy mầm cao Titapha,Hạt giống,20680.0,SG Titapha Co LTD,Titapha,20,14000,14000,0
4581767,Bình Thủy Inox Rạng Đông RD1040 ST2 (1L),Bình giữ nhiệt,389.0,Đại Phát Tài,Rạng Đông,689,159000,155820,2
151555811,Bàn làm việc có kệ,Bàn ghế làm việc,246511.0,NTHG168,OEM,89,359000,359000,0
74380766,Kệ đựng đũa muỗng dao thớt 3 trong 1 HOBBY KDMT Inox 304 khay nhựa cao cấp,Phụ kiện nhà bếp khác,20023.0,Hobby Home Decor,Hobby Home Decor,114,469000,399000,15
193439461,Đèn Bàn Học LED Đọc Sách Học Làm Việc Chống Cận - 5 Cấp Độ Chỉnh Ánh Sáng - 2 Trục Điều Chỉnh Góc Sáng - Gấp Gọn Tiện Lợi MR-PH338,Đèn bàn,160175.0,MIREN TECH,MIREN,7,699000,568000,19
53926593,"Combo 6 cuộn Túi đựng rác văn phòng, Bao đựng rác trường học tiện lợi 3 màu size đại 64x78",Túi đựng rác,19256.0,Công ty TNHH LPS VINA,Túi ni lông tự phân hủy sinh học GIMEX II,182,99000,72000,27
49741952,Bộ 2 thìa khuấy 2 đầu inox cao cấp,Dụng cụ pha chế,186548.0,Gia dụng Bảo Trân,OEM,4,45000,45000,0
140791193,Bóng đèn LED Bright PHILIPS E27 - Thay thế hoàn hảo cho bóng đèn Compact - Hàng Chính Hãng,Bóng đèn,232117.0,QUOSOM,Philips,694,90000,56000,38
108243500,Chảo Inox cao cấp 5 Đáy Sunhouse IN24M2 - Dùng trên mọi loại bếp - Hàng chính hãng,Chảo các loại,1.0,Tiki Trading,Sunhouse,129,510000,300000,41
197104665,"Kệ gỗ decor Monrovia để cây trang trí trong nhà, ban công siêu bền bỉ, tiêu chuẩn Châu Âu",Kệ & Tủ,165121.0,Monrovia Official,Monrovia,14,600000,430000,28
11220810,Dao Nhà Bếp Santoku Knife Lock&Lock Ckk312 (300mm),Nhà Cửa - Đời Sống,1.0,Tiki Trading,Lock&Lock,644,402000,201000,50
4497007,"Keo dán giày, đồng hồ Selleys Kwik Grip 35ML",Nhà Cửa - Đời Sống,1028.0,TAVANA,Selleys,1518,19000,19000,0
182786661,"Bịt Mắt Ngủ Hai Mặt Xịn Xò, Gọn Nhẹ, Cho Nam Và Nữ Phù Hợp Cho Du Lịch Và Văn Phòng",Phụ kiện phòng ngủ khác,67869.0,Zen,SHOFUKA,146,115000,61000,47
71518884,Chảo Decor Lock&Lock LDE1243IH (24cm) - Màu Kem,Nhà Cửa - Đời Sống,1.0,Tiki Trading,Lock&Lock,429,693000,416000,40
110204562,Túi Lọc Rác Bồn Rửa Chén Bát JOYLOT - Túi Lưới Vải Tự Phân Huỷ Có Chun Miệng Túi - Mifan Hàng Chính Hãng,Phụ kiện nhà bếp khác,76621.0,Mifan Official Store,Joylot,1405,30000,17900,40
72016703,"Bếp Nướng Than Hoa Phiên Bản Cải Tiến Loại Dài 2020 Chống Cháy Thực Phẩm, An Toàn Sức Khỏe, Không Cần Quạt, Bếp Nướng Không Khói, Bếp Nướng Ngoài Trời, Bếp Nướng Than Hoa Vuông - Tặng Kèm 3 Móc  Kim Loại Chữ S Treo Đồ Tiện Lợi",Bếp nướng,61513.0,chat24h,KUNBE,515,400000,229000,43
92441037,"[LOẠI XỊN - CÓ TẶNG BƠM TAY] Bộ 8 Túi Hút Chân Không Đựng Quần Áo, Chăn Màn CỠ ĐẠI Cao Cấp miDoctor",Phụ kiện phòng ngủ,34473.0,Danido Store,miDoctor,936,250000,188000,25
51915247,Combo 200 túi lọc rác bồn rửa bát,Phụ kiện nhà bếp khác,64160.0,Công Nghệ July,OEM,609,55000,55000,0
158462914,"Cây lau kính gạt chùi kính đa năng 2 đầu trong 1 MyJae, cây lau kính cán dài 2 mặt thông minh",Dụng cụ vệ sinh khác,190794.0,MyJae Flagship Store,MyJae,86,390000,159000,59
185647202,"Tranh Cát Chảy Chuyển Động 3D KUNBE Nhiều Mẫu Trang Trí Nhà Cửa Bàn Làm Việc, Giảm Stress",Nhà Cửa - Đời Sống,61513.0,chat24h,K KUNBE everything you need,176,209000,209000,0
106208918,"Ô dù che mưa cỡ lớn tự động đóng mở, gấp gọn tiện lợi - Thiết kế mở ngược chống ướt khi mở, gập - Chính hãng NIKITA",Áo mưa,19288.0,NIKITA Official Store,Nikita,245,249000,166000,33
109125761,Combo 5 miếng keo dính chuột siêu dính,Dụng cụ diệt côn trùng khác,258659.0,Pin Bom Shop,OEM,1,26000,26000,0
51472857,Kệ đa năng Tokyo 3 tầng cao cấp,Kệ nhà bếp,8526.0,AZO MART,Inochi,343,262000,126000,52
162366804,Đồng Hồ Dán Tường DIY VINAVU Sang Trọng Cỡ Siêu Lớn Nhiều Mẫu,Đồng hồ treo tường,17480.0,Ghế Nam Việt,OEM,51,170000,170000,0
80657249,"Hộp Vải Đựng Đồ Đa Năng TD3 – Túi Vải Thụy Điển Có Nắp Rời Sang Trọng, Đẳng Cấp miDoctor",Tủ,34473.0,Danido Store,miDoctor,691,200000,119000,41
176677477,Màng bọc thực phẩm Laspalm Chính Hãng cuộn bọc thực phẩm thức ăn có dao cắt tiện lợi Laspalms,Màng nhôm,199817.0,Besthome Store,OEM,30,96000,96000,0
137226640,Nhang xanh trầm hương phổ thông - Hộp 500 gram,Hương,183040.0,HOÀNG VÂN SHOP,Nhang Xanh,367,165000,165000,0
91475535,"Áo Mưa Cánh Dơi Rằn Ri, Áo Mưa Xẻ Tà Màu Lính Vải Dù Siêu Dày 1M4, Chống Thấm Hiệu Quả, Phù Hợp Nam Và Nữ, Có Túi Đựng",Áo mưa,100919.0,XỐP DÁN TƯỜNG 3D SÀI GÒN,XUDI,139,125000,125000,0
176734294,Tranh dán tường poster truyện tranh anime decor trang trí góc học tập làm việc phòng ngủ rẻ vô địch,Decal & giấy dán tường,114197.0,Bách Lộc Toàn Gia,OEM,172,25000,25000,0
177780309,Nến thơm Candle Cup/Agaya - Hương khơi gợi đặc điểm địa danh HỘI AN,Nến trang trí & Phụ kiện,159301.0,Thế giới mùi hương tự nhiên,Candle Cup,35,120000,120000,0
144549679,Hạt Giống Hoa Sao Nhái Kép Nhiều Màu - Hạt giống Rạng Đông,Hạt giống,42056.0,KoyShop,Hạt giống Rạng Đông,37,8599,8513,1
73406110,Đệm nệm lót ghế ngồi văn phòng tựa lưng thư giãn Have a New Day,Gối các loại,146536.0,Phan Nguyễn Office,OEM,78,250000,250000,0
17510214,Bộ 20 gói giấy ăn than tre gấu trúc,Phụ kiện nhà bếp khác,20367.0,VI TÍNH NAM TRUNG HẢI,OEM,117,70000,70000,0
51461989,Thùng rác đạp chữ nhật Hiro 15L,Thùng rác,17480.0,Ghế Nam Việt,Inochi,144,179000,179000,0
12461025,"Nước cắm hoa công nghệ nano đồng Fresh Flowers AHT 430ml - giúp hoa lâu tàn, không thối nước",Đèn xông tinh dầu,15981.0,Nano AHT,Nano AHT,153,55000,49500,10
197148273,"Combo 4 Túi Rác Màu Soji Siêu Dai Tự Hủy Bảo Vệ Môi Trường Hàng Xuất Nhật , EU - Chính hãng inochi ( Tặng kèm khăn lau pakasa) Màu ngẫu nhiên ",Túi đựng rác,137411.0,Phụ Kiện Store 76,Inochi,6,169400,89000,47
5736583,"Cân điện tử xách tay, cân hành lý sân bay, cân du lịch K-8",Nhà Cửa - Đời Sống,131912.0,Shop Thịnh,OEM,56,77900,77900,0
200762341,Cốc Giữ Nhiệt Ly Giữ Nhiệt Inox 304 Có Ống Hút Ly Uống Coffee 600ml,Nhà Cửa - Đời Sống,35488.0,Aquaria,OEM,5,358000,179000,50
52581646,Dây Đèn LED Rèm Trăng Sao Chống Thấm Nước Trang Trí Ngoài Trời - Dài 2.5 Mét,Đèn khác,17480.0,Ghế Nam Việt,OEM,863,149000,149000,0
181909421,Nồi Thấp Suit LocknLock CSU1242PIK – 24cm - Màu Pink,Nồi các loại,1.0,Tiki Trading,Lock&Lock,53,1184000,592000,50
108370954,Cây lau nhà xoay siêu tốc mini MyJae Đài Loan kèm thùng xoay 360 độ thông minh lau sạch nhanh khô,Chổi,190794.0,MyJae Flagship Store,MyJae,207,990000,590000,40
161301569,Ghế Kê Chân Văn Phòng Điều Chỉnh 6 Mức Chiều Cao; Giá Gác Chân Công Thái Học Chống Đau Mỏi - Hàng Nhập Khẩu,Nội thất phòng học,148768.0,Nụ Cười,iKiU,231,370000,370000,0
134242996,Ly Nhựa Có Ống Hút Lock&Lock HAP507YEL,Nhà Cửa - Đời Sống,1.0,Tiki Trading,Lock&Lock,8966,217000,109000,50
153291977,"Băng Keo Chống Thấm, Chống Dột Dán Siêu Dính Trên Mọi Bề Mặt, Dán Mái Tôn, Dán Tường, Dán Ống Nước - PucaMart",Khác,17480.0,Ghế Nam Việt,OEM,136,55000,55000,0
35905859,Đầu Cây Lau Nhà Pva Lock&Lock ETM481RFL - Mixed 32.7 x 6 x 4cm,Chổi,1.0,Tiki Trading,Lock&Lock,2175,109000,55000,50
108999637,"Đèn led thanh cảm biến tích điện Xiaomi Yeelight, 20-40-60cm, pin sạc type C - Nhập khẩu chính hãng",Đèn khác,67624.0,AKIA SmartHome Store,Yeelight,308,250000,250000,0
172334427,"Bàn 2 tầng làm bàn trà, bàn sofa phong cách Bắc Âu, chân gỗ tự nhiên ( Hình chữ nhật, hình trứng, hình Elip)",Sofa/ salon và phụ kiện,274847.0,T Funiture2012,OEM,13,635000,469900,26
5980477,Bình Ngâm Rượu Kim Cương Thủy Tinh 8833 Có Van,Bình đựng nước,72116.0,MimiShoping,OEM,878,149000,149000,0
173717336,"Túi Hộp Vải Lưới Đựng Đồ Lót, Tất Vớ Nhiều Ngăn - Khay Xếp Chia Ô Đựng Đồ Để Tủ Quần Áo Tiện Ích",Tủ,193023.0,Bờm Boutique,OEM,5,45000,45000,0
193365988,Đèn Bàn Học Led Bảo Vệ Mắt Chống Cận Làm Việc - Đọc Sách - Học Tập - 2 Trục Gập Gọn Tiện Lợi - 5 Cấp Độ Ánh Sáng ,Đèn bàn,37335.0,TRIỀU CƯỜNG TECH OFFICIAL ,TRIỀU CƯƠNG TECH ,24,580000,528000,9
56308540,Bàn học gấp gọn có khe để ipad điện thoại chân gập chống trượt tiện dụng - BHG (Giao màu ngẫu nhiên),Nhà Cửa - Đời Sống,108828.0,Tiện ích 1708,OEM,478,150000,109000,27
155690467,"Xẻng làm vườn đa năng MONROVIA trồng cây cảnh mini, để bàn, đào đất, phân bón cho hoa hồng, rau củ quả, chất liệu nhựa",Dụng cụ làm vườn khác,54962.0,Docneem Official,Monrovia,102,45000,45000,0
81316180,"Ruột Chăn Bông Sông Hồng Siêu Nhẹ, Siêu Mềm, Kháng Khuẩn Cao Cấp 2 Loại Dày/Mỏng",Chăn,29686.0,ĐỆM HỒNG,OEM,264,450000,382500,15
56400156,"Đèn LED Hình Ngôi Sao Trang Trí Giáng Sinh, Noel, Lễ Tết",Đèn khác,17480.0,Ghế Nam Việt,OEM,713,43000,43000,0
20508118,"Giá Để Giẻ Rửa Bát, Nước Rửa Chén Đa Năng Inox 304",Nhà Cửa - Đời Sống,71167.0,Thiết bị SG,OEM,48,95000,80000,16
132074671,15x12x10 Combo 50 hộp Carton đóng gói hàng giá tại xưởng,Tủ,83192.0,BOXES VIỆT NAM,BOXES VIỆT NAM,213,78000,78000,0
97708109,Hạt giống Tía Tô F1 - nảy mầm cao Titapha,Hạt giống,92052.0,Phú Thành Phát,Titapha,475,9000,9000,0
108884253,"Bộ Đèn led dây dán nguồn USB RGB đổi màu 1M/ 2M/ 3M/ 5M điều khiển chọn màu đứng yên, nhấp nháy, bóng 5050 strip light trang trí cây máy tính, màn hình, ti vi, TV, Gaming, Tiktok dán tường, chống nước bền đẹp- Chính hãng DEHA",Đèn khác,133345.0,DEHA Official Store,DEHA,339,232000,159000,31
38434027,"Thanh treo rèm cửa inox không cần khoan tường hay bắt vít, thay đổi vị trí linh hoạt HT04",Kệ nhà tắm,268511.0,Chuyên Decal,OEM,64,49000,49000,0
657077,Màng Bọc Thực Phẩm PE Ringo 175 (30cm x 175m),Màng nhôm,235.0,Tuyền Hưng Phú,RINGO,1064,105000,105000,0
5923961,Giá để sách nhạc cao cấp ( Màu đen),Nhà Cửa - Đời Sống,31375.0,Guitar MinMusic,OEM,144,225000,225000,0
1471675,Gối Kê Cổ Du Lịch Văn Phòng Tmark Gấu Totoro - Xám,Gối các loại,9455.0,MISA Shop,Tmark,0,78000,78000,0
137860560,"Bộ vòi xịt vệ sinh (Toilet) chất liệu nhựa mạ (bao gồm vòi xịt+giá đỡ+dây xịt 1,5m) - Thiết kế thông minh nhỏ gọn tiện ích",Vòi nước các loại,54602.0,HUY HÙNG AFAST,CTFAST,62,129000,129000,0
77029162,Hộp 100 bao tay nilon dùng chế biến thực phẩm an toàn vệ sinh tặng 2 zipper 10cm,Phụ kiện nhà bếp khác,18854.0,mecafe,SEIWAPRO,191,50000,45000,10
177350932,"Kệ nồi chiên không dầu, Tiết kiệm diện tích, Lắp ráp dễ dàng",Kệ nhà bếp,68379.0,2GOOD Official Store,2Good,221,380000,380000,0
193091770,Combo 5 Móc Dán Tường Trong Suốt Treo Đồ Dùng Thông Minh,Móc treo,12424.0,Ruby Ruby,OEM,47,13000,13000,0
164479566,"Ghế chỉnh dáng ngồi đúng - Roichen Hàn Quốc (Made in Korea). Dùng cho Nam, Nữ, Trẻ em. Hàng chính hãng",Nhà Cửa - Đời Sống,101716.0,GIA DỤNG TIỆN ÍCH MINH NGỌC,Roichen,904,898000,853000,5
77947848,"Kệ Chén Đĩa Thép Cao Cấp Sơn Đen Tĩnh Điện Kèm Khay Ráo Nước VANDO, Giá Kệ Úp Bát Đa Năng",Kệ nhà bếp,157549.0,Vando Official Store,VANDO,499,509000,457000,10
155794592,"Kệ lò vi sóng đa năng Thép Carbon cao cấp Vando, kệ để đồ nhà bếp siêu chịu lực 300kg sơn tĩnh điện chống bong tróc, kệ nhà bếp ",Kệ nhà bếp,157549.0,Vando Official Store,VANDO,631,1099000,677000,38
145400574,"Máy Cọ Chà Sàn Vệ Sinh Tự Động, Bàn Chải Làm Sạch Vệ Sinh Nhà Tắm Không Dây Với 5 Đầu Thay Thế - Có Video",Bàn chải,40708.0,Thiết Bị Điện Hải Dương,OEM,28,499000,429000,14
95225703,"Bộ 3 nồi chảo chống dính đáy từ vân đá Tefal Cook Healthy dùng cho mọi loại bếp (Nồi 20c, chảo 24cm và 28cm) - Hàng chính hãng",Nhà Cửa - Đời Sống,121435.0,Tefal Official Store - Chính hãng,Tefal,516,2309000,1349000,42
59425995,Bộ Ga Gối Cotton Tici Kẻ LIDACO Cao Cấp - Kẻ Cam Ghi - Tặng 01 Vỏ Gối Ôm,Bộ ga,43482.0,Lidaco Official Store,LIDACO,448,229000,185000,19
110756858,Set 200 Găng Tay Nilon Trong Suốt Sử Dụng Một Lần Tiện Lợi ,Phụ kiện nhà bếp khác,53713.0,linhkien1984,OEM,13,29000,29000,0
3524537,Ruột Nằm E.Lite Everon Lite ELRG4565 - Trắng (45 x 65 cm) ,Nhà Cửa - Đời Sống,2207.0,Everon Official Store,Everon Lite,364,150000,105000,30
143779168,Thảm ngủ cá nhân văn phòng ,Chiếu,160163.0,K KRISHNA,Krishna,596,25000,25000,0
122413518,Bình giữ nhiệt LOCK&LOCK 1.000mL Easy Take - LHC1439,Bình giữ nhiệt,125245.0,KK-MART,Lock&Lock,293,309000,295000,5
68034681,"Ruột Gối Nằm Thuần Việt Cozy Cao Cấp, Êm Ái Vượt Trội, Thoáng Mát",Nhà Cửa - Đời Sống,56226.0,NỆM THUẦN VIỆT,Nệm Thuần Việt,1002,187000,79000,58
172364143,"Tủ gỗ thấp kê cửa sổ, [BH 12 tháng] ban công , dọc tường nhiều ngăn có cánh cửa tiện lợi đa chức năng , Uy tín tại Saikou",Kệ & Tủ,289682.0,Thế Giới Nội Thất 68,OEM,48,274998,274998,0
148812388,"Thìa, Muống Inox 304 Nhật Bản Cao Cấp, Sang Trọng Bền, Đẹp Mãi Với Thời Gian",Đũa,151652.0,Jodily StarHome HP,Jodily StarHome,553,32000,32000,0
181909432,Chảo Suit LocknLock - Màu Pink,Chảo các loại,1.0,Tiki Trading,Lock&Lock,103,759000,380000,50
51373821,Đèn bàn học led cảm ứng chính hãng Rạng Đông Model: RD RL 36 LED,Nhà Cửa - Đời Sống,246985.0,PHƯƠNG ĐÔNG TPHCM,Rạng Đông,33,215000,215000,0
70906467,Giấy ăn gấu trúc Ycool -giấy vệ sinh giấy gói giấy rút 390 tờ 1 bịch 6 gói màu trắng,Phụ kiện nhà bếp khác,131980.0,Giấy ycool,ycool,1425,48000,48000,0
160907594,Bàn nâng hạ chiều cao thông minh iCockpit 1460 1675,Bàn ghế làm việc,211062.0,Tăm nước Sài Gòn,iCockpit,50,5000000,2799000,44
184913941,"Bộ Vòi Tưới Cây , Rửa Xe 12m Kèm Vòi Tưới 6 Chế Độ - Hàng Nhập Khẩu",Vòi nước và phụ kiện tưới cây,108828.0,Tiện ích 1708,PEAFLO,60,620000,475000,23
195356666,"Đèn mắt mèo cảm biến hồng ngoại 3 màu trong 1, tự động bật/tắt ánh sáng, sạc USB không dây, trang trí tủ đồ, nhà bếp, phòng khách, bàn làm việc",Đèn cảm ứng,133565.0,SmartTech-Shop,QFire,91,195000,139000,29
193894899,phôi nấm bào ngư xám,Hạt giống,211857.0,81farm,81 FARM,111,15000,15000,0
43808661,Bồ đoàn (đệm) ngồi thiền vỏ đậu xanh,Gối các loại,5756.0,THE YOGI'S SHOP,The Yogis Shop,1129,180000,180000,0
71178441,"Áo Mưa Bít Dù Trơn, Áo Mưa Kín Người Vải Dù Siêu Dày 1M4, Chống Thấm Hiệu Quả, Phù Hợp Nam Và Nữ, Có Túi Đựng, Có Lựa Chọn Màu Sắc",Áo mưa,100919.0,XỐP DÁN TƯỜNG 3D SÀI GÒN,XUDI,780,115000,115000,0
155562318,Túi Đựng Bình Nước 20x House Mẫu Trơn,Phụ kiện phòng ăn khác,254538.0,20X HOUSE,20x House,226,22000,22000,0
32189969,Bộ 3 Hộp Thủy Tinh Cường Lực Glasslock 400ml Và 695/710ml x 2 + Túi Giữ Nhiệt,Nhà Cửa - Đời Sống,1.0,Tiki Trading,GlassLock,1387,569000,378000,34
74409358,Chặn cửa dán sàn gạch men Inox 304 HOBBY CC5 nam châm cực mạnh- có keo dán 3M và đinh ốc,Bảo vệ nhà cửa khác,20023.0,Hobby Home Decor,Hobby Home Decor,397,119000,85000,29
96180139,Chân đàn Organ/ Piano đa năng - Kzm Kurtzman STX1 - Dáng chữ X đơn - Màu đen - Hàng chính hãng,Phụ kiện nhạc cụ khác,174653.0,KZM KURTZMAN OFFICIAL STORE,Kzm Kurtzman,842,155000,99000,36
508484,Đèn Diệt Muỗi Và Côn Trùng Nanolight IK-001,Nhà Cửa - Đời Sống,1028.0,TAVANA,Nanolight,45,339000,339000,0
46207255,Combo 2 túi lưới giặt đồ 2 lớp Polyester dạng lưới mịn giặt đồ chống biến dạng quần áo cho máy giặt dạng hộp khóa kéo phù hợp giặt đồ nhỏ đồ lót,Túi giặt,17480.0,Ghế Nam Việt,OEM,499,68000,68000,0
33787304,Gối cao su thiên nhiên Kymdan Pillow IYASHI 48 x 28 x 7 cm,Nhà Cửa - Đời Sống,63821.0,Kymdan Official Store,KYMDAN,184,1607000,1440000,10
68565401,"Dụng Cụ Mài, Chà Gót Chân Tẩy Da Chết Inox Cao Cấp",Khác,309465.0,HTH Shop,OEM,0,89000,69000,22
116667583,Miếng Lau Nhà Thay Thế Dành Cho Cây Lau Nhà,Chổi,5697.0,Huy Tưởng Tphcm,OEM,218,12000,9000,25
108964915,Hạt Giống Cải Cúc ( Tần Ô ) F1 - Nảy mầm cao Titapha,Hạt giống,92052.0,Phú Thành Phát,Titapha,271,13900,13900,0
38552299,Bộ 12 Ly Thủy Tinh Ống Cao Uống Cà Phê Camdaco (315ML),Ly,6495.0,Camdaglassco,CAMDACO,284,105000,105000,0
692123,Hộp Bảo Quản Chữ Nhật Ngắn Có Chia Ngăn Lock&Lock Classic HPL806C (350ml),Hộp đựng thực phẩm,1.0,Tiki Trading,Lock&Lock,137,72000,36000,50
164008980,"Bộ đèn LED Âm Trần DN027B G2 PHILIPS - Thiết kế chắc chắn, Hiệu suất vượt trội, Ánh sáng chất lượng cao, Lắp đặt và thay thế dễ dàng - Hàng Chính Hãng",Đèn trần,232117.0,QUOSOM, Philips,30,255000,140000,45
1325531,Combo 10 Cặp Nút Tai Chống Ồn 3M 1100 - Cam,Nhà Cửa - Đời Sống,935.0,Bảo Hộ Lao Động Achison,3M,1465,53000,53000,0
194773056,"Tấm lót bàn ăn cao cấp, chịu nhiệt, chống thấm, chống trượt - Lót bàn ăn trang trí sang trọng cho nhà hàng, khách sạn",Phụ kiện phòng ăn khác,134154.0,Funu Home,FuNu,18,165000,130000,21
101947159,Ga Chống Thấm PT Họa Tiết Cúc Xanh,Bộ ga,75554.0,Ga chống thấm cao cấp PT,OEM,132,340000,340000,0
34710854,VỈ 5 Viên Pin CR2450 3V Panasonic Hàng Chính Hãng,Nhà Cửa - Đời Sống,71726.0,Thegioipin88,Panasonic,599,150000,150000,0
94888985,Sọt Đựng Quần Áo Bẩn Túi Đựng Đồ Đa Năng,Giỏ đựng quần áo,17480.0,Ghế Nam Việt,OEM,243,95000,95000,0
53497586,40 VIÊN PIN MAXELL AA TEM BẠC PDA - HÀNG CHÍNH HÃNG,Nhà Cửa - Đời Sống,20367.0,VI TÍNH NAM TRUNG HẢI,Maxell,90,91600,91600,0
192070067,"Keo dán trường treo đồ siêu chắc Keo xây dựng dán tường đa năng chống thấm nước No More Nail dán gỗ, gạch đá, thủy tinh",Nhà Cửa - Đời Sống,239814.0,Shop Tậnnn Tâm,OEM,37,15988,15988,0
116041658,Áo mưa Seagate,Áo mưa,4106.0,CÔNG NGHỆ TẦM NHÌN,OEM,77,99000,99000,0
16362780,Cân Điện Tử Cầm Tay Du Lịch 50Kg - 10Gr Tròn,Nhà Cửa - Đời Sống,100773.0,Smart Trading,OEM,55,74900,74900,0
10603943,Bộ Tua Vít 31 Đầu Đa Năng,Máy vặn vít,131912.0,Shop Thịnh,OEM,171,29000,29000,0
109662011,"Bộ trải tiện ích Everon Lite 80x195cm (tấm trải, gối, chăn)",Nệm,2207.0,Everon Official Store,Everon Lite,137,850000,635000,25
202805092,"Bình Giữ Nhiệt 800ml Lock&Lock Vacuum Bottle LHC6180 - Hàng Chính Hãng, Bằng Thép Không Gỉ, Có Lưới Lọc Trà Bằng Inox, Mức Giữ Nhiệt Vượt Trội Tặng Kèm Ống Hút Inox",Nhà Cửa - Đời Sống,38510.0,JoyMall LocknLock Chính Hãng,Lock & Lock,936,697000,369000,47
168234677,[Hàng chính hãng] Ghế chỉnh dáng ngồi đúng - Curble Wider_Premium Model Hàn Quốc (Made in Korea). Phù hợp mọi đối tượng (Free Size),Bàn ghế làm việc,101716.0,GIA DỤNG TIỆN ÍCH MINH NGỌC,Ablue,308,729000,714420,2
187934715,Đèn Năng Lượng Mặt Trời Bàn Chải 400W 500W 600W ,Đèn ngoài trời,292365.0,ĐÈN NĂNG LƯỢNG TYS TAI YANG SHEN,TYS,29,1100000,825000,25
121367420,"Gối ngồi lót mông y tế chống trĩ, đau xương cụt, ê mỏi mông cho dân văn phòng, lái xe, thu ngân, sinh viên...Chính hãng Ema - Hàng nhập khẩu",Gối các loại,18299.0,Gối nêm Hi-Sleep Store,Ema,514,650000,325000,50
54476660,"Đèn Bàn Học Đọc Sách, Làm Việc (Học Sinh, Sinh Viên, Văn Phòng) Cao Cấp Kẹp Bàn – 03 Mức Độ Ánh Sáng Vàng Bảo Vệ Mắt Chống Cận Pin 2500 mAh",Nhà Cửa - Đời Sống,97355.0,Future Store,eLights,1258,220000,189000,14
200768673,"Đèn năng lượng mặt trời 100W 200W 300W 400W  đèn  chống nước,Ánh sáng sân vườn năng lượng mặt trời LED Đèn năng lượng mặt trời với chỉ báo pin",Đèn ngoài trời,303510.0,TTB Solar,OEM,31,599000,399000,33
115891338,"Gối Cao Su Kim Cương Lượn Sóng 44x64cm 100% cao su thiên nhiên nâng đỡ, bảo vệ đốt sống cổ - A",Gối các loại,9596.0,Vua Nệm Official Store,Kim Cương,280,600000,480000,20
188375839,Khăn tắm Khăn lau mặt Cotton 100% Mềm Êm Dày dặn Màu trơn Nhấn viền họa tiết 74x33cm,Khăn,173842.0,HomeMi Shop,CHIKIGON,162,53000,53000,0
147975049,Thảm Chùi Chân Lau Chân trải sàn TCS SHOUSE phòng khách phòng tắm cao cấp giá rẻ 3d chống trượt hình thú đế cao su hút nước,Thảm chùi chân,141070.0,Shouse,Shouse,1081,39000,39000,0
193433927,Đèn Bàn Học Led Đọc Sách Làm Việc Học Tập Bảo Vệ Mắt Chống Cận - 2 Trục Đèn Chiếu Sáng - Gấp Gọn Tiện Lợi ,Đèn bàn,37335.0,TRIỀU CƯỜNG TECH OFFICIAL ,TRIỀU CƯƠNG TECH ,59,699000,568000,19
155487222,Kệ Chén Đĩa Kéo Giãn Thông Minh VANDO Giá Úp Bát Thay Đổi Kích Thước Trên Bồn Rửa 1 Tầng Chống Han Gỉ Cao Cấp,Kệ nhà bếp,157549.0,Vando Official Store,VANDO,53,999000,817000,18
129621533,30 GóI Giấy Ăn Gấu TrúC Sipiao Siêu Dai - Loại Tốt,Phụ kiện nhà bếp khác,298269.0,ThuyDungShop2002,OEM,0,97448,97448,0
48175867,KỆ TRANG TRÍ VUÔNG 2 TẦNG - CAO 50CM x DÀI 35CM x RỘNG 35CM ,Kệ & Tủ,179883.0,Cây Thông Xinh,OEM,230,115000,115000,0
949751,Kệ Đỡ Màn Hình Máy Tính Monitor Stand Plyconcept MSM01002 (490 x 200 mm) - Trắng,Kệ & Tủ,1303.0,MipuMade,Plyconcept,823,240000,225000,6
4361879,Bộ lọc nước thô đầu nguồn 3 cấp lọc 10inch Yamato YMTH10-3T,Thiết bị lọc,8413.0,SMY (Tp.HCM),YAMATO,1906,610000,395000,35
106390929,Vỉ pin  5 viên 2025 Maxell CR2025 - Pin 3v Lithium,Pin tiểu,36755.0,60s Watch,Maxell,146,44000,39000,11
