p_id,p_name,p_id_shop,p_shop_name,p_brand,p_categories,p_day_created,p_sold_quantity,p_original_price,p_current_price,p_discount_rate
135322547,Set 10 Móc áo chống trượt Inochi Hara 186,197301.0,TAMDUONG,Inochi,"Móc treo, kẹp quần áo",432.0,218,42000,42000,0
21181898,Phụ kiện Silicone lắp thoát sàn chống mùi hôi vi khuẩn trào ngược lên,20888.0,Minh House,OEM,Thiết bị phòng tắm khác,1286.0,1244,15500,15500,0
206323002,[SALE CUỐI NĂM] NỆM VĂN PHÒNG- ĐỆM NGỦ VĂN PHÒNG 80X200cm dày 3cm,270288.0,Nệm đa năng Happy Dream,EOM,Nhà Cửa - Đời Sống,44.0,92,179000,179000,0
185809373,Khăn tắm lông cừu Hàn Quốc Cao Cấp 70x140 (Loại 1),267574.0,bamboo and love,OEM,Khăn,207.0,86,80000,50700,37
48049718,"Giường Ngủ Thông Minh (Liền 2 Tab, Có Hộc Tủ Giường) Màu Vân Gỗ Sồi -  GN-609",293357.0,DoDiDu,OEM,Nội thất phòng ngủ khác,1065.0,14,8700000,7900000,9
115536058,CUỘN 10 MÉT Băng Keo Lụa | Cao Su Non | BĂNG TAN Dùng Cuốn Ống Nước dây cấp nước các ron KEO DAI CHẮC,8413.0,SMY (Tp.HCM),SMY,Khác,526.0,118,10000,10000,0
208561236,Đế cắm nhang  - đế cắm hương vòng - đế cắm nhang trầm - đế cắm nhang hoa sen - đế cắm nhang trầm huowng - amrita,313941.0,Cửa Hàng Phật Giáo Amrita,OEM,Root,26.0,11,129000,129000,0
156821210,VỎ GỐI THUN MÀU TRƠN ,190446.0,Tiệm Blue,OEM,Vỏ gối,362.0,18,29000,29000,0
46175050,Chảo Gang Nướng BBQ Chống Dính 22cm Làm Bò Beefsteak Kèm Đế Lót Gỗ,44707.0,Kat shop,Dragon,Chảo các loại,1049.0,86,165000,165000,0
119220427, Bình giữ nhiệt Inox 304 có ngăn pha trà 24h giữ lạnh cao cấp thể thao dung tích 800ml BGN11,146174.0,HOÀNG HÀ 888,TAKIHA,Bình giữ nhiệt,501.0,577,288000,137500,52
171476351,"Kệ Góc Nhà Tắm - Có Sơn Tĩnh Điện, Kệ Dán Tường Nhà Tắm, Nhà Bếp Siêu Dính - Tặng Kèm Tấm Dán - Hàng Chính Hãng",249634.0,Homebox Store,JYooHome,Kệ nhà tắm,287.0,979,96000,52000,46
94305891,"Chảo sâu lòng chống dính Tefal Natura 28cm, dùng cho bếp gas và hồng ngoại- Hàng chính hãng",121435.0,Tefal Official Store - Chính hãng,Tefal,Nhà Cửa - Đời Sống,616.0,1561,539000,358000,34
163827119,"Mô Hình Rồng vàng cử động khớp linh động in công nghệ 3D trang trí nhà cửa, bàn trà, hồ thủy sinh, tiểu cảnh, bán cạn",146858.0,NgoiNhaVuiVe,	OEM,Mô hình & Tượng trang trí,318.0,41,119000,119000,0
189634105,Chảo Đá Nướng Chống Dính Hàn Quốc 33cm,291512.0,Phố Xinh Store,OEM,Chảo các loại,183.0,0,114797,114797,0
205138098,Tượng Mèo Sứ Cao Cấp Minh Long - Vạn Phúc - Trang Trí vàng - 9.5 cm,197402.0,Minh Long Official Store,Minh Long I,Linh vật phong thủy,55.0,19,709500,709500,0
36461827,bàn làm việc chân sắt - vàng nhạt,180729.0,LINHGIANG,OEM,Nhà Cửa - Đời Sống,1177.0,358,299900,174200,42
60709422,Cây Treo Quấn Áo Phong Cách Hàn Quốc Thương Hiệu IGEA - GP60,48574.0,IGEA Nội Thất Thông Minh,IGA,"Giá, kệ phơi quần áo",862.0,904,224000,212000,5
204431176,"Móc treo dán tường đa năng, bộ 2 chiếc, treo chìa khóa, đồ dùng nhà bếp, vật dụng nhà tắm - Parroti Handy HD12",96639.0,Parroti Store,Parroti,"Móc treo, kẹp quần áo",60.0,41,22000,9900,55
181988627,Bóng đèn led 5 cánh hình lá 75w to đẹp,263578.0,Dụng Cụ Y Khoa Hoàn Mỹ 1,OEM,Bóng đèn,228.0,77,98000,98000,0
25144488,TỦ TREO QUẦN ÁO ĐÔI 5 TẦNG GỖ THÔNG 97x150 cm,179883.0,Cây Thông Xinh,OEM,Tủ,1250.0,84,480000,480000,0
69843631,CÂY TREO QUẦN ÁO HÀN QUỐC GỖ LẮP RÁP- STANDING HANGER- BLUE HOME- MÀU GỖ TỰ NHIÊN,132509.0,Blue Home,Morninghouse,"Giá, kệ phơi quần áo",814.0,248,279000,279000,0
31473727,Combo 100 Túi Lọc Trà Có Dây Rút,19256.0,Công ty TNHH LPS VINA,OEM,Nhà Cửa - Đời Sống,1216.0,307,28500,28500,0
95043563,Khăn tắm sợi tre Bamboo Life hàng chính hãng Khăn lau người mềm mại kháng khuẩn siêu thấm hút an toàn cho da ngay cả với trẻ sơ sinh BL046,152044.0,Bamboo Life Official Store,Bamboo Life,Khăn,605.0,1960,65000,57600,11
34171666,0.5 kg túi zip chỉ đỏ lựa chọn size,266755.0,Tạp hóa Vân An,OEM,Nhà Cửa - Đời Sống,1197.0,152,39000,39000,0
67811819,"Đèn LED Cảm Biến Chuyển Động Nhiều Kích Cỡ, Cảm Ứng Hồng Ngoại 3 Chế Độ",97441.0,Luckky Shop,OEM,Nhà Cửa - Đời Sống,839.0,21,196000,196000,0
43880302,"Kệ chữ nhật phòng tắm Inox 304 HOBBY Home Decor KCN1 dán tường gạch men, kính - có sẵn keo dán siêu dính và đinh ốc - không rỉ sét",20023.0,Hobby Home Decor,Hobby Home Decor,Kệ nhà tắm,1126.0,848,249000,162000,35
124392263,Bộ Thái Rau Củ Đa Năng ECOCO - Hàng Chính Hãng,107147.0,Nonostyle Official Store,Ecoco,Dụng cụ Cắt-Gọt-Bào,464.0,333,350000,169000,52
165219472,"Sét 10 khay giấy bạc,khay bạc đựng thực phẩm lót nồi chiên không dầu chịu nhiệt độ cao",20367.0,VI TÍNH NAM TRUNG HẢI,OEM,Root,312.0,19,19600,19600,0
89054016,ÁO MƯA BỘ THÀNH LONG VẢI DÙ 2 LỚP CAO CẤP,282800.0,KEN SHOPP,OEM,"Áo mưa, ô dù và phụ kiện đi mưa",639.0,1,184000,184000,0
68908587,"Chân Đế Đỡ Chậu Hoa, Cây Kiểng Thuận Tiện Di Chuyển ",94442.0,Xanh Garden,OEM,Kệ trang trí cây,820.0,3680,35000,35000,0
5981431,Bình Ngâm Rượu Thủy Tinh Hoa Văn Rồng (Có Van),72116.0,MimiShoping,OEM,Bình đựng nước,1540.0,509,187000,187000,0
109739684,GA GIƯỜNG THUN LẠNH MÀU TRƠN (bộ),190446.0,Tiệm Blue,OEM,"Bộ ga, ra, drap",551.0,83,150000,150000,0
212986033,"Đồng hồ bấm giờ đếm ngược điện tử mini, đồng hồ điện tử đa năng",134154.0,Funu Home,OEM,Nhà Cửa - Đời Sống,9.0,462,65000,63000,3
68716601,Dao Gọt Hoa Quả Sunhouse KS-KN100PS,182530.0,GIADUNG TẤN PHÁT,Sunhouse,Dao các loại,825.0,2,37000,37000,0
38302207,TÚI 1 KG- PHÂN LÂN ĐƠN - CUNG CẤP NHANH LƯỢNG LỚN P2O5 CHO CÂY TRỒNG - BỔ SUNG THÊM CANXI VÀ LƯU HUỲNH - KÍCH THÍCH RA HOA - RA RỄ,18516.0,Nông Nghiệp Phố,OEM,Phân bón,1162.0,1140,8000,7800,3
58311830,Hạt giống Hoa Mười giờ Mỹ kép - Mix nảy mầm cao,92052.0,Phú Thành Phát,Titapha,Hạt giống,895.0,2886,18000,12900,28
86376338,Đèn ngủ Oval cắm điện 10 cấp độ sáng có remote - đèn ngủ thông minh - hẹn giờ - 2 cổng USB sạc nhanh mới 2021,97441.0,Luckky Shop,OEM,Đèn ngủ,641.0,165,99000,99000,0
48094891,"Combo 2 Túi bọc quần áo chống bụi bẩn, nấm mốc có khóa kéo tiện dụng size S/M/L giúp bảo vệ quần áo luôn sạch sẽ",17480.0,Ghế Nam Việt,OEM,Phụ kiện giặt ủi khác,1017.0,158,55000,55000,0
14448546,Bình Gas Bơm Bật Lửa BlueSky,67417.0,Shop AZ,OEM,"Than, cồn & Dụng cụ mồi lửa",1353.0,2,85000,85000,0
1918931,Keo Dán Đa Năng Selleys Epoxy Fix (10ml / Tuýp),1028.0,TAVANA,Selleys,Khác,1727.0,690,39000,35400,9
72646042,Combo 10 cặp nút tai chống ồn cao cấp Honeywell Max 1,935.0,Bảo Hộ Lao Động Achison,Honeywell,Nhà Cửa - Đời Sống,784.0,722,48000,48000,0
195901387,Bao Trống Cajon thương hiệu CORO VIETNAM - Chống thấm cao cấp,301534.0,Coro Percussion,CORO,Trống & Phụ kiện,120.0,42,495000,495000,0
103822707,Hạt giống Cà chua đỏ quả to F1 - Nảy mầm cao Titapha,92052.0,Phú Thành Phát,Titapha,Hạt giống,576.0,366,13900,13900,0
157152581,Móc Dán Tường Có Đinh Ốc Vít Miếng Dán Tường Đóng Đinh Tiện Lợi Ko Khoan Đục Tường,20367.0,VI TÍNH NAM TRUNG HẢI,OEM,"Giá, móc, cây treo",360.0,0,8500,8000,6
108652829,Xẻng lật và vá inox 304 Sa Maison,64171.0,Sa Maison,Sa Maison,Phụ kiện nhà bếp khác,558.0,181,99000,59400,40
160705822,Kim Nguyên Bảo - Thỏi vàng phong thủy Thần Tài May Mắn KAI_ Hàng Chính Hãng,158862.0,Art H Store,OEM,Vật phẩm phong thủy khác,342.0,133,4000,4000,0
203883187,Bọc Tay Nắm Cửa Silicon Chống Va Đập Hiệu Qủa,290838.0,BiBonStore,OEM,Khác,64.0,89,9500,9500,0
135810827,Tạp Dề Chống Thấm Nước 2 lớp nhiều màu,146279.0,Tạp Dề Đồng Phục Xanh,OEM,Phụ kiện nhà bếp khác,431.0,247,50000,50000,0
37266689,Hạt Giống Rau Muống Thái Lan,42056.0,KoyShop,OEM,Nhà Cửa - Đời Sống,1170.0,1960,6895,6895,0
143608611,"Chùm cây rong biển 85cm-Hoa giả trang trí nội thất nhà hàng, quán cafe siêu đẹp",245916.0,Nhím Decor,OEM,Root,405.0,27,25000,25000,0
191911126,"Kệ giày thông minh, tủ giày gỗ đa năng 4 tầng cánh tủ trắng, hai bên kèm kệ phong cách hiện đại 78x30x78 TAGO ND22",135751.0,Home decoration,OEM,Kệ & Tủ,167.0,19,279000,264800,5
21101765,Bàn Học Bàn Làm Việc Kết Hợp Kệ Sách Thương Hiệu IGEA,48574.0,IGEA Nội Thất Thông Minh,IGA,Nhà Cửa - Đời Sống,1287.0,8081,615000,586000,5
189373783,"Máy Rửa Xe Mini Deli Công Suất Lớn - Tiết Kiệm Điện Năng, Phun Rửa Đa Năng - DL882201",236924.0,Deli tools Store,Deli,Nhà Cửa - Đời Sống,187.0,80,2399000,1289000,46
141201958,Ly Giữ Nhiệt Cà Phê Có Tay Cầm Nắp Trượt Chống Tràn Rinfere (415ml),28034.0,Rinfere Official,Rinfere,"Ly, cốc & phụ kiện ly",413.0,256,449000,290000,35
24437529,Thảm Lông Loang Màu Xám Nhạt Trải Sàn Trang Trí 1m6x2m,34982.0,Nhaxinh decor,Bảo Anh,Trang trí nhà cửa khác,1255.0,1058,299000,284200,5
107534596,Đèn Rèm Mành 6M 8M 16M Mưa Led Rủ Mành Đèn Led Thả Mành Trang Trí Ngoài Trời Trang Trí Sự Kiện Nhà Cửa Sảnh Quán Cafe,246985.0,PHƯƠNG ĐÔNG TPHCM,OEM,Đèn khác,562.0,125,98000,98000,0
177456220,Dụng Cụ Bánh Xe Nâng Đỡ -Di Chuyển Vật Nặng Đa Nâng,221038.0,Shop Gia Dụng Tiện Lợi,OEM,Xe đẩy hàng,252.0,48,145000,125000,14
7202377,Bộ 3 Lõi Lọc Nước Máy Tiêu Chuẩn Barrier,1.0,Tiki Trading,BARRIER,Nhà Cửa - Đời Sống,1514.0,2150,660000,519000,21
140791193,Bóng đèn LED Bright PHILIPS E27 - Thay thế hoàn hảo cho bóng đèn Compact - Hàng Chính Hãng,232117.0,QUOSOM,Philips,Bóng đèn,413.0,787,90000,56000,38
116966601,HỘP 10 ĐÔI ĐŨA INOX 304 - CAO CẤP - SANG TRỌNG - NGUYÊN KHỐI INOX 304,151652.0,Jodily StarHome HP,Jodily StarHome,"Đũa, muỗng, nĩa",513.0,349,275000,228000,17
106281034,Bình nước thủy tinh Luminarc Quadro 1.7L -LUQUG2668,189048.0,Luminarc Official Store,Luminarc,"Bình, ly uống trà và phụ kiện",567.0,267,186000,105000,44
121367420,"Gối ngồi lót mông y tế chống trĩ, đau xương cụt, ê mỏi mông cho dân văn phòng, lái xe, thu ngân, sinh viên...Chính hãng Ema - Hàng nhập khẩu",18299.0,Gối nêm Hi-Sleep Store,Ema,Gối các loại,485.0,540,650000,325000,50
125658476,"Bình Giữ Nhiệt Kim Cương 1500Ml Inox 304- YOGA QG- Chống Rỉ Set, Nắp Đậy Chặt, Giữ Nhiệt Nóng Lạnh Tốt 6- 8h, Quai Đeo Chắc Chắn, Thiết Kế Sang Trọng, Màu Sắc Thanh Lịch, Tiện Lợi, Pha Lọc Trà, Hàng Chính Hãng",205461.0,Học Viện Yoga Quốc Gia,YOGA QG,Bình giữ nhiệt,467.0,491,186000,186000,0
53119459,Chảo inox 304 Westfalia (Đức),90431.0,Tentum,Westfalia,Chảo các loại,985.0,528,600000,600000,0
72226853,"Đèn Bàn Học Đọc Sách Chống Cận, Đèn Bàn Làm Việc, Đèn Ngủ Sang Trọng (Học Sinh, Sinh Viên, Văn Phòng) Cao Cấp Kẹp Bàn – 03 Mức Độ Ánh Sáng Vàng Bảo Vệ Mắt Chống Cận - Hàng Chính Hãng - VinBuy",109746.0,VinBuy,VinBuy,Nhà Cửa - Đời Sống,792.0,154,200000,130700,35
9805349,"Ổ cắm Điện Quang ECO ĐQ ESK 5WR 8ECO (8 Lỗ, dây dài 5m, màu trắng đỏ)",17490.0,Điện Quang Official Store,Điện Quang,"Ổ cắm, ổn áp, biến áp",1460.0,522,217100,152000,30
120170899,"Kéo cắt gà đa năng SK5 Nhật siêu cứng - Kéo Nhật nội địa cắt giấy, vải chuyên dụng GD016",16725.0,Sứa Closet,OEM,Kéo các loại,496.0,77,49000,35000,29
73608154,ĐỒNG HỒ TREO TƯỜNG TRÒN KIM TRÔI SIZE LỚN ĐƯỜNG KÍNH 30CM,267338.0,Máy Photocopy Hoàng Nguyên,OEM,Đồng hồ treo tường,758.0,18,125000,125000,0
20484673,Nắp ngồi rơi êm cao cấp thay thế cho các loại bồn cầu INAX thân dài 504-702-700-710-808-900,15938.0,Thiết bị vệ sinh VN,SUNZIN,Nhà Cửa - Đời Sống,1295.0,758,295000,295000,0
169757734,"Đầu nối vòi nước, đầu vòi rửa bát chén tăng áp đa năng thông minh xoay 360 720 độ bồn rửa mặt inox",264288.0,Trà Đá,OEM,Root,295.0,38,49998,48380,3
130410828,Chăn Ngủ Văn Phòng Chăn Du Lịch Giữ Ấm Màu Trơn Cho Nam Cao Cấp - Kích  Thước(160cm * 120cm)- Hàng Chính Hãng MINIIN,134678.0,Smarthome29,MINIIN,"Chăn, mền và phụ kiện",446.0,84,120000,118200,2
204207230,"Nhang nụ trầm hương đốt xông nhà tẩy uế HÀ XÁ đồ thờ cúng phong thủy, xua đuổi vận xui, thu hút nguồn năng lượng tích cực, thanh lọc không khí, an toàn cho sức khỏe",146857.0,Trầm Hương HÀ XÁ,Trầm Hương Hà Xá,Nhà Cửa - Đời Sống,62.0,269,198000,99000,50
137175886,"1KG Túi zip giấy đáy đứng - Túi giấy đựng thực phẩm, túi zip zipper giấy kraft, craft đựng bánh kẹo",238816.0,Shop túi zip thực phẩm,OEM,Root,426.0,128,120000,120000,0
185798331,"Máy chà nhà vệ sinh Jesopb K129 phiên bản 5 in 1, chổi cọ bồn cầu đa năngm lau chùi bề mặt không dây, Pin 4000mAh, Tốc Độ Cao 320 Vòng/Phút, hàng chính hãng",179711.0,ĐIỆN MÁY HTG,Jesopb,"Bàn chải, dụng cụ thông tắc, cọ rửa",205.0,41,735000,735000,0
147694768,găng tay làm bếp nấu ăn siêu dai Victoria Bay chất liệu TPE không mùi chống nhăn hộp 100 cái size M,12619.0,CATAN shop,OEM,Root,391.0,15,21999,21999,0
197822149,"Tựa lưng công thái học EMA cho ghế văn phòng, ô tô - Chuẩn công thái học, thoái mái & thoáng mát",18299.0,Gối nêm Hi-Sleep Store,Ema,"Nội thất phòng học, làm việc khác",109.0,255,860000,430000,50
184915910,"Chậu Gội Đầu Tại Nhà, Tại Giường Cho Người Già, Người Bệnh, Trẻ Em",108828.0,Tiện ích 1708,PEAFLO,"Xô, thau, chậu",212.0,90,150000,103400,31
104681217,Bông lau cho cây lau nhà sợi fbier tự vắt phẳng và cây lau nhà tự vắt phun sương MyJae Đài Loan,190794.0,MyJae Flagship Store,MyJae,Khăn,573.0,301,99000,27000,73
186692944,Bộ 6 Đĩa Chấm Thuỷ Tinh Luminarc Diwali 11cm - LUDIN3977,189048.0,Luminarc Official Store,Luminarc,"Tô, chén, dĩa",198.0,197,203000,117000,42
75517080,GỐI NGỦ VĂN PHÒNG ĐA NĂNG TỰA LƯNG HÌNH THÚ - KHỦNG LONG- GỐI NGỦ,146536.0,Phan Nguyễn Office,OEM,Gối các loại,729.0,129,119000,119000,0
173671887,"Phân Bón Hữu Cơ Hoa Hồng Phân Bón Hoa Hồng, Cây Cảnh GREEN FARM Gói 1kg",212248.0,HeLiCorp,OEM,Phân bón,275.0,172,42050,23127,45
80666842,Bộ 4 miếng đệm cao su lót chân máy giặt chống rung chống ồn,76796.0,Vietstore24h,OEM,Phụ kiện giặt ủi khác,667.0,6,16080,16080,0
145495739,Nhang nụ Dương Minh 100% thành phần tự nhiên nụ trầm nụ quế nụ bồ kết - nụ khói tỏa ngược hương nhang sạch an toàn cho sức khỏe,245287.0,Nhang sạch Dương Minh,Dương Minh Since 1984,"Hương, nhang",398.0,114,150000,110000,27
105892083,"Rèm Cửa Dán Tường, màn cửa sổ chống nắng may sẵn treo phòng ngủ, giường tầng, dán bếp",42815.0,Marytexco - Home and Living Decor,OEM,"Rèm, màn cửa",569.0,24,149000,149000,0
199171217,"Đèn LED Chữ Merry Christmas Treo Cây Thông, Trang Trí Giáng Sinh, Noel - Chính Hãng NAVIVU",17480.0,Ghế Nam Việt,NAVIVU,Đèn khác,93.0,38,149000,149000,0
184245786,"Túi đựng hộp cơm giữ nhiệt, túi đựng đồ ăn trưa văn phòng có lớp lót nhôm giữ nhiệt dày dặn, kích thước lớn tiện lợi",160959.0,Bột Mì House,OEM,Phụ kiện nhà bếp khác,218.0,85,92000,86000,7
115767168,Gối Tựa Lưng Gối Trang Trí Sofa Hình Mèo Neko May Mắn Siêu Dễ Thương,35488.0,Aquaria,OEM,Gối các loại,525.0,58,498000,259000,48
1325511,Combo 5 Cặp Nút Tai Chống Ồn 3M 1110 - Cam,935.0,Bảo Hộ Lao Động Achison,3M,Nhà Cửa - Đời Sống,1818.0,637,58000,58000,0
178316055,Bịch 100 túi bao trái (quả) - túi vải không dệt,18516.0,Nông Nghiệp Phố,OEM,Dụng cụ làm vườn khác,244.0,49,66000,66000,0
73314056,Lọ xay tiêu tay vặn HOBBY HOME DECOR XT - lọ thủy tinh và cối sứ viền Inox 304 không rỉ,20023.0,Hobby Home Decor,Hobby Home Decor,"Dụng cụ xay, giã",769.0,528,99000,65000,34
125604026,Dây Treo Trang Trí Noel Dài 3m,223658.0,Giáo Cụ Dạy Học Shop,OEM,Root,464.0,65,25000,25000,0
114105978,Keo Vá Tường Chống Thấm LKB 250gr - Trám Trét Vết Nứt Khe Hở Tường - Chống Mốc Ẩm Làm Sạch Tường - Mifan Hàng Chính Hãng,76621.0,Mifan Official Store,LKB,Nhà Cửa - Đời Sống,533.0,393,35000,29000,17
160310658,"Tạp dề chống thấm giá rẻ, giao màu, họa tiết ngẫu nhiên - Hàng chính hãng",134154.0,Funu Home,FuNu,Phụ kiện nhà bếp khác,348.0,1089,19000,19000,0
197676301,Tủ nhựa cao cấp TABI Vân gỗ,238272.0,PHÚ MỸ furniture,Duy Tân,Root,111.0,295,1250000,1085000,13
201050752,Bình Giữ Nhiệt Nóng Lạnh Vusign Inox 316 350ml Cao Cấp Cách Nhiệt Deli - Phù Hợp Cà Phê Trà Nước Ép Sinh Tố Đá Du Lịch Đi Học Tập Bình Nước Thể Thao Gym Yoga - LL606,113115.0,Deli Official Store,Deli,Bình giữ nhiệt,82.0,56,466200,159000,66
198028980,Máy Rửa Xe Chuyên Dụng Pin 10 Cell Siêu Trâu - Máy Xịt Rửa Tăng Áp 199V Chuẩn Động Cơ Lõi Đồng Siêu Khỏe Hàng Mới,286730.0,TỔNG KHO HÀNG MINH KHOA,OEM,Máy xịt rửa,107.0,1,690000,690000,0
149573787,Thùng rác thông minh cảm ứng tự động M&L-FH-2 phong cách Hàn Quốc,250596.0,ML Official Store,M&L,"Thùng rác, đồ hốt rác",384.0,466,527000,339000,36
164479566,"Ghế chỉnh dáng ngồi đúng - Roichen Hàn Quốc (Made in Korea). Dùng cho Nam, Nữ, Trẻ em. Hàng chính hãng",101716.0,GIA DỤNG TIỆN ÍCH MINH NGỌC,Roichen,Nhà Cửa - Đời Sống,310.0,946,898000,808000,10
70083074,"Ghế xếp thư giãn SUMIKA 199 - có lăn tay massage, khung vuông cao cấp, tải trọng 300kg",1764.0,PGN Professional Equips & Cleaning,Sumika,Nhà Cửa - Đời Sống,810.0,1206,1580000,1135000,28
202611094,Bộ 2 hộp Thủy Tinh Chịu Nhiệt Lock&Lock LCB425 + LCB425C,1.0,Tiki Trading,LocknLock,Hộp đựng thực phẩm,71.0,33,387000,179000,54
162210732,"Bộ Tua Vít Deli Cao Cấp 30 Chi Tiết Đa Năng Vặn Ốc Vít, Bu Lông - Phù Hợp Sửa Chữa Vật Dụng, Xe Máy - DL1130",47548.0,Nhà sách Chi An,Deli,"Máy vặn vít, tua vít",323.0,0,268000,268000,0
135350935,Set mỏ hàn thiếc mini  220V 60W với 5 mũi hàn +thiếc + nhựa thông tiện dụng,236529.0,Cá Mập Trắng,EOM,Máy hàn,433.0,84,99000,99000,0
142214410,Ổ Cắm Điện Đa Năng Thông Minh Phích Cắm Chuyển Đổi Với 2 Cổng USB Bugu HHT202 Tặng Hộp Đựng - Hàng Chính Hãng,160736.0,Love Me,Bugu,"Ổ cắm, ổn áp, biến áp",408.0,188,255000,242250,5
114738040,Tấm chia ngăn tủ ️Không cần khoan bắt vít - Thép chống rỉ sơn tĩnh điện - Mặt nhựa ABS cao cấp,245840.0,Đồ Gia Dụng Gia Đình Thông Minh,OEM,Root,531.0,81,90000,90000,0
175091479,Giấy bạc kháng khuẩn Nhật Bản 25cm x 10m chịu nhiệt tốt nướng thực phẩm,190794.0,MyJae Flagship Store,MyJae,"Màng nhôm, giấy bạc bọc thực phẩm",261.0,82,130000,59000,55
147100752,"Dụng cụ bơm hút rượu, xăng dầu chất lỏng bóp tay , hút chất lỏng bóp tay",294631.0,Bách Hóa 247 online,OEM,Phụ kiện nhà bếp khác,393.0,0,56000,56000,0
162122783,Bộ 6 Đĩa Sâu Thuỷ Tinh Luminarc Diwali Lines 20cm - LUDIQ1662,189048.0,Luminarc Official Store,Luminarc,"Tô, chén, dĩa",324.0,103,338000,237000,30
163580111,Bọ xiphong ống thoát chậu rửa chén siêu to,57051.0,thiết bị vệ sinh cao cấp Moonoah,	OEM,"Chậu, vòi rửa chén bát",319.0,325,580000,452400,22
162116332,Bộ 6 Tô Thuỷ Tinh Luminarc Diwali Lines 18cm - LUDIQ1672,189048.0,Luminarc Official Store,Luminarc,"Tô, chén, dĩa",324.0,53,600000,420000,30
199254482,"Đèn pin cầm tay siêu sáng chiếu xa 500m có Zoom xa gần, chip Led XHP50 tâm tròn, pin trấu, 7 chế độ sáng, chống nước IPX6",8999.0,Rẻ cùng bạn,OEM,Đèn pin,93.0,33,149000,146700,2
10647257,Ổ cắm Điện Quang ĐQ ESK 2B.SM750SL (5 lỗ 3 chấu dây 2 mét màu Đen Trắng Đỏ),17490.0,Điện Quang Official Store,Điện Quang,"Ổ cắm, ổn áp, biến áp",1419.0,314,243100,170000,30
193894899,phôi nấm bào ngư xám,211857.0,81farm,81 FARM,Hạt giống,149.0,166,15000,13700,9
207379266,"[Nguồn 220V] Đèn Led Đom Đóm Hạt Gạo Chống Nước Trang Trí Ngoài Trời, 8 Chế Độ Nháy",17480.0,Ghế Nam Việt,NAVIVU,Đèn khác,38.0,19,109000,109000,0
173433806,"Móc treo phơi quần áo em bé, khăn tay, tất vớ, đồ lót - Móc treo quần áo - Móc Inox treo đồ 10/20 Kẹp",170061.0,Bảo Hân Store 68,OEM,"Móc treo, kẹp quần áo",278.0,265,34000,34000,0
69193092,Bộ vòi xịt tăng áp lực rửa chén HOBBY VSTADAY có dây nối dài và khớp nối xoay - 3 chế độ phun cực mạnh,20023.0,Hobby Home Decor,Hobby Home Decor,Nhà Cửa - Đời Sống,819.0,433,119000,79000,34
54758744,"combo 5 keo bẫy  chuột siêu dính cao cấp , dùng được nhiều lần ",5697.0,Huy Tưởng Tphcm,OEM,Dụng cụ diệt côn trùng khác,965.0,1467,42000,25200,40
187184291,Băng Dính Silicol 2 Mặt Siêu Dính Siêu Tiện Lợi Ứng Dụng Vào Mọi Công Việc Vị Trí Trong Gia Đình,151652.0,Jodily StarHome HP,Jodily StarHome,Khác,197.0,74,35000,29000,17
188997797,Đầu Bàn ChảI Điện Oral B Braun - Người Lớn - Set 2-3-4-5-6 (không tách lẻ) - Hàng chuẩn Úc - Sản xuất tại Đức,293680.0,ANNY AUS STORE,OEM,"Bàn chải, dụng cụ thông tắc, cọ rửa",188.0,119,80000,80000,0
134232221,Đồng Hồ Điện Tử LED; Điều Khiển Giọng Nói; Báo Thức Kèm Nhiệt Độ - Hàng Nhập Khẩu,148768.0,Nụ Cười,iKiU,Đồng hồ để bàn,436.0,297,150000,150000,0
211905446,Đồ bộ siêu nhân kèm mặt nạ N,320802.0,Thế giới đồ chơi 99,OEM,Root,15.0,0,100000,100000,0
21229521,Hộp đựng giấy vệ sinh gắn tường cỡ lớn 26cm,9463.0,Giá rẻ mỗi ngày,OEM,Kệ nhà tắm,1283.0,431,119000,116600,2
152915395,Keo Dán Tường Đa Năng - Trám Vết Nứt Tường Thông Minh- LOẠI 1 - HÀNG CHÍNH HÃNG,134678.0,Smarthome29,MINIIN,Khác,376.0,169,32000,32000,0
17635804,Keo Liền Sẹo - Keo Liền Da Cây Mỹ Tiến 100gr,248161.0,TRUONGNGUYETLOC,OEM,Phân bón,1315.0,3,24000,24000,0
121602582,"Bình xịt chống thấm tường, Keo chống dột xịt chống thấm nhà, mái tôn, bể nước 720ml Waterproof",298269.0,ThuyDungShop2002,OEM,Root,484.0,3,88000,88000,0
10914085,Ổ cắm Điện Quang ĐQ 001A-02-2M (2 lỗ dây 2 mét),17490.0,Điện Quang Official Store,Điện Quang,"Ổ cắm, ổn áp, biến áp",1407.0,363,99800,85000,15
117048535,"Giấy lọc cà phê HARIO V60 100 tờ (size 02, màu tự nhiên) - V60 Paper Filter 02 M 100 sheets VCF-02-100M",108769.0,Hario Official Store,Hario,"Bình, ly uống cà phê và phụ kiện",515.0,354,109000,99000,9
207206135,"Tiền 0 Euro kỷ niệm World Cup 2022 Qatar được săn lùng, BÃO GIÁ",232469.0,Quà Tặng Tết PASA,PASACOLLECTION,Vật phẩm phong thủy khác,41.0,16,89000,86300,3
208527249,"Bộ Van Ngăn Mùi Hôi Cống Kèm Nắp Nhựa, Phụ Kiện Phễu Cao Su Silicon Lắp Thoát Sàn Nhà Tắm Phòng Vệ Sinh Chống Côn Trùng",317828.0,Sun Group,OEM,Root,26.0,15,38000,35100,8
89227279,"Giấy bạc dán tường nhà bếp chống thấm dầu, thấm nước tiện dụng, cách nhiệt",2684.0,HKT Home Shopping,ZOOYOO,Decal & giấy dán tường,638.0,664,69000,37800,45
176435276,Vòi Xịt Vệ Sinh Bồn Cầu Toilet Trong Nhà Tắm Tăng Áp Pimisi Chịu Áp Lực Nước - Mạ Xi Inox Sáng Bóng Từ Tay Xịt Và Dây Mềm Cao Cấp | Hàng Chính Hãng,127298.0,Pimisi,Pimisi,Vòi nước các loại,258.0,86,250000,157000,37
69248810,Kệ chân đế máy giặt tủ lạnh inox cao cấp 48-60cm,197704.0,Lộc Minh Phát,OEM,Kệ nhà bếp,819.0,0,172000,172000,0
199144803,"Bộ Dây đèn led đuổi ARGB 16 triệu màu, cảm biến âm thanh trực tiếp, điều khiển bằng điện thoại, led IP65 cao cấp",277227.0,Tấn Phát Store,OEM,Nhà Cửa - Đời Sống,94.0,13,279965,279965,0
39317473,Hộp 60 Viên Pin AAA Panasonic NEO ( Pin Đũa ) - Hàng Chính Hãng,71726.0,Thegioipin88,Panasonic,"Pin tiểu, pin sạc",1156.0,756,220000,210000,5
130978265,"Ổ cắm Xoay 90° Điện Quang ĐQ ESK RT 6GW (6 lỗ, màu xanh lá trắng)",51365.0,ABMA VIỆT NAM,Điện Quang,Nhà Cửa - Đời Sống,443.0,0,78000,78000,0
134351529,"Đũa Gỗ Dùng 1 Lần KETILO Cao Cấp, Thân Thiện Với Môi Trường, Không Hóa Chất Độc Hại, An Toàn Sức Khỏe Người Dùng(Giao Ngẫu Nhiên) - CHÍNH HÃNG ĐG001",189298.0,KETI LO,KETILO,"Đũa, muỗng, nĩa",435.0,536,33000,33000,0
