p_id,p_name,p_id_shop,p_shop_name,p_brand,p_categories,p_day_created,p_sold_quantity,p_original_price,p_current_price,p_discount_rate
158639945,"Hộp 20 Viên Pin AA / AAA Maxell Alkaline 1,5V - Hàng chính hãng",86463.0,Phụ Kiện Anh Ngọc,Maxell,"Pin tiểu, pin sạc",352.0,8,140000,140000,0
58828647,"Xe đẩy hàng 4 bánh SUMIKA T150 - Khung thép, tay cầm gấp mở tiện lợi, tải trọng 150kg",283011.0,Gia dụng Huy Linh,Sumika,Nhà Cửa - Đời Sống,883.0,0,949000,949000,0
107351108,Hạt giống Rau Mùng tơi F1 - Nảy mầm cao Titapha,92052.0,Phú Thành Phát,Titapha,Hạt giống,562.0,404,13900,13900,0
193279804,Bộ tranh đính đá 5D tự làm hình cô bé dễ thương 30*30cm,271210.0,Tranhdinhdatulam,OEM,Root,155.0,63,49900,49900,0
80757840,"Combo 3 Hộp Vải Đựng Đồ Đa Năng TD2 – Túi Vải Thụy Điển Không Nắp Bộ 3 Chiếc Sang Trọng, Đẳng Cấp miDoctor",34473.0,Danido Store,miDoctor,Tủ,667.0,1082,200000,147400,26
74155997,Đèn Pin Led Essesa Cầm Tay Có Thể Gắn Xe Đạp - Chính Hãng,134154.0,Funu Home,Essesa,Đèn pin,751.0,10,110000,110000,0
73095635,Giỏ Đựng Đồ Đa Năng Gấp Gọn Tiện Lợi - Màu Ngẫu Nhiên,115414.0,Gold,OEM,Giỏ đựng quần áo,776.0,30,110000,85000,23
191592137,Set quà tặng thảo mộc khô thơm - thương hiệu Citta - trang trí nhà cửa + thơm nhà,159301.0,Thế giới mùi hương tự nhiên,Citta,Nến trang trí & Phụ kiện,169.0,50,220000,220000,0
74285588,Khăn tắm lông cừu Hàn Quốc,53713.0,linhkien1984,OEM,Khăn,749.0,6,32900,32900,0
27656117,"Thùng rác nhựa văn phòng, kiểu Âu - Fitis 2 lớp (xám) - ROM3-909",24615.0,KENZIO,Fitis,"Thùng rác, đồ hốt rác",1078.0,69,190000,152000,20
195928002,Combo Chai Nhựa HDPE (250ml - 500ml - 1000ml) Có Nắp + Seal Chống Tràn,302028.0,Gia Dụng Hoàng Phát,OEM,Bình đựng nước,134.0,30,22500,22500,0
120339115,"Thanh xốp chắn cửa đa năng chống bụi, chống va đập khi gió mạnh",8426.0,Bao Bì Hiếu,OEM,Khác,494.0,0,9999,9999,0
34812576,Pin Đại Panasonic Ankaline LR20T/2B Hàng Chính Hãng,1242.0,"Vo Hoang Trading Co.,Ltd",Panasonic,Nhà Cửa - Đời Sống,1189.0,45,90000,90000,0
19822607,"Cân tiểu ly điện tử 5kg phím cảm ứng - cân tiểu li điện tử có độ chính xác cao, có lỗ treo tiện lợi",21344.0,NGUYỄN ĐẠT SHOP,OEM,Đồ dùng nhà bếp khác,1303.0,17,185000,185000,0
145750524,"Bộ Giá Đỡ Ke Bàn Gấp Treo Tường KUNBE, Bản Lề Gập Thông Minh Tiết Kiệm Không Gian, Chịu Tải Tốt",61513.0,chat24h,KUNBE,"Nội thất phòng học, làm việc khác",397.0,226,135000,111500,17
114633173,Bộ Khay đựng đồ ăn kèm phụ kiện bằng Lúa Mạch - Hàng Chính Hãng ,137411.0,Phụ Kiện Store 76,PaKaSa,"Khay, Thau, rổ",531.0,9,150000,110000,27
127126066,Hộp đựng bàn chải đánh răng diệt khuẩn bằng tia cực tím UV,254353.0,khoaitay boutique,OEM,Khác,459.0,0,129986,129986,0
75707305,Bộ May Vá Quần Áo Đa Năng Cho Gia Đình KUNBE Kèm Hộp Đựng Kim Chỉ,61513.0,chat24h,KUNBE,Phụ kiện phòng ngủ,722.0,476,70000,51400,27
36302375,Túi Đựng Hộp Cơm Giữ Nhiệt Đa Năng Họa Tiết Cá Và Sóng Biển Siêu Hot - Vàng,273327.0,Gia dụng thông minh HH,OEM,Túi đựng hộp cơm,1177.0,0,40500,40500,0
90439729,Bút thử điện dùng trong gia đình sieu bềnHàng cao cấp,252842.0,SHOP 94,OEM,Khác,634.0,0,30000,24200,19
152209577,Bộ miếng nhấc nồi chống nóng rẻ ( 1 bộ gồm 2 miếng ),47072.0,Quynhthy,OEM,Phụ kiện nhà bếp khác,378.0,149,10000,10000,0
207200186,"Bộ bình giữ nhiệt kèm cốc sang trọng, Cốc Ly đựng nước giữ nhiệt Vacuum Bottle INOX 304 500ml - Chính Hãng JYoohome",249634.0,Homebox Store,JYooHome,Bình giữ nhiệt,41.0,41,300000,150000,50
113458874,Tủ Để Đồ Thông Minh S Smart Tận Dụng Không Gian Cạnh Cửa Sổ - GP131,48574.0,IGEA Nội Thất Thông Minh,IGA,Kệ & Tủ,537.0,1558,415000,396000,5
106808360,"Bình Giữ Nhiệt Lock&Lock Riga Tumbler LHC4160 (897ml) - Hàng Chính Hãng, Bằng Thép Không Gỉ, Có Lưới Lọc Inox - Tặng Kèm Ống Hút Và Cọ Rửa Ống Hút",38510.0,JoyMall LocknLock Chính Hãng,LocknLock,Bình giữ nhiệt,553.0,373,735000,389000,47
93760107,"Dây đèn trang trí ngoài trời chống nước dùng cho quán cà phê, trà chanh, trà sữa đuôi đèn chống nước -thương hiệu Kiotool",7241.0,KIOTOOL Official Store,KIOTOOL,Đèn khác,618.0,623,103000,103000,0
150663096,"Bộ Chăn Ga Gối Cotton Tici M2T Bedding Drap Giường Đủ Kích Thước Trải Nệm 1m, 1m2, 1m4, 1m6, 1m8, 2m2 Không Kèm Ruột",252297.0,M2T Bedding Official,M2T BEDDING,Root,383.0,212,400000,320000,20
71518869,Nồi Decor Lock&Lock LDE1202IH (20cm) - Màu Navy,1.0,Tiki Trading,LocknLock,Nhà Cửa - Đời Sống,803.0,758,1098000,539000,51
5980477,Bình Ngâm Rượu Kim Cương Thủy Tinh 8833 Có Van,72116.0,MimiShoping,OEM,Bình đựng nước,1540.0,910,139000,139000,0
143644945,"Decal dán tường ngày tết Hoa Mai, Hoa Đào Sticker Decal Trang Trí Tết",2684.0,HKT Home Shopping,ZOOYOO,Decal & giấy dán tường,405.0,148,70000,40000,43
141230683,Hạt xốp làm đầy ghế lười - HXWBCK,239917.0,CUCKOO BEAN BAG,OEM,Bàn ghế các loại,413.0,79,108000,108000,0
54478757,"Đèn Bàn Học Đọc Sách, Làm Việc (Học Sinh, Sinh Viên, Văn Phòng) LED Chống Cận, Cảm Ứng Tích Điện Pin 3200mAh eLights TD-618",97355.0,Future Store,eLights,Nhà Cửa - Đời Sống,965.0,1818,300000,249000,17
173768367,"Hộp đựng đồ chia ngăn sắp xếp quần áo Danido - Khay đựng đồ 7 ngăn tiện ích, chất liệu cao cấp",34473.0,Danido Store,miDoctor,Tủ,274.0,319,150000,77800,48
207197323,"Túi treo túi xách đồ dùng đa năng, Túi treo giỏ xách, bóp ví 6 ngăn chống bụi bẩn có móc treo xoay 360 độ - Chính hãng JYoohome",249634.0,Homebox Store,JYooHome,Tủ,41.0,33,100000,60000,40
116191376,"Nhang trầm hương tự nhiên Thiên Mộc Hương 30cm, Ít Khói, Thơm Nhẹ, Dễ Chịu, Không kích mũi",1795.0,Thiên Mộc Hương Official Store,Thiên Mộc Hương,"Hương, nhang",471.0,325,396000,297000,25
161455577,Đui đèn cảm biến chuyển động,258659.0,Pin Bom Shop,OEM,Root,328.0,21,54000,54000,0
125968190,"Đèn Ngủ Để Bàn Mặt Trăng, Đèn Trang Trí Decor - Điều Chỉnh Độ Sáng Theo Ý Muốn - Hàng Chính Hãng - VinBuy",109746.0,VinBuy,VinBuy,Đèn ngủ,463.0,84,250000,125000,50
78025846,Khăn tắm Bamboo Life BL058 hàng chính hãng được làm từ sợi tre thiên nhiên mềm mại kháng khuẩn siêu thấm hút an toàn cho da,152044.0,Bamboo Life Official Store,Bamboo Life,Khăn,677.0,2363,59000,59000,0
50272433,"Đèn LED Bóng Tròn Pha Lê Bọt Khí Trang Trí Lễ Tết, Sinh Nhật, Nhà Cửa - Nhiều Kích Cỡ",17480.0,Ghế Nam Việt,OEM,Đèn khác,1029.0,414,69000,69000,0
90530495,"Đèn Pixar, Đèn Bàn Học Chống Cận Thị, Đèn Đọc Sách, Đèn Làm Việc Bảo Vệ Mắt - Hàng Chính Hãng Moontronics MT01",97355.0,Future Store,Moontronics,Đèn bàn,,537,310000,259000,16
198057044,Dây Đèn LED Edison S14 Năng Lượng Mặt Trời Chống Nước Trang Trí Ngoài Trời - Chính Hãng NAVIVU,17480.0,Ghế Nam Việt,NAVIVU,Đèn ngoài trời,106.0,14,660000,660000,0
104681323,Màng bọc PE chấm đứt 60m (M) (Tặng thêm màng bọc 30m) MyJae,190794.0,MyJae Flagship Store,MyJae,Màng bọc thực phẩm,573.0,498,99000,55000,44
54156958,Pin Sạc Energizer AAA 700mAh Power Plus,1242.0,"Vo Hoang Trading Co.,Ltd",Energizer,Nhà Cửa - Đời Sống,966.0,371,145000,145000,0
143779168,Thảm ngủ cá nhân văn phòng ,160163.0,K KRISHNA,Krishna,Chiếu,404.0,654,25000,25000,0
52260520,Pin AA Energizer LR6 AM3 1.5V,11618.0,MYMYMART,Energizer,Nhà Cửa - Đời Sống,1001.0,1278,39000,39000,0
149376396,"Túi peva SmileBox size lớn bọc nhiều bộ quần áo treo tủ chống thấm, chống bụi, có khóa kéo đôi tiện lợi nhiều size ngắn dài 90cm 110cm- Hàng chính hãng",10380.0,PhuKienMini,SmileBox,Tủ,386.0,55,105000,103000,2
183254388,"Ô (Dù) Tự Động 2 Chiều Cao Cấp Teement, Che Mưa, Che Nắng, Chống UV - Hàng Chính Hãng",147879.0,Thanh Giàu,TEEMENT,"Áo mưa, ô dù và phụ kiện đi mưa",218.0,52,175000,175000,0
36935892,Combo 10 khăn lau bếp đa năng - KL29 (Giao ngẫu nhiên mẫu),134133.0,An Vũ Techcom,OEM,Nhà Cửa - Đời Sống,1171.0,39,15000,15000,0
159236996,Bật lửa điện độc lạ tạo 4 tia plasma chóng gió sạc pin độc đáo,184269.0,Quang Duy Plasma,OEM,"Than, cồn & Dụng cụ mồi lửa",352.0,112,129000,119300,8
59149834,"Giường xếp đa năng, giường tre gấp gọn",169565.0,SharkDecorrHN,OEM,Nội thất phòng ngủ khác,877.0,0,1900000,1900000,0
133846119,"Hộp Cơm Giữ Nhiệt, Hộp Cà Men Inox SEASY SS35, Giữ Nhiệt Thức Ăn Lâu Hơn, 2 Lớp Cách Nhiệt, Thiết Kế Nắp Chống Tràn, An Toàn Sức Khỏe, Tặng Kèm Túi Giữ Nhiệt, Hộp Đựng Bộ Đũa Thìa, Miếng Cọ Rửa Tiện Lợi– Hàng Chính Hãng",195068.0,SEASY TECH STORE,SeaSy,Hộp đựng thực phẩm,436.0,240,389000,255000,34
21006786,Kệ Giày Dép 6 Tầng Rộng 60cm,16412.0,nolulu shop,OEM,Nhà Cửa - Đời Sống,1288.0,65,788200,600000,24
87941678,Sạc pin Camelion BC-0904 sạc được pin AA/AAA/9V,1242.0,"Vo Hoang Trading Co.,Ltd",Camelion,Máy sạc pin,639.0,31,190000,190000,0
2873653,Kệ Đỡ Màn Hình Máy Tính Monitor Stand Plyconcept MSM01004 ( 490 x 200 mm) - Gỗ Sồi,1303.0,MipuMade,Plyconcept,Kệ & Tủ,1644.0,915,380000,290000,24
181972379,"Chậu Xông Vùng Kín Sau Sinh, Chậu xông hơi vùng kín Gấp Gọn, gắn bồn cầu, bô xông vùng kín Tiện Lợi kèm Vòi xịt phụ khoa",308556.0,Gia Dụng Đời Sống Tiện Ích,OEM,Root,229.0,0,120000,120000,0
52785428,"Chốt khóa cửa trượt an toàn cho văn phòng, căn hộ, khách sạn chống mở từ ngoài - HOBBY KCT1",20023.0,Hobby Home Decor,Hobby Home Decor,Ổ khóa,992.0,210,125000,85000,32
26602007,Kẹp Bẫy Bắt Chuột Thông Minh,54154.0,hoangvietstore,OEM,Dụng cụ diệt côn trùng khác,1230.0,2,9900,9900,0
131894766,Dao thái thịt bò siêu mỏng - thép Nhật -Không rỉ-Chuôi gỗ hương,232776.0,Shop dao le ngoc,OEM,Dao các loại,442.0,16,135000,120000,11
76369610,Ca lọc cặn dầu bằng thép không gỉ - Chính hãng (Giao ngẫu nhiên),163615.0,HIBARWELL,BARWELL,Nhà Cửa - Đời Sống,709.0,201,195000,185000,5
198619155,Hộp Vải Đa Năng Gấp Gọn Có Khung Thép Nhiều Hoa Văn - Chính Hãng NAVIVU,17480.0,Ghế Nam Việt,NAVIVU,Tủ,99.0,6,139000,139000,0
34574806,"BƠM ĐIỆN 2 CHIỀU DÙNG BƠM PHAO, BỂ PHAO, NỆM HƠI",298269.0,ThuyDungShop2002,OEM,Khác,1185.0,0,80000,80000,0
52578184,"Tuýp Keo Dán Đồ Gia Dụng Siêu Dính, Keo Dán Kim Loại Cao Cấp",189795.0,MarryStore,OEM,Khác,996.0,504,15000,15000,0
166448776,"Tấm lót bình hoa, lọ hoa, bình trà, lót ly, chén bằng nhựa ren chống thấm",268454.0,Chun Decor,OEM,Root,307.0,70,20000,15000,25
198119267,"Lót ly giấy tiện dụng, lót ly thấm hút nước, sử dụng cho gia đình, tổ chức sự kiện. Tấm lót cốc cao cấp",157002.0,Cây kiểng Thạnh Xuân,OEM,Root,106.0,18,1500,1500,0
173971270,"Kệ chén bát 2 tầng trên bồn rửa tiện lợi VANDO bằng thép carbon cao cấp không gỉ, giá úp bát, kệ để chén sạch sẽ nhà bếp",157549.0,Vando Official Store,VANDO,Kệ nhà bếp,273.0,50,1199000,799000,33
138534630,Tủ quần áo KATA 5 tầng - Nhựa Talopa,238272.0,PHÚ MỸ furniture,Duy Tân,Tủ,421.0,435,1260000,1045000,17
96271704,"Ổ Cắm Điện Thông Minh XSmart Đa Tính Năng Chống Giật Hàng Siêu Cao Cấp,  Chống Cháy Nổ Chịu Được Công Suất Cao, Chính Hãng",152209.0,XSmart Official Store,XSmart,"Ổ cắm, ổn áp, biến áp",604.0,822,169000,139000,18
70684212,BG Ghế lưới làm việc ghế xoay văn phòng cao cấp mới 2020 Mẫu B200 BLACK (hàng nhập khẩu),1409.0,BG Việt Nam Official Store,BG,Bàn ghế làm việc,809.0,1409,969000,511200,47
79323086,"Đèn Ngủ kiêm Đèn Chiếu Ngàn Sao 6 phong cách xoay tự động, tích hợp phát nhạc bằng Bluetooth nhiều hiệu ứng, sạc bằng USB",133565.0,SmartTech-Shop,SPEVI,Đèn ngủ,672.0,205,380000,196000,48
57335326,"Ghế xếp thư giãn SUMIKA 179A - Khóa kim loại, khung thép tròn, tải trọng 200kg",283011.0,Gia dụng Huy Linh,Sumika,Bàn ghế các loại,918.0,10,825000,825000,0
173999814,"Kem giảm mụn Viêm, mụn ẩn KLENZIT C (15g)",282193.0,BEAUTY CHOICE,OEM,Phụ kiện phòng ngủ khác,273.0,276,130000,130000,0
188838171,ĐÈN LED LASER CHIẾU SAO BẦU TRỜI ĐẦU CẮM USB,132726.0,ATN SYSTEM,OEM,Đèn khác,189.0,28,54000,54000,0
73829087,Kệ rổ đựng đồ rửa chén có khay hứng nước HOBBY KRC5 - Inox 304 nhỏ gọn tiện lợi không rỉ sét,20023.0,Hobby Home Decor,Hobby Home Decor,Kệ nhà bếp,757.0,877,159000,105000,34
63051860, Đèn Học Làm Việc Đọc Sách Để Bàn Pixar Chống Cận Thị Bảo Vệ Mắt - Hàng Chính Hãng eLights,97355.0,Future Store,eLights,Nhà Cửa - Đời Sống,853.0,2580,189000,169000,11
161455657,Bóng đèn led 30W TAT,263733.0,Shop đèn led biên hoà,OEM,Root,328.0,1175,19000,19000,0
114204740,Bình giữ nhiệt inox 304 Sunhouse 900ml KS-TU900I,182530.0,GIADUNG TẤN PHÁT,Sunhouse,Bình giữ nhiệt,533.0,1,143500,143500,0
161455624,bóng đèn led 50W siêu sáng có ,203034.0,Gia Dụng Trí Vũ,OEM,Root,328.0,0,52000,52000,0
35958689,"Thang nhôm rút đôi chữ a Nhật Bản HAKAWA HK256 (5,6M) - Phân phối chính hãng - Nhỏ gọn tiện lợi ",8081.0,Thang Nhôm HAKAWA,HAKAWA,Nhà Cửa - Đời Sống,1181.0,239,5600000,3900000,30
150662102,Bộ ga giường và vỏ gối Cotton Tici M2T Bedding ga gối Cotton Hàn Quốc đủ size drap nệm,252297.0,M2T Bedding Official,M2T BEDDING,Root,383.0,79,250000,200000,20
26491454,Bộ 1 gói Hạt giống rau bạc hà italian (húng bạc hà),42056.0,KoyShop,OEM,Nhà Cửa - Đời Sống,1153.0,1584,6895,6826,1
172340730,"Túi Zip Bạc 1 Mặt Bạc, 1kg Túi Zip Bạc Đáy Đứng Đựng Thực Phẩm Cao Cấp",233963.0,Siêu thị túi đóng gói Elas House,OEM,"Túi, màng bọc thực phẩm",284.0,46,89000,45000,49
137226640,Nhang xanh trầm hương phổ thông - Hộp 500 gram,183040.0,HOÀNG VÂN SHOP,Nhang Xanh,"Hương, nhang",426.0,399,165000,165000,0
199535959,Cây Treo Quần Áo 3 Chân 8 Nhánh Treo Bằng Gỗ Cao Su Cao Cấp - Thương hiệu Viet Home Decor,69415.0,Viet Home Decor,Viet Home Decor,"Giá, kệ phơi quần áo",92.0,32,500000,330000,34
58207999,Thùng Đá Duy Tân (Họa Tiết Ngẫu Nhiên),112953.0,Ngọc Diệp HCM,Duy Tân,Root,902.0,6,235000,235000,0
16170433,"Combo 3 lõi lọc nước yamato 1,2,3 - 10 inch",8413.0,SMY (Tp.HCM),YAMATO,Lõi lọc,1328.0,805,190000,120100,37
1021671,Màng Bọc Thực Phẩm Ringo ST612SC 8936009561872 (30cm x 500m),98343.0,sieuthiat68,RINGO,"Màng nhôm, giấy bạc bọc thực phẩm",1840.0,528,255000,238500,6
50393230,Nhang Sạch Phòng Máy Lạnh - Ít khói - Hương trầm dịu nhẹ - Chân tăm mộc - Nhang Xanh ,3280.0,Nhang Xanh Official,Nhang Xanh,Nhà Cửa - Đời Sống,1027.0,480,27000,25200,7
162224791,(Size 137*180cm) Khăn Trải Bàn PVC/ Khăn Trải Bàn Họa Tiết Đa Dạng Siêu Xinh/ Khăn Bàn Ăn Chống Thấm Nước,152674.0,nhaxinhxinh,OEM,Root,323.0,58,40400,40400,0
11747533,Máy Khò Nhiệt màng  Khò nhiệt 2000W + móc khóa kĩ thuật,249606.0,gia dụng kim biên,OEM,Các loại máy khác,1388.0,0,366450,366450,0
50231888,Bộ Bàn ăn gỗ sồi mặt đá  Granite 6 ghế hàng chuẩn xuất khẩu ,218707.0,DAN ORGANIC,OEM,Bàn ghế,1029.0,0,10789000,10789000,0
142331006,Chuôi đèn liền công tắc Điện Quang ĐQ LH E27 ,17490.0,Điện Quang Official Store,Điện Quang,Linh kiện đèn,408.0,235,49800,40000,20
51969021,"Màng PE, Màng bọc hàng, Màng quấn pallet 50cm x 2kg",20680.0,SG Titapha Co LTD,Titapha,Khác,1003.0,457,159000,123000,23
99688742,"Khuôn Thạch Bi Tròn Hoa Quả Trái Cây/ Khuôn Rau Câu, Khay đá Viên Tròn 33 Viên",53713.0,linhkien1984,OEM,Root,593.0,0,15900,15900,0
160290544,"Dây chằng hàng, buộc hàng tăng đơ không móc, màu cam bản 2.5cm chiều dài 2 đến 15m - NIKITA",19288.0,NIKITA Official Store,Nikita,Dụng cụ ngoài trời khác,348.0,125,55680,46000,17
51462534,Thùng rác đạp chữ nhật Hiro 20L - trắng xanh đậm,17480.0,Ghế Nam Việt,Inochi,"Thùng rác, đồ hốt rác",1010.0,25,289000,289000,0
28039453,Bộ dụng cụ thông tắc bồn cầu và các loại ống nước bằng khí nén - Canino cao cấp,298269.0,ThuyDungShop2002,OEM,Nhà Cửa - Đời Sống,1227.0,0,179000,179000,0
59452929,Chén Chấm Sứ Trắng Bên Trong Nhiều Màu- Cổ Điển pha Lẫn Hiện Đại- Gốm Sứ Nhật,135995.0,XUANsHome,OEM,"Tô, chén, dĩa",869.0,235,22000,22000,0
194779476,Cây Dạ Lý Hương,36604.0,Cây Cảnh An Nhiên,OEM,Root,144.0,4,70000,70000,0
7583254,Vòi xịt vệ sinh inox - Vòi xịt bồn cầu inox SUS 304 cao cấp,291069.0,RUBY2,OEM,Vòi nước các loại,1505.0,7,151998,75999,50
184334157,"Đèn Học , Đèn Đọc Sách Để Bàn Chống Cận Có Ống Đựng Bút , Giá Đỡ Điện Thoại , Cổng Sạc Usb - Hàng Chính Hãng ",137411.0,Phụ Kiện Store 76,PaKaSa,Đèn bàn,217.0,6,380000,266000,30
95760230,[Quà Tặng] Gối Ôm Gòn Cao Cấp Thuần Việt,56226.0,NỆM THUẦN VIỆT,Nệm Thuần Việt,Ruột gối,151.0,93,599000,599000,0
160521556,"Rổ nhựa giả đan mây Việt Nhật đựng đồ dùng học tập, mỹ phẩm, trái cây",285421.0,Store H and k,OEM,Root,345.0,2,25000,25000,0
33337588,Áo Bọc Nệm Hai Mặt Có Khóa Đủ Kích Thước 10cm - Màu Ngẫu Nhiên,254905.0,Cửa hàng nệm trường phát,Happy,"Bộ ga, ra, drap",1199.0,67,95000,95000,0
38304453,"Ổ Cắm Điện Đa Năng 4 Tầng 16 Chân Cắm Điện, 3 Cổng USB Siêu tiện lợi",64160.0,Công Nghệ July,OEM,"Ổ cắm, ổn áp, biến áp",1162.0,5,215000,215000,0
22131223,Giấy Dán Tường Đáng Yêu Cho Bé,256755.0,Trangtrilyly,OEM,Decal & giấy dán tường,1275.0,0,78000,78000,0
44145738,kệ để gia vị KN 133,20367.0,VI TÍNH NAM TRUNG HẢI,OEM,Kệ nhà bếp,1122.0,0,139000,139000,0
21674758,"Bộ 6 thìa , muỗng gỗ NHÃN nhỏ múc gia vị màu nâu 9cmx3cm-TG22",20195.0,Mỹ Nghệ Việt,Vitrapro,Nhà Cửa - Đời Sống,1275.0,48,120000,120000,0
133866129,"Móc Dán Tường Inox 304 Sang Trọng, Cứng Cáp, Dùng Keo 3M, Nhiều Kiểu Dáng Đẹp",67869.0,Zen,SHOFUKA,"Giá, móc, cây treo",438.0,633,43000,43000,0
48476515," Set 10 Kẹp miệng túi đồ ăn, thực phẩm - Màu ngẫu nhiên",131912.0,Shop Thịnh,OEM,Nhà Cửa - Đời Sống,1057.0,55,19000,19000,0
160405368,"Dây mềm cho vòi xịt vệ sinh, uốn hình lò xo, sen tắm bằng nhựa PU, đầu bằng inox 304, dài 1.5m-2m-3m tùy chọn",242489.0,Shop Phương Bảo,OEM,Root,346.0,14,69400,69400,0
76404965,Bộ 2 Vòng sứ cô đặc dùng cho ấm sắc thuốc - mẫu ngẫu nhiên,131912.0,Shop Thịnh,OEM,Phụ kiện nhà bếp khác,710.0,62,32000,32000,0
372930,Thớt Nhựa Kháng Khuẩn Kova Hoa Sen TT- Xanh Lá,1.0,Tiki Trading,KOVA,Thớt nhà bếp,2138.0,219,260000,205000,21
17491634,"Dây xịt vệ sinh , dây sen - inox 304 dài 1,2m",5697.0,Huy Tưởng Tphcm,OEM,Vòi nước các loại,1316.0,24,30000,28200,6
580669,Thước Cuộn Tolsen 36004 - 5 Mét,10508.0,Khởi Phát,Tolsen,Thước đo các loại,2128.0,155,90000,90000,0
22081865,TÚI ÁO BÌNH GIỮ NHIỆT TIỆN LỢI,17480.0,Ghế Nam Việt,OEM,Nhà Cửa - Đời Sống,1274.0,1182,40000,40000,0
152780561,100 Tờ Giấy Nến Nồi Chiên 23cm Đục Lỗ Dùng Hấp Nướng Loại 1 Chính Hãng - Thấm Dầu Mỡ - An Toàn Cho Sức Khỏe,203034.0,Gia Dụng Trí Vũ,MINIIN,Phụ kiện nhà bếp khác,376.0,5,43000,43000,0
45098399,"Giá góc, kệ góc treo tường bằng miếng dính (không phải khoan) cho nhà bếp, phòng tắm thêm gọn gàng, để được nhiều đồ hơn",20367.0,VI TÍNH NAM TRUNG HẢI,OEM,Nhà Cửa - Đời Sống,1105.0,27,22800,22800,0
17347038,"Khuôn làm giò lụa, giò xào, chả inox tiện dụng loại 1kg",273325.0,Bách hóa tổng hợp 247,OEM,Nhà Cửa - Đời Sống,1317.0,0,42899,42899,0
98869615,Dụng cụ tách lòng đỏ lòng trắng trứng gà tiện lợi,186896.0,Phụ kiện tóc Na’s corner,OEM,Root,596.0,2,9000,6000,33
81291846,Thác Khói Trầm Hương - Thác trầm Tay Phật (Đen) chính hãng THAFA-TT01 - tặng 10 nụ trầm thơm tự nhiên ,148060.0,THAFA,THAFA,"Lư trầm, bát hương, bát nhang",663.0,69,65000,65000,0
9858449,Vòi xị đa năng rửa xe tưới cây 7 chế độ (giao màu ngẫu nhiên),258659.0,Pin Bom Shop,OEM,Vòi nước và phụ kiện tưới cây,1455.0,1,28845,28845,0
51843538,"Set 10 khăn lau đa năng 2 mặt lau bát đĩa, lau bếp, lau đồ đạc - màu ngẫu nhiên",273325.0,Bách hóa tổng hợp 247,OEM,Khăn,1008.0,0,17594,17594,0
57877773,Nồi Thuỷ Tinh Visions VS,51365.0,ABMA VIỆT NAM,Visions,Nồi các loại,909.0,59,949900,949900,0
32995319,Lọ đựng tiêu xay tiêu inox 304 cao cấp,291266.0,KandK12 Shop,OEM,"Dụng cụ xay, giã",1202.0,3,28999,28999,0
58600201,"Chảo Gang Chiên Nướng BBQ, Áp Chảo Chống Dính Ít Hao Dầu Mỡ",210077.0,smartsell3,OEM,Chảo các loại,891.0,22,114000,114000,0
75586779,"Cây lau cán rút gọn, Lau sàn nhà công nghiệp, lau ô tô xoay được 360 được làm bằng chất liệu Nhôm cao cấp ( các kích thước ) tặng chổi phất bụi",241961.0,siêu thị hà nội,OEM,"Chổi, cây lau nhà",727.0,0,365000,365000,0
100048105,Đồng hồ đo 7 chỉ số xe đạp thể thao,84183.0,King Sport Martial Art Store HN,OEM,Thiết bị đo lường khác,593.0,906,150000,150000,0
160583437,Thỏi Vàng Thần Tài Phong Thủy Trạm Rồng. Đỉnh Vàng Khắc 1 Chữ Hán Được Gộp Từ 4 Từ (Chiêu Tài Tiến Bảo),6270.0,GLORY VIỆT NAM,OEM,Vật phẩm phong thủy khác,344.0,9,58300,58300,0
34818286,"ĐỦ SIZE - Túi bạt, túi dứa có dây kéo đựng đồ, quai xách màu ngẫu nhiên (may từ vải bạt  Tú Phương)",240182.0,Viee Shop,OEM,Giỏ đựng quần áo,1191.0,65,34000,34000,0
181909432,Chảo Suit LocknLock - Màu Pink,1.0,Tiki Trading,LocknLock,Chảo các loại,229.0,161,709000,351000,50
180746646,"Bàn tăng giảm nâng hạ chiều cao thông minh iCockpit 1460, nâng hạ 80 kg, tặng móc treo tai nghe, giá để ly nước, thảm lót chuột",211062.0,Tăm nước Sài Gòn,iCockpit,Bàn ghế làm việc,230.0,118,5800000,2999000,48
153415687,"[GRMN14] Khăn vải phòng bếp, Khăn lau bằng vải thấm nước 2 mặt tiện lợi",229184.0,Giadungsaigon1977,OEM,Khăn,374.0,183,13000,7000,46
121220373,"Móc Dán Tường Treo Chậu Rổ, Treo Đồ Đa Năng Inox 304 Jodily Sử Dụng Miếng Dán Thế Hệ Mới",151652.0,Jodily StarHome HP,Jodily StarHome,"Giá, móc, cây treo",484.0,1300,15000,9000,40
193709920,Bình Đựng Nước 1L Bao Bì Dễ Thương Có Vạch Báo Giờ Uống Nước Chia Lượng Nước Deli - Nhựa Cao Cấp An Toàn Đầy Đủ Kiểm Định Chất Lượng Phủ Hợp Bình Nước Thể Thao Cho Bé Tới Trường - VS822 VS823,113115.0,Deli Official Store,Deli,Bình đựng nước,152.0,199,178200,79000,56
77448059,Cốc Giữ Nhiệt Lock&Lock LHC4247 (473ml),38510.0,JoyMall LocknLock Chính Hãng,LocknLock,"Ly, cốc & phụ kiện ly",698.0,74,484000,269000,44
198069246,"Bộ cây lau nhà VinBuy kèm thùng tự vắt thông minh, chổi lau nhà xoay 360 độ lau sạch nhanh ",109746.0,VinBuy,VinBuy,Dụng cụ lau nhà khác,106.0,76,511000,294500,42
207825592,"Cây lau nhà Phun nước + Tự vắt 2 trong 1 HOMEPOWER CS-02, Chất liệu nhôm cao cấp, thiết kế sang trọng hiện đại",166385.0,Homepower Official Store,Homepower,"Chổi, cây lau nhà",34.0,20,490000,249000,49
192471715,Topper Nệm Bông GONI Kiểu Nhật Phong Cách Tối Giản Êm Ái Gọn Nhẹ,267106.0,GONI Official Store,GONI,Nệm,161.0,89,388000,388000,0
115673330,[VỈ 20C KEO 3M MỚI] Nẹp Cố Định Dây Điện Kẹp Giữ Cáp Sạc Nẹp Dây Điện Chống Rối Dán Tường,167037.0,Hamart Gia Dụng Tiện Lợi,OEM,"Giá, móc, cây treo",526.0,384,40000,19700,51
204083681,"Đĩa Giấy Nến Thấm Dầu Lót Nồi Chiên Không Dầu, Chịu Nhiệt, Không Dính, Hút Dầu Mỡ",17480.0,Ghế Nam Việt,NAVIVU,Phụ kiện nhà bếp khác,62.0,57,19000,19000,0
14640564,Bộ Dụng Cụ Nâng Và Thiết Bị Di Chuyển Đồ Thông Minh,267549.0,SHOPNHIMCUNG,OEM,Khác,1350.0,0,79900,79900,0
61278429,Bình Nước Giữ Nhiệt Có Móc Treo (300ml),146174.0,HOÀNG HÀ 888,OEM,Bình giữ nhiệt,862.0,868,172000,86000,50
38369258,Phụ kiện trang trí giáng sinh trang trí Noel,107004.0,Dolare,OEM,Trang trí nhà cửa khác,1162.0,24,35000,35000,0
54097692,Pin Energizer 12V A23 BP1,1242.0,"Vo Hoang Trading Co.,Ltd",Energizer,"Pin tiểu, pin sạc",968.0,551,28000,28000,0
