p_id,p_name,p_id_shop,p_shop_name,p_brand,p_categories,p_day_created,p_sold_quantity,p_original_price,p_current_price,p_discount_rate
127215514," Hộp Đũa Dán Tường Jodily Có Nắp Sang Trọng, Sạch Sẽ",151652.0,Jodily StarHome HP,Jodily StarHome,Phụ kiện nhà bếp khác,457.0,351,205000,190000,7
198995620,Kệ để giày dép chữ x - Kệ để giày dép tháo lắp 5 - 6 tầng có thể tháo lắp gấp gọn,160608.0,AT HOME,OEM,Kệ & Tủ,96.0,228,39000,39000,0
72797082, Chảo Sâu Lòng DECOR Lock&Lock LDE1225IH 22cm (màu vàng) - Hàng chính hãng ,1.0,Tiki Trading,LocknLock,Nhà Cửa - Đời Sống,779.0,802,662000,328000,50
205856283,"Bộ ga giường K-Bedding KMP chất liệu Microfiber bền chắc, kháng khuẩn (KHÔNG BAO GỒM CHĂN)",2207.0,Everon Official Store,K-Bedding,"Bộ ga, ra, drap",48.0,37,650000,422000,35
199728521,Bộ lau nhà đa năng Space Saving Sunhouse KS-CL3211P,1.0,Tiki Trading,Sunhouse,Dụng cụ lau nhà khác,90.0,223,450000,275000,39
59341791,Set 100 túi lọc trà vải không dệt- sản phẩm có nhiều kích thước,67417.0,Shop AZ,OEM,Nhà Cửa - Đời Sống,869.0,81,31000,31000,0
108280989,"1 Vỏ gối ôm cao cấp A kích thước 35x100cm (giao mẫu ngẫu nhiên), lớp vải dày cùng với đường may chắc chắn giúp bảo vệ lõi gối bên trong an toàn",2443.0,Shop Ánh Sao,A,Vỏ gối,559.0,304,75000,65000,13
74859074,"Chuông Cửa Không Dây Thông Minh CTFAST CT - 01 (1 Nút Bấm, 1 Chuông ), Chống Nước, Khoảng Cách Sử Dụng Hiệu Quả 300 mét - Hàng Chính Hãng",142623.0,LEDANTA,CTFAST,Nhà Cửa - Đời Sống,734.0,186,199000,176300,11
174184368,Topper làm mềm nệm LIDACO chuyên dùng khách sạn vải cotton chuẩn dày 7cm,43482.0,Lidaco Official Store,LIDACO,Phụ kiện nệm,271.0,29,379000,336000,11
147975049,Thảm Chùi Chân Lau Chân trải sàn TCS SHOUSE phòng khách phòng tắm cao cấp giá rẻ 3d chống trượt hình thú đế cao su hút nước,141070.0,Shouse,Shouse,Thảm chùi chân,389.0,1142,39000,39000,0
48717416,"1kg - Túi đựng rác gia đình , Bao đựng rác văn phòng size trung 55x65 màu đen",92052.0,Phú Thành Phát,Titapha,Túi đựng rác,1047.0,1607,68000,39000,43
188375839,Khăn tắm Khăn lau mặt Cotton 100% Mềm Êm Dày dặn Màu trơn Nhấn viền họa tiết 74x33cm,173842.0,HomeMi Shop,CHIKIGON,Khăn,191.0,260,53000,53000,0
72660053,Miếng Dán Tường Dự Phòng Cho Kệ Nhà Tắm OENON ,72734.0,OENON,OENON,Kệ nhà tắm,785.0,909,50000,25000,50
191604178,"Đèn đốt nến thơm, an toàn, sang trọng, phù hợp mọi không gian",159301.0,Thế giới mùi hương tự nhiên,Aurae,Đèn khác,168.0,41,373000,373000,0
97790251,Hạt giống Ớt Chỉ Thiên F1 - Nảy mầm cao Titapha,20680.0,SG Titapha Co LTD,Titapha,Hạt giống,593.0,87,13000,13000,0
185674459,Set 3 nĩa ăn mini Echo,133097.0,Phú Sĩ Arigatou,OEM,"Đũa, muỗng, nĩa",208.0,28,38000,27000,29
173635827,"Kệ Góc Nhà Tắm INOX 304/ Kệ Góc Dán Tường Nhà Tắm, Nhà Bếp Siêu Chắc Chắn - Tặng Kèm Tấm Dán - Hàng Chính Hãng",249634.0,Homebox Store,JYooHome,Kệ nhà tắm,277.0,835,130000,68000,48
53116344,Súng bắn keo nến silicon + Tặng 10 cây keo silicon nến,5411.0,vinet shop,OEM,Súng bắn keo,988.0,72,38700,38700,0
119309533,"Gối cao su non có gel lạnh Ema cho người lớn - Chống ngủ ngáy, giảm đau mỏi cổ vai gáy - Phòng ngừa thoái hóa đốt sống cổ - Phong cách Nhật Bản",18299.0,Gối nêm Hi-Sleep Store,Ema,Gối các loại,500.0,1726,650000,325000,50
141231743,Ruột Chăn Bông Trắng Everon Lite chuẩn 5 sao khách sạn,2207.0,Everon Official Store,Everon Lite,"Chăn, mền và phụ kiện",413.0,127,750000,452000,40
105657875,Giá Treo Quần Áo INOX Cao Cấp VANDO Hàng Loại 1 Chịu Lực 160kg Chắc Chắn Giá Kệ Phơi Đồ 2 Thanh Sức Chứa Lớn,157549.0,Vando Official Store,VANDO,"Giá, kệ phơi quần áo",568.0,973,999000,695000,30
110204562,Túi Lọc Rác Bồn Rửa Chén Bát JOYLOT - Túi Lưới Vải Tự Phân Huỷ Có Chun Miệng Túi - Mifan Hàng Chính Hãng,76621.0,Mifan Official Store,Joylot,Phụ kiện nhà bếp khác,548.0,1746,30000,17900,40
71518864,Nồi Decor Lock&Lock LDE1182IH (18cm) - Màu Kem,1.0,Tiki Trading,LocknLock,Nhà Cửa - Đời Sống,803.0,565,1043000,512000,51
89308474,Thước Dây Da Cuộn Deli - 1.5M - Hồng/ Xanh Lá/ Trắng/ Xanh Dương - 1 Chiếc - 79650,113115.0,Deli Official Store,Deli,Thước đo các loại,638.0,968,45000,25000,44
3677753,Bình Lọc Nước BRITA Flow Basic Blue - 8.2L (Kèm Maxtra Plus) - Hàng Chính Hãng,6916.0,BRITA VIỆT NAM,Brita,Nhà Cửa - Đời Sống,1605.0,3034,2249000,1499000,33
86263672,Nồi quánh chống dính đa năng Dr.Hows Poco,175722.0,Dr.HOWS Official,Dr.Hows,Nồi các loại,638.0,29,1750000,1750000,0
208411197,Đèn bắt muỗi Điện Quang ĐQ EML06L ,17490.0,Điện Quang Official Store,Điện Quang,Nhà Cửa - Đời Sống,27.0,1095,413400,289000,30
205973149,Đồng Hồ Để Bàn lật số cơ học Auto Flip Clock Retro Mac Setup Đồng hồ phong cách vintage cổ điển Sang Trọng chất liệu thép không gỉ,285488.0,Office Chill,OEM,Đồng hồ để bàn,47.0,42,540000,285000,47
199539210,"Dụng Cụ Làm Sạch Tôm Hai Đầu, Dao Làm Lòng Gà, Mổ Cá Cạo Vảy, Lột Bóc Vỏ Tôm, Cua Sò, Dụng Cụ Nhà Bếp Bằng Inox Không Gỉ",165627.0,LÊ THỊ HƯƠNG VIỆT BẢO TÍN,OEM,Phụ kiện nhà bếp khác,92.0,55,25000,13500,46
68279903,Nến Điện Tử Tim Lắc Cao Cấp Mô Phỏng Như Nến Sáp Tặng Kèm Pin,17480.0,Ghế Nam Việt,OEM,Nến trang trí & Phụ kiện,833.0,137,90000,90000,0
13619778,Đồng Hồ Treo Tường P1 (25cm) - Màu ngẫu nhiên,138330.0,TQT Decor,OEM,Đồng hồ treo tường,1367.0,4,80000,80000,0
205531604,"Set Thớt Kháng Khuẩn 5D, Chống Trơn Trượt 35x25 Cm - Hàng Nhập Khẩu",193366.0,HOMES STORE,OEM,Thớt nhà bếp,51.0,87,319000,169000,47
52774383,Đèn LED Đom Đóm Chipsbling Dùng Pin Năng Lượng Mặt Trời ,291080.0,ShopAnZ,OEM,Đèn khác,993.0,0,148999,148999,0
107063648,"Ly nhựa 2 lớp Lock&Lock HAP507 750ml - Hàng chính hãng, có ống hút, có nắp đậy - Tặng kèm cọ rửa",38510.0,JoyMall LocknLock Chính Hãng,LocknLock,"Ly, cốc & phụ kiện ly",560.0,466,227000,119000,48
207336569,"BIG SIZE - Túi đựng quần áo chăn màn vải canvas chống thấm nước, Thùng giỏ đựng đồ đa năng gấp gọn tiện lợi - Hàng Chính Hãng JYoohome",249634.0,Homebox Store,JYooHome,Tủ,39.0,110,100000,58000,42
59318679,Bộ Ga Gối Cotton Tici Kẻ LIDACO Cao Cấp - Caro Nâu Nhạt - TẶNG 01 VỎ GỐI ÔM,43482.0,Lidaco Official Store,LIDACO,"Bộ ga, ra, drap",874.0,504,238000,218000,8
165029589,VỢT BẮT MUỖI CAO CẤP 2 IN 1 DP - 834,267066.0,ANT Thiết Bị Điện,OEM,Root,311.0,4,145000,145000,0
68478297,Combo 2 Ron Thanh Nẹp Xốp Chèn Chắn Cửa Chống Bụi Côn Trùng Dài 90cm Legaxi,3196.0,Legaxi Official,Legaxi,Khác,828.0,3841,36000,36000,0
201112268,"Thảm Nhà Bếp Siêu Thấm Dễ Dàng Vệ Sinh, Thảm Silicon 4 Lớp NAVIVU",17480.0,Ghế Nam Việt,NAVIVU,Thảm chùi chân,81.0,53,129000,129000,0
22764290,Ghế Lùn Xếp Duy Tân - Giao Màu Ngẫu Nhiên,1.0,Tiki Trading,Duy Tân,Nhà Cửa - Đời Sống,1269.0,2828,59000,41000,31
173710560,"Cuộn Khăn Giấy Lau Đa Năng - Chất Liệu Rayon An Toàn - Lau Chén Đĩa , Lau Nhà Bếp..vv - Hàng Chính Hãng",137411.0,Phụ Kiện Store 76,PaKaSa,Khăn,276.0,135,70000,49000,30
72049662,"Combo 6 Túi Giặt Lưới Bảo Vệ Quần Áo, túi lưới mịn polyester bảo quản quần áo",270513.0,HALOTA,OEM,Túi giặt,796.0,1,150000,150000,0
3607659,Kéo cắt cành cây Nhật ,298269.0,ThuyDungShop2002,OEM,Dụng cụ làm vườn khác,1608.0,6,59000,59000,0
14895703,Bộ tua vít đa năng 32 đầu,6351.0,Siêu Thị Linh Kiện,OEM,"Máy vặn vít, tua vít",1343.0,2,52999,52999,0
202805092,"Bình Giữ Nhiệt 800ml Lock&Lock Vacuum Bottle LHC6180 - Hàng Chính Hãng, Bằng Thép Không Gỉ, Có Lưới Lọc Trà Bằng Inox, Mức Giữ Nhiệt Vượt Trội Tặng Kèm Ống Hút Inox",38510.0,JoyMall LocknLock Chính Hãng,LocknLock,Nhà Cửa - Đời Sống,70.0,994,697000,369000,47
74296343,Chảo chiên Lock&Lock Handycook LHD1163 có tay cầm 16cm,1.0,Tiki Trading,LocknLock,Chảo các loại,749.0,855,220000,113000,49
70898819,Giấy ăn giấy gấu trúc Ycool -khăn giấy rút 300 tờ 1bịch 10 gói mẫu trắng,131980.0,Giấy ycool,ycool,Phụ kiện nhà bếp khác,777.0,1866,43000,43000,0
206473614,"Túi Vải Đa Năng Đựng Đồ Quần Áo, Chăn Ga Gối Màn Gấu Bông, Sách Vở Khéo Khoá Deli - Hộp Vải Đựng Đồ Khung Thép Chịu Lực Cao Cấp - Nhiều Size Kích Cỡ Lớn Nhỏ",113115.0,Deli Official Store,Deli,Tủ,44.0,71,135000,75000,44
128206072,"Bộ Cọ Nhà Vệ Sinh, Nhà Tắm Tự Động Không Dây Thông Minh 360 Độ Với 4 Đầu Cọ Thay Thế Tiện Lợi, Đơn Giản Và Dễ Dàng Sử Dụng",291266.0,KandK12 Shop,OEM,"Bàn chải, dụng cụ thông tắc, cọ rửa",454.0,4,520499,520499,0
167019283,"Đèn Pixar, Đèn Bàn Học Chống Cận Thị, Đèn Làm Việc Để Bàn Bảo Vệ Mắt - Hàng Chính Hãng - VinBuy",109746.0,VinBuy,VinBuy,Đèn bàn,303.0,244,360000,180000,50
120470959,Bình Nước Thuỷ Tinh Luminarc Arc 1.3L - LUBIG2662,189048.0,Luminarc Official Store,Luminarc,Bình đựng nước,493.0,281,111000,50000,55
198097413,Máy Xay Hạt Khô Tiêu Chuẩn Châu Âu Máy Xay Ngũ Cốc Mini Công Suất 300w Lưỡi Dao 6 Cánh Thân Máy Bằng Thép Không Gỉ - Hàng Loại 1 - Chính Hãng MINIIN,134678.0,Smarthome29,MINIIN,"Dụng cụ xay, giã",105.0,124,329000,164500,50
160278163,[COMBO] Trà Nam Mỹ Yerba Maté 180g vị Truyền thống + Cốc Gourd và ống hút Bombilla mới,202853.0,Matéa Yerba Maté,OEM,"Bình, ly uống trà và phụ kiện",348.0,218,425000,425000,0
196530625,"Xô nước gấp gọn, xô đa năng vệ sinh nhà cửa, xô giặt lau nhà, chùi kính, xô ô tô Parroti Extra XT01",96639.0,Parroti Store,Parroti,"Bàn chải, dụng cụ thông tắc, cọ rửa",121.0,113,209000,145000,31
159971094,"Bộ 2 hộp vải đựng đồ 7 ngăn mã HQ2, Combo 2 hộp vải đựng quần áo chia ngăn gọn gàng tiện lợi chất vải Oxford cao cấp miDoctor",34473.0,Danido Store,miDoctor,Tủ,349.0,1028,250000,157600,37
36960736,Dây Đèn LED Trang Trí Bông Tuyết,273325.0,Bách hóa tổng hợp 247,OEM,Đèn khác,1173.0,1,88000,88000,0
94888985,Sọt Đựng Quần Áo Bẩn Túi Đựng Đồ Đa Năng,17480.0,Ghế Nam Việt,OEM,Giỏ đựng quần áo,614.0,250,95000,95000,0
141502984,"Sét 50 Chén(Bát) Giấy FEST BIO BOWL 350mlTHÁI LAN Hàng Nhập Khẩu Cao Cấp, Dùng Tốt Trong Lò Vi Sóng, Lò Nướng Dùng 1 Lần Tiện Lợi, An Toàn - CHÍNH HÃNG F012(Tặng Móc Khóa KETILO)",189298.0,KETI LO,FEST,"Tô, chén, dĩa",412.0,234,115500,115500,0
37891224,"Súng bắn keo 20w, Tặng 10 keo nến 19cm",5411.0,vinet shop,OEM,Súng bắn keo,1167.0,483,39600,39600,0
182148476,Combo Móc Dán Tường In Hình Họa Tiết Dễ Thương Loại Lớn PaKaSa - Hàng Chính Hãng ( Giao họa tiết ngẫu nhiên ),137411.0,Phụ Kiện Store 76,PaKaSa,"Giá, móc, cây treo",227.0,121,76000,59000,22
101947582,Combo 2 Khăn Lau Đa Năng Siêu Thấm Nước,277866.0,WFAST,OEM,Khăn,586.0,5,6890,6890,0
196358685,"[ Gift ] Áo thun ngắn tay Bosch, size ngẫu nhiên",153.0,DIYHOMEDEPOT (TP.HCM),Bosch ,Bảo hộ lao động,118.0,80,0,0,0
90523892,"Ly Giữ Nhiệt Lock&Lock Energetic One Touch Tumbler LHC3249 (550ml) - Hàng Chính Hãng, Bằng Thép Không Gỉ Inox 316L, Nắp Mở Một Chạm, Tặng Ống Hút Và Cọ Rửa",38510.0,JoyMall LocknLock Chính Hãng,LocknLock,"Ly, cốc & phụ kiện ly",618.0,939,568000,289000,49
191911148,"Kệ sách gỗ xương rồng, kệ sách hình cây gỗ MDF cao cấp, chống mối mọt, đựng sách 8 ngăn 50x20x120 ND25",275563.0,Tiệm Gia Dụng Tháng 5,OEM,"Tủ, kệ sách",167.0,96,220000,162500,26
73529777,"Kệ chén bát đa năng bằng thép carbon không gỉ, chống xước, sơn đen tĩnh điện, giá bát trên bồn rửa ráo nước cho nhà bếp sạch sẽ VANDO",157549.0,Vando Official Store,VANDO,Kệ nhà bếp,763.0,2564,690000,599000,13
4995493,"Thang Nhôm Rút Chữ A Sumika SK380D NEW - Chữ A cao 1.9m, chữ I cao 3.8m, tải trọng 300kg",1764.0,PGN Professional Equips & Cleaning,Sumika,Nhà Cửa - Đời Sống,1542.0,1425,2300000,1779000,23
195105079,Vỏ Áo Gối Ôm Tencel Thuần Việt Cao Cấp - Kích Thước 35x100cm - Mẫu Ngẫu Nhiên,56226.0,NỆM THUẦN VIỆT,Nệm Thuần Việt,Vỏ gối,141.0,102,214000,78000,64
35273810,"Keo vá tường,Keo trám vết nứt tường thông minh - Tặng kèm bộ dụng cụ",152674.0,nhaxinhxinh,OEM,Khác,1189.0,87,21400,21400,0
118315498,Dao gọt trái cây Tefal Comfort K2213504 9cm - Hàng chính hãng,121435.0,Tefal Official Store - Chính hãng,Tefal,Dao các loại,505.0,232,299000,188000,37
51737688,Túi Đựng Chăn Màn - Hộp Đựng Quần Áo Khung Sắt Gấp Gọn Amalife - Màu Ngẫu Nhiên,34473.0,Danido Store,Amalife,Nhà Cửa - Đời Sống,1009.0,4936,130000,88000,32
169208802,"Vỏ gối chất liệu Cotton 40x60, 50x70 mềm mại siêu rẻ cho khách sạn, phòng ngủ, phòng trọ",265861.0,Linh Trung Store,	OEM,Vỏ gối,298.0,709,30000,29500,2
75339729,"Chổi Quét Trần Nhà, Chổi Phất Trần Có Cán Điều Chỉnh Độ Dài KUNBE Quét Mạng Nhện, Lau Chùi Bụi Bẩn Trên Cao Tiện Dụng",61513.0,chat24h,KUNBE,"Chổi, cây lau nhà",730.0,857,140000,86000,39
52053584,Chảo Tefal lòng sâu chống dính - So Chef G1358696 - hàng chính hãng,138278.0,AM MART,Tefal,Chảo các loại,1002.0,57,414000,345000,17
445730,Bếp Nướng Than Inox Prota P016 - Kèm Theo 1 Vỉ Nướng,1.0,Tiki Trading,Prota,"Bếp nướng, vỉ nướng",2138.0,3004,159000,136000,14
183335881,"RÈM VẢI MÀU XANH DƯƠNG TRƠN CHỐNG NẮNG, NHIỀU KÍCH THƯỚC LỰA CHỌN",282852.0,Monaco Luxury,OEM,"Rèm, màn cửa",218.0,69,75000,75000,0
53647975,"1 Gối Ôm thương hiệu A có khóa kéo - an toàn sức khỏe, không chứa chất độc hại - êm ái, mềm mịn",2443.0,Shop Ánh Sao,A,Gối các loại,980.0,1029,150000,123100,18
130385982,"Vòi hoa sen tăng áp  Luva VS4, tăng áp lực nước, hàng chính hãng",110489.0,Tiện Ích Công Nghệ Mới,Luva,Vòi nước các loại,442.0,227,199000,199000,0
122277622,"Gối dựa lưng cao su non có gai massage EMA cho dân văn phòng, lái xe, học sinh - Thế hệ thứ 3 nâng cấp gai massage độc đáo",18299.0,Gối nêm Hi-Sleep Store,Ema,Gối các loại,481.0,378,420000,210000,50
197115273,Gối Kê Cổ Chữ U Văn Phòng Bamozo Tiện Dụng Chống Mỏi Vai Gáy,71793.0,Bamozo Official,BAMOZO,Phụ kiện du lịch khác,119.0,62,169000,119000,30
59598451,"Miếng xốp bọc chân cửa chắn gió chống bụi, ngăn tiếng ồn, ngăn côn trùng 93 x 9.6cm",2225.0,chuyên giấy dán tường aqa,OEM,Nhà Cửa - Đời Sống,867.0,142,15199,15199,0
150567627,"Ruột Gối Ôm Lông Vũ Microfiber A 35x100cm - tặng kèm túi xách đựng gối sang trọng màu ngẫu nhiên - Tạo giấc ngủ bồng bềnh, an toàn sức khoẻ",2443.0,Shop Ánh Sao,A,Gối các loại,383.0,49,350000,210000,40
74935368,"Chuông Cửa Không Dây Thông Minh Besti , Chống Nước Khoảng Cách Sử Dụng Trong 300M - Hàng Chính Hãng",147879.0,Thanh Giàu,Besti,Nhà Cửa - Đời Sống,736.0,592,170000,170000,0
48716910,"6 cuộn Túi đựng rác gia đình, Bao đựng rác văn phòng tiện lợi 3 màu size trung 55x65",92052.0,Phú Thành Phát,Titapha,Túi đựng rác,1051.0,1233,95000,79000,17
148873333,"Sạc Thông Minh K65 3.7V 4.2V Sạc Các Loại Pin 14500, 18650 (Sạc tự ngắt, có đèn báo, không kèm pin)",17480.0,Ghế Nam Việt,OEM,Máy sạc pin,388.0,142,99000,99000,0
113182744,RÈM VẢI GẤM MỀM CHẤT LIỆU CAO CẤP GIÁ HẠT RẺ MANG ĐẾN SỰ SANG TRỌNG TƯƠI MỚI CHO CĂN NHÀ,204611.0,Xưởng Rèm Trang Trần,OEM,Root,538.0,56,110000,110000,0
202229558,"Ổ cắm đa năng 4 trong 1, Sạc nhanh IQ 5V-3.4A có sạc tyc sạc usb, Chống cháy nổ tiện lợi.",200309.0,phụ kiện BO shop,OEM,"Ổ cắm, ổn áp, biến áp",74.0,57,299000,299000,0
69741184,"Thanh treo inox cao cấp không cần khoan tường, siêu chắc chắn, khả năng chịu tải cao HT07",207207.0,Kho Hàng Gia Dụng TH 247,OEM,Kệ nhà tắm,817.0,6,117000,117000,0
208525015,"Khuôn Giò Xào Inox, Khuôn Làm Giò 1-2 Kg Thiết Kế Mới",316139.0,Smarthome24h,OEM,Khuôn làm bánh,25.0,34,36900,36900,0
119790624,COMBO 2 Bẫy Chuột Tự Động Bập Bênh Siêu Nhạy Thiết Kế Nắp Lật Có Thể Tái Sử Dụng,192111.0,BHome6868,OEM,Dụng cụ diệt côn trùng khác,497.0,82,36000,30000,17
57243045,"Cuộn 10 Mét Ron Dán Khung Cửa Giảm Tiếng Ồn Va Đập, Ngăn Bụi, Ngăn Côn Trùng Size  4 mm 6 mm 8 mm 10 mm - Hàng Chính Hãng",54602.0,HUY HÙNG AFAST,3M,Khác,922.0,1023,99000,99000,0
25412653,Cây lăn bụi quần áo đa năng kèm 2 cục dự phòng,53713.0,linhkien1984,OEM,Cây lăn bụi,1244.0,11,24100,24100,0
77330041,"Bộ 04 chân đế cao su đa năng - HT SYS - Đế chống rung máy giặt - Đế chống ồn máy giặt, máy sấy,tủ lạnh, bàn ghế ",78619.0,Muasam247,HT SYS,Phụ kiện giặt ủi khác,698.0,201,66000,52000,21
98153708,"Chậu Gội Đầu Tại Giường KUNBE, Chậu Gội Đầu Tại Nhà Thông Minh Cho Mọi Người - Tặng Lược Massage Và Cốc Gội Đầu",61513.0,chat24h,KUNBE,"Xô, thau, chậu",590.0,665,350000,239000,32
52756206,1kg Túi Đựng Rác Tự Phân Hủy Sinh Học Gimex II (full size),19256.0,Công ty TNHH LPS VINA,Túi ni lông tự phân hủy sinh học GIMEX II,Túi đựng rác,989.0,2942,36000,36000,0
177780907,Nến thơm Candle Cup/Agaya - Hương Gỗ ĐÀ LẠT,159301.0,Thế giới mùi hương tự nhiên,Candle Cup,Nến trang trí & Phụ kiện,243.0,66,120000,120000,0
37164065,HỘP KEO VÁ TƯỜNG THÔNG MINH CHỐNG BONG TRÓC,5411.0,vinet shop,OEM,Khác,1168.0,215,18100,18100,0
10032000,Ổ cắm đa năng du lịch Adapter,6351.0,Siêu Thị Linh Kiện,OEM,"Ổ cắm, ổn áp, biến áp",1450.0,70,32000,32000,0
56400156,"Đèn LED Hình Ngôi Sao Trang Trí Giáng Sinh, Noel, Lễ Tết",291080.0,ShopAnZ,OEM,Đèn khác,937.0,3,32899,32899,0
73147684,"Thanh xốp gắn chân cửa chống kẹt chân cho bé, bịt khe hở, chắn gió, chặn côn trùng",2225.0,chuyên giấy dán tường aqa,OEM,Khác,775.0,45,14999,14999,0
51915247,Combo 200 túi lọc rác bồn rửa bát,6351.0,Siêu Thị Linh Kiện,OEM,Phụ kiện nhà bếp khác,1008.0,50,26996,26996,0
115506559,"Túi đựng rác dẻo dai bịch 5 cuộn, kích thước 45x50cm, có nhiều màu sắc phù hợp với mọi nhà",67869.0,Zen,SHOFUKA,Túi đựng rác,527.0,375,60000,41000,32
36629994,Pin Sạc Lithium 18650 3.7V  new,76796.0,Vietstore24h,OEM,"Pin tiểu, pin sạc",1175.0,43,18500,18200,2
42491736,"Bút thử nước TDS, dụng cụ đo TDS, máy đo độ cứng của nước - Hàng chính hãng",8413.0,SMY (Tp.HCM),SMY,Nhà Cửa - Đời Sống,1137.0,1330,150000,145700,3
183038438,"Bình xịt tưới cây MONROVIA 2 lít, bán tự động, phun sương tưới cây cảnh, vòi dài, tặng vòi ngắn, màu xanh, tiêu chuẩn Châu Âu",165121.0,Monrovia Official,Monrovia,Vòi nước và phụ kiện tưới cây,223.0,72,169000,169000,0
106676695,"Bộ Thau Rổ Nhựa Cao Cấp Yoko INOCH - Nhựa Cao Cấp Chắc Chắn Sang Trọng, Gọn Gàng, An Toàn Cho Sức Khoẻ",185072.0,INC Gia Dụng,Inochi,Root,566.0,806,69000,34500,50
163550425,"Nệm Bông Gòn Xuất Nhật, Nệm Trải Sàn Tiện Lợi, Đệm Văn Phòng Size 1m x 2m; 1.4m x 2m; 1.6m x 2m",44079.0,Xưởng SX Nệm,FUKOJI,Nệm,308.0,32,500000,392988,21
57867024,Bộ Lau Nhà Xoay 360 Độ Sunhouse Ks-Cl350PO,182530.0,GIADUNG TẤN PHÁT,Sunhouse,Nhà Cửa - Đời Sống,908.0,2,316599,316599,0
102488853,"Thùng Đựng Gạo Cao Cấp 5kg & 10kg - Thùng Đựng Gạo Nắp Đậy Thông Minh, Thiết Kế Hiện Đại & Đẹp Mắt, Chất Liệu ABS &PP An Toàn Chống Nước, Chống Ẩm Mốc, Mối Mọt - Hàng Nhập Khẩu",76589.0,TITANSTORE,ENCOVINA,Khác,583.0,1746,343500,215700,37
32328782,Phin Nhôm Cà Phê Tráng Men Đen Trung Nguyên  ,72479.0,Trung Nguyên Legend,Trung Nguyên,"Bình, ly uống cà phê và phụ kiện",1206.0,1949,69000,69000,0
185004372,Ly Thủy Tinh Phong Cách Bắc Âu Đế Xoay 170ml - Navivu Rock Glass,17480.0,Ghế Nam Việt,NAVIVU,"Ly, cốc & phụ kiện ly",212.0,111,38000,38000,0
72527573,"Hộp Đựng Giấy Vệ Sinh Cao Cấp OENON Dán Tường, Hộp Đựng Giấy Đa Năng Có Thêm Ngăn Để Đồ Tiện Lợi - OENON",72734.0,OENON,OENON,Kệ nhà tắm,788.0,1591,320000,169000,47
51368456,"Bộ 6 thìa muỗng inox 304 DandiHome 2020 cao cấp, sang trọng, tinh tế",16347.0,DandiHome Việt Nam,DandiHome,Nhà Cửa - Đời Sống,1009.0,1116,210000,160000,24
182732848,"Đầu bàn chải điện thay thế, bàn chải điện Oral-B người lớn và trẻ em",250543.0,Shop Konni Nguyễn Trãi,OEM,"Bàn chải, dụng cụ thông tắc, cọ rửa",225.0,252,75000,66500,11
54460849,Bộ chăn ga gối cotton LIDACO PL1 - Caro Nâu (SP000661) - TẶNG VỎ GỐI ÔM,43482.0,Lidaco Official Store,LIDACO,"Bộ ga, ra, drap",968.0,319,276000,251000,9
24184873,Ấm đun nước bằng inox 304 Smartcook 2.5L SM 3372,1.0,Tiki Trading,Elmich,Nhà Cửa - Đời Sống,1256.0,1022,375000,322000,14
195949375,"Đèn Bàn Học Đọc Sách, Đèn Bàn Làm Việc Sang Trọng, Đèn Ngủ Cao Cấp (Học Sinh, Sinh Viên, Văn Phòng) LED Chống Cận 03 Mức Độ Sáng, Cảm Ứng Tích Điện Pin 3200mAh - Hàng Chính Hãng - VinBuy",109746.0,VinBuy,VinBuy,Nhà Cửa - Đời Sống,133.0,2179,360000,185100,49
113674505,Khăn tắm cotton 50x100cm muses - màu ngẫu nhiên,73012.0,SiroShop,OEM,Khăn,536.0,249,85900,81605,5
95014508,Công tắc điều khiển từ xa bằng điện thoại Hunonic Lahu 4 kênh 500W/kênh + Hẹn giờ thông minh | Công nghệ 4.0,172818.0,codienshop,HUNONIC,Thiết bị điều khiển thông minh,605.0,168,370000,370000,0
135321378,"Thanh Chặn Khe Cửa 95cm Đa Năng,Chặn Đáy Khe Cửa, Ngăn Côn Trùng, Chắn Gió Mùa, Ngừa Bụi Bẩn, Giảm Ồn",2225.0,chuyên giấy dán tường aqa,OEM,Root,433.0,52,14999,14999,0
52574827,Ô (dù) tự động 2 chiều cao cấp DandiHome chống UV,16347.0,DandiHome Việt Nam,DandiHome,"Áo mưa, ô dù và phụ kiện đi mưa",994.0,4306,230000,193000,16
36781968,"Neem Cake (Bánh dầu Neem), Phân bón hữu cơ dưỡng mầm lá tốt nhất cho hoa hồng, hoa lan,Trị và phòng ngừa bệnh tuyến rễ như nấm rễ, sùng đất, cuốn chiếu, ốc sên, tuyến trùng",54962.0,Docneem Official,DocNeem,Nhà Cửa - Đời Sống,1174.0,686,119000,119000,0
66877902,"Đèn Ngủ Quả Cầu Mây Để Bàn SPEVI - Điều Chỉnh Độ Sáng, Làm Đèn Ngủ Trang Trí, Quà Sinh Nhật Cực Đáng Yêu, Đầu USB, Adapter USB Tiện Lợi, Đế Gỗ Xếp Sang Trọng, Bóng Đèn Led Vô Cùng Tiết Kiệm Điện - Hàng Chính Hãng",112244.0,Vimila Mart,SPEVI,Nhà Cửa - Đời Sống,842.0,895,234000,164000,30
2153187,Ổ Cắm Điện Tích Hợp Sạc USB Xiaomi Mi Power Strip - Hàng Chính Hàng,129537.0,Mi Hoàng Gia,Xiaomi,"Ổ cắm, ổn áp, biến áp",1698.0,571,290000,215700,26
86516579,Đá chà gót chân tẩy các lớp da khô sầy chai sạn giúp mềm mại và mịn màng hơn,146720.0,Trịnh Thị Hồng Vân,OEM,Khác,615.0,85,45000,45000,0
169455049,"Chậu sứ trồng cây kèm đĩa hứng nước, chậu trồng cây đẹp phù hợp trồng cây để bàn, cây văn phòng, cây phong thủy.",271325.0,Chậu Cây Đẹp,OEM,Root,297.0,241,27000,27000,0
56737810,Lô 4 Cuộn Túi Rác Tự Hủy Có Quai Tiện Dụng SOJI INOCHI Nhật Bản - Nhiều Màu - Nhiều Size - Đa dạng công năng sử dụng,8526.0,AZO MART,Inochi,Túi đựng rác,929.0,497,150000,72700,52
35206226,Cân điện tử cầm tay A060 40kg mini dạng treo nhỏ gọn tiện lợi móc sắt,131912.0,Shop Thịnh,OEM,Nhà Cửa - Đời Sống,1190.0,39,59000,59000,0
190300577,"Túi hút chân không đựng quần áo, chăn màn van chống thoát khí, tiết kiệm 70% không gian diện tích",213186.0,Tiên Home,OEM,Phụ kiện phòng ngủ khác,180.0,42,40000,29000,28
187843307,"Đèn Năng Lượng Mặt Trời Chống Lóa 100W 200W 300W, 4LED 200W 300W 500W",292365.0,ĐÈN NĂNG LƯỢNG TYS TAI YANG SHEN,TYS,Đèn ngoài trời,195.0,240,850000,577200,32
128969410,"Kệ Sách Để Bàn, Giá Sách Thiết Kế Hiện Đại Thương Hiệu IGA - GP157",48574.0,IGEA Nội Thất Thông Minh,IGA,"Tủ, kệ sách",452.0,1139,184000,176000,4
138910755,Kệ chén dĩa 2 tầng bằng sắt LocknLock LDR206BLK (510x300x230mm) - Màu Đen,38510.0,JoyMall LocknLock Chính Hãng,LocknLock,Kệ nhà bếp,420.0,5,572000,319000,44
